,star_rating,review_body
2344,5,Lake Country makes the best foam pads on the market! I have never had a problem with any of their products.
2345,5,Purchased this belt for my 2006 Mustang and was a perfect fit and stopped alot of under the hood noises
2346,5,"great product, would have been nice to come with a wiring diagram, but google helped me out with that. will buy more!"
2347,5,"I'd previously purchased a Slime COMP02 from Wallyworld for around $15. It was slow, loud, and I thought it was going to rattle apart. I figured if I was going to have a portable compressor, I wanted something I could rely on. I went in search for something better and was drawn to the positive review of the 85P. For $45-50, this is a great value. Out of the box, I noticed how much better built this compressor was. Hearing the tight buzz when turning it on confirmed that. I like the screw-on connector, and the built-in light is a nice feature. To be expected, the metal pump does get hot. Because of the amp draw, be sure the car is running while the compressor is on. Overall excellent product and I plan on purchasing a second for our other vehicle and one to give as a gift."
2348,4,Very happy with purchase! Came with all parts needed and easy to follow directions. Took me 3 hours to install (I am quite handy and mechanical). Everything works great. Turn signals are manual and lights could be bigger. A lot of bang for the buck tho.
2349,5,"After reading mixed reviews, I was a little skeptical about buying these instead of OEM replacements.  Gievn ANCO's reputation I decided to give them a shot; am I glad I did.<br /><br />I drive a 4x4 pickup, so the windshield is much less curved than on most cars. I was afraid there would be a section (middle) that would not be swept well from other reviews.  WRONG.  As long as the springs on your wiper arms are not stretched you will not have any problems.  Since I installed them just over a week  ago we have had light rain, heavy downpours, heavy / wet snowfall, and a couple of light snowfalls (a.k.a. early spring in New England).  These wipe better than any blades - replacement or OEM - I have ever had; even on my Mercedes'.  Ice also does not build up on them as heavily as on my OEM blades; a shot with the washers and a few seconds with the wipers on high and they are free of snow and ice.  I will now be buying these exclusively for all of my vehicles as long as they are available.<br /><br />Many people raise / leave their wiper arms up when snowfall is expected; realize this position stretches the springs and permanently weakens them as a result.  If you do this, in time you can expect that the wipers will not properly wipe the windshield.  It's not the blades that are the problem.<br /><br />UPDATE - 2/25/14 - it's been the \\""winter from h***\\"" - a snowstorm a week, give or take -  and I'm still loving these wipers.  Do not hesitate to buy them!!"
2350,5,My grandson is very happy with the Window Vent Shade's. They were easy to install and look fantastic. Thank you
2351,5,"There was a little job in running the wires  but not overall  too bad.<br /><br />The gauge works perfedt, It matches my gauges on the cowl strip."
2352,5,"Product looks nice, fits good, and seems durable.  I put these in an 01 honda civic.  The receipt is from an actual Honda Dealership as well so they are not a knock off."
2353,5,"This charger works great at keeping batteries  fully charged in  instances where they are not used for long periods of time, like a garden tractoer or motorcycle."
2354,1,"I bought this item several years ago and it's been more trouble than it's worth. Eats batteries like no other and then I eventually ran into the 'L' issue where replacing the LR44 batteries no longer worked. Go read 'Mr. Natural \\""Randy\\""' review on the hidden CR2032 battery. Junk."
2355,4,"It was fairly easy to install even for a novice like me. The only thing I would suggest for this unit is to have the flexibility/option of using an existing switches (original switches from the vehicle make i.e. Ford, Chevy etc). I installed mine using a direct power from the battery via a fuse box and added a kill switch to turn the power off (otherwise, the lighted switch would stay on all the time)."
2356,5,Exactly what I need for my car colour is a rich nice red as described...I have no complaints at all
2357,5,Works better than OEM units I have in other cars easy hook up review needs seven more words to be correct length so there you go
2358,5,"Service was fast, item was received as described with specific instrutions on how to program it. Programming was easy and worked! Great price for a new key fab, thank you!"
2359,3,Like most premium car care products that cost alot more this just does&#34;nt do that much better of a job than any of other less expensive brands.Save some money and just use another less expensive brand name and get the same results.
2360,4,this is a great filter value for all engines that have oil and air filter service maintenance performed at least every 4000 miles.
2361,5,I purchased these as a gift and the recipient absolutely loves them!  The fit is perfect and stays in place nicely!  The color is true to the picture posted.  It's a nice product.
2362,5,This is very sturdy and very handy. It looks like it will take a lot of use vs. other styles out there.
2363,5,I bought this kit not knowing too much about how I was going to install it.  It first it looked like it was going to dripping water as did not look tight. so I decided to pour water in the bump to test first before screwing it in.  No leaks!!  It was really easy to install.  Great buy!!
2364,4,i love mickey so its hard to disappoint me....they are  a little flimsy and thin...trying to flip up on driver mat...but worked it out...
2365,4,"This received a good rating from other Amazon buyers and I was not disappointed. Be sure though to check out the requirements for the passenger side, which are different in size for Honda Accords. This blade was for the passenger side of the windshield."
2366,5,i thought this item was a little pricey but after using the beadbuster i think it was well worth the money.it worked great on a trailer and and lawn mower tire.
2367,5,"If you're doing a boat over, this is the best compound.  It really brings it back and gets rid of all the oxidation."
2368,5,It saved me about $100 dollars over the local auto shops. Installs easily and fixed my problems. Definitely worth the money.
2369,5,"Very solid construction and ridiculously easy install.  It's fairly expensive, but looks much better than the faded plastic hood catch I had before."
2370,4,I bought this one month ago and from then the car perfomance improved. affordable product and they come packaged nicely. and they're easy to install.it took me about an hour to finish installing them in my 2004 ford expedition.
2371,3,"Have 4 cars I was hoping this would work on.<br />Worked well on 2006 VW Golf, and 2005 Ford BAII Fairmont (Aussie).<br />Didn't work on 2005 E53 Mini Cooper S, or 2003 E39 BMW 525D<br />Price is good though, and seems well built."
2372,5,"Excellent heavy leather.  You can smell the quality.  This is a well built product.  The concealed carry pockets with strap are a plus, but may not fit all handguns."
2373,3,"First of all, let me say that I found this to be the cheapest price for a bed cover that I could find, and since I just wanted something to hide the train horn I'm mounting in the bed of my Ram, this will do just fine. The price is great, but keep in mind, with this and everything, you get what you pay for.<br /><br />INSTALLATION: Before you install, I suggest you unroll the vinyl cover and lay it in the sun so it will heat up and make it easier to stretch. I didn't do this, and I paid dearly for it. I actually installed it in my unheated garage on a cool day. Other than that, installation is easy and takes about a half hour or so. The gasket material they provide to you is a bit bulky but it does do the trick.<br /><br />The 2 areas of great concerns, and the reason I subtracted 2 stars, are as follows: I notice while I'm driving over 70, the rear end of the cover pushes in behind the back support beam and causes minor flapping. I installed it as per the directions(14\\"" and 16\\"" inches from the front and rear of the bed), so I have to assume it's the quality of the vinyl that causes this. It's been going on for about 3 weeks now(since I installed it) and am fairly certain it's going to be the reason I replace it. The other concern is that the c-clamps used for installation are asinine. The hex bolts to tighten them are actually turned from the top, so it's impossible to do it while the cover is on. It'd make a lot more sense, and be a whole lot easier, if you can tighten them from the bottom. I would suggest using different c-clamps.<br /><br />All in all, if you want a cheap bed cover, that you can install yourself and install quickly, this is the way to go. If you're looking for seriously high quality, you're going to spend a lot more money."
2374,5,"THanks It was wasy as pie to program , and saves me alot time getting in and out of my car"
2375,5,Nothing to complain about here. My front emblem was weathered and I simply removed it and slapped this one on. No problem- looks new.
2376,5,I gave this to a good friend and neighbor who like to wash his car and wanted to give a good  product.
2377,3,"These worked, barely . I had to add a diode to my bike's brake light circuit to both keep the tail light portion of these bulbs going and keep the backfeed they produced into the brake light system from kicking the bike's brake light relay on . Also, the high side of the lighting wasn't nearly as bright for the brake lights as the incandescents they replaced ."
2378,5,"Owner of 04' GMC Canyon Crew Cab, Z71 SLE.  Two screws, remove and replace.  JFYI, I recommend to get the harness connector ACDelco PT1231 Female 4-Way Wire Connector with Leads.  If you the inspect harness carefully, you will see the that overtime, the harness product may cause the Resistor Assembly to fail or vise versa."
2379,4,"the manual appears to be a faithful reproduction of the original Owners Manual, It is great to be able to get an accurate owner's manual for a 20 year old vehicle.  Very satisfied."
2380,5,"After a visit to the dealer, and getting a quote for $800.... I decided to search around for other solutions. This was an option, and for the price, it was feasible. It took 25 minutes to install... Adios oil leak!<br /><br />The seller was also very open, and communicative, making the sale that much better"
2381,5,This product fits great in my daughter's 2011 GMC Terrain.  It is just like the picture shows.  It is great for spills or messy hauls.
2382,5,Great price and it installed in place of the OE bearing without issue.  It's been smooth and quit since installation - trouble free.
2383,3,"Rather poorly made, but if used carefully, it will work.  I used it to start a contactor for a 3 phase pump.  Wish I had bought some thing more robust.  Not bad for the price."
2384,4,"My ignition wore out on my trusty old '97 LE.  The car has 320k miles on it so it's probably about time for a new one.  This one went in without issue.  The only reason I knock it a star is that it is very notchy.  It's almost like the tolerances between the lock and the keys is really tight.  I could see this being the case since it's brand new and I've been running one that 16 years old.  I'm hoping that it smooths out after using it for a while.  As it stands, there's been a day or so where I couldn't just pull the key out after turning off the car, I had to make sure the key was perfectly aligned to the lock and then pull it out.  If the key was slightly angled, it jammed.  I do feel like it's getting better though.  We'll see how it goes."
2385,5,Own a Honda CRV and after I cut out the part for the console it fit perfectly.  Great to have in the back seat with children.
2386,4,"This little step stool is handy, versitile and sturdy.  My kids love it.  We bought it for our motor home, but I may have to get another one, as it hasn't made it out of the house yet!"
2387,4,"I received this product and installed it the same day. Now when the car is off or when I am driving and the light isn't activated to its fullest it continues to stay dim. Very bright when fully lit but they never fade completely off, even after a day they are still lit dimly before leaving. Its not a bad thing and people think it cool when they see them. I like them overall and they do look nice and bright so I would recommend them."
2388,5,"I bought this to replace the one I had. I thought I would replace the whole stem,rather than trying to find the right washer. I found this one on Amazon, at half the price of ACE. So I got it. It was the original stem.  SW"
2389,2,"I had a small chip (pencil rubber size) and a 1 inch small crack like chipping (marker line size), I put the solution as mentioned but didn't seem to fix it."
2390,5,"The Monster beanie arrived on time. Very nice colors black & green with the Monster symbol  as pattern. The fabric is lightweight and very comfortable. If you like beanies, this one is a keeper. Thanks again."
2391,3,"I bought it for the catalytic converter low efficiency. It did not work out - I was putting a little hope on this. At the end, I have to replace the catalyic converter which is very expensive.<br />It did clean the fuel system, the car ran quieter and smoother afterwards."
2392,5,"works great and no trouble installing, OEM parts.will buy again in the future.would recommend to anyone needing to replace timing belt, this has it all"
2393,5,"I bought this product for my 1999 Dodge Durango. It got here quickly, and worked just as I expected it to. I would definately recommend this product."
2394,5,thankfully i have not had to use it yet but glad to have it with me. its a nice small kit and and well put together.
2395,1,Weapon r did not keep these on the market long for a reason they did a poor job advertising this product and it shows why . Would of been great with so fine tuning but  very dissatisfying
2396,5,its great i love it  put it on my longboard and it stuck prety well it was a good buy
2397,4,"Based on all the other reviews (falling off), I didn't attempt to install them on the outside mirrors.  I put them on the inside door post.  The ability to adjust them makes this application work well."
2398,5,"It came in fast. I was very excited to get started with it, and it was very easy and fun to use on all the cars i tried it on"
2399,5,I bought a pair of these and only had to use one. I put the other one back for future use.
2400,4,"What I liked about these are they are made to fit many different cars because of the way there manufactured, they have an accordion effect that contours to the cars, Glad I ordered them and ps these were for my 5 door 2013 Subura Impreza, saved me a lot of money over the factory splash guards, they look exactly like the picture when there on the car, the accordion effect just hides. The engineer had a great idea in designing these."
2401,5,"great price great product, would recommend this product to anyone, quick  service and heaps cheaper than any retailers in my area"
2402,5,"great product, would buy again  A A A  A  a  aaaaaaaa  aaa aaaa aaa aaaa aaaa aaaa aaa aaa /"
2403,3,Not the greatest thing in the world but it does what I want it to (which is to see who is coming up behind me when I'm at work).
2404,5,I am a ladybug lover!!!:) I decided to do my car with ladybugs and I found and ordered this charm!:) when it came in I was VERY happy with it!:) it is adorable and fits perfect with the ladybug theme I'm doing!!:)
2405,5,i have a 2000 4.7L v8 tundra i replaced the paper filter with this k&n and i never thought you would be able to tell the difference but yes better mpg and you can actually hear your engine sucking more air if you listen great product 100% recommend this to anyone!
2406,5,Nice addition to my base Wrangler.  I highly recommend these for a nice protection to your entryway of any Jeep.
2407,5,"To protect iPod or iPhone from drops and to find iPod when it slips thru couch cushions, this Lanyard is worth the money.  It is such nice quality and looks great.  I trust it to hold my iPod.  I can now trust my child with my iPod.  I have had a couple cheaper lanyards that broke and could have been disastrous to my iPod.  We spend so much on our iPod cases, so spending on a good lanyard to avoid the drops is worth it.  No more drown iPods or iPhones in the toilet!!"
2408,5,This is a quality product that works very well and for the price that includes a case it's excellent. Recommended...
2409,3,You have to buy bolts to install this and you have to be careful when tightening down as it is not a perfaect match for the original and will break easily.
2410,5,I bought these for my husband for Christmas and he loves them.  They are definitely protecting the floor of his truck from all the snow and mud.  He just rinses them off and he&#34;s good to go.
2411,5,"I haven't been able to use it in the car yet because the weather hasn't been nice enough outside, but for the little bit of use that I did on the carpet inside the house it worked great.  It has great suction power.  It's also small enough to not be a hassle to have to lug around in the car.  I can put it inside my 'carry all' in the trunk of my car and not have to take up to much room and it's light enough to carry.  I can't wait to use it in the car this Spring."
2412,5,"I have a 2004 HD Electra Glide Ultra-Classic (FLHTCUI) that had the stock 'air-ride' rear shocks which required constant attention when riding two-up with luggage.  The stock air-ride from Harley is fine when riding one up but when you really load up I found it to lose air constantly on trips and grew tired of dragging out the hand pump to maintain proper PSI to avoid bottoming out on rough roads or railroad crossings.<br /><br />I emailed a guy over at Progressive and asked a few questions and settled on the 444-4020 13\\"" shocks.  These shocks are adjustable by hand cranking the top of the shock.  I'd be nice if they'd etch a marking on the collar of the shock to help you keep track of full turns but one can do that easily with a spot of paint.  Keep in mind when adjusting these shocks on a bagger, you'll need to remove the bags to change the stiffness of the shocks. The first thing I did after installing these shocks was leave them at full rigidity and left my side bags at home.  As anticipated, the ride was too stiff so I'd get a feel of it going over bumps and pits, pull over and give them one full turn and try it again.  Then I picked up the lady and we gave it a nice test hitting driveway aprons at a good clip and NO BOTTOMING OUT.  Nice.  I think it takes a little time to find the sweet spot, but it sure is worth it so far.  Honestly I think I'm still riding them a little on the stiff side but the bike handles so much better and will only improve when I locate that perfect spot for riding one-up.<br /><br />Also these are a breeze to install.  If you swap out the air-ride shocks, don't forget to keep your old shocks upright so you can sell or store them, otherwise they'll leak and become useless.  There are other manufacturers of shocks out there but when it comes to price versus performance, I decided on these and I can't see being any more pleased.<br /><br />Like Frank said over at Progressive; it may be a little extra work moving your bags to adjust these shocks, but isn't a great ride worth a little effort?  Yes it is Frank. SOLD.shocks, but isn't a great ride worth a little effort?  Yes it is Frank. SOLD."
2413,4,"I installed this spoiler on my 2010 3.8 GT, which did not come with a spoiler originally. Let me start by saying that, overall, I really like this spoiler. This spoiler is installed using 3M tape and 2 screws. Like any other spoiler install, you use the included alignment strips to transfer the location of the mounting holes on the spoiler to the trunk lid and then drill two holes in the top of the lid where you will mount the spoiler. However, potential buyers should be advised that the location of these holes do NOT correspond to any of the holes that already exist on the under-side of the trunk lid. This means that in order to secure this spoiler (probably not advisable to rely solely on the 3M tape) you will need to drill holes on the bottom side of the trunk lid big enough to get the screw and washer through. This wouldn't be so bad either, except the holes will also not be covered up by the felt interior panel due to their locations. That being said, I bought this spoiler pre-painted from a different seller and I think it looks great, and was well worth the extra effort."
2414,5,works great i have had it on my truck now for a couple months none of the leds have gone out and is very bright.
2415,5,Love the slush mats! Looks amazing in my Grand cherokee and its really helpful when you have little kids like me or live in a rainy place.
2416,4,"Product is identical to photo, very easy to install however I don't imagine it will last long and will peal off but for the price it's definitely worth it."
2417,5,"This is a basic brake controller with no fancy features. It works on a mechanical principle rather than electronic sensors, and is based on a design made since these things were invented. This means it works reliably and predictably, all the time. No surprises, and no glitches. It's trustworthy.<br /><br />Which is what you want when you're trying to slow 7000 lbs of metal stuck to your back bumper."
2418,5,"I had thought this was a solid white sticker (like, not see-through), and intended to put it on a notebook with a label I wanted to cover up. When I got the sticker, I saw that it is see-through, so I put it on my car window instead. Either way, it is super cute and I love it."
2419,5,"product good as expected, shipped timely, I would recommend it, now my byke have a great look and drive great"
2420,5,"Bought Rhino Ramps 11909 from Autozone for about the same price as Amazon. I'm using them on a slick concrete floor with a Lexus ES350 (front wheel drive). The Rhinos are a big improvement over my old metal ones. They are wider (almost 11.5\\""), they don't slip, and they don't slide. They seem very sturdy - I left the car on them overnight and this morning everything looks fine.<br /><br />I was going to make some wooden ramps but they would have been much heavier and about three times the price so I bought the Rhinos and I'm glad I did.<br /><br />I would recommend these ramps and I would buy them again. Very happy with them.<br /><br />Some other reviewers have mentioned using rubber mats under them with rear wheel-drive cars on slick concrete and I will probably do that with my other car (rear wheel drive)."
2421,4,"These switches work well, and are pretty durable feeling. They are nothing special, but I would recommend for a basic switch with an LED indicator."
2422,1,i feel bad<br /><br />i dont like the item<br />the angle eyes melt i dont know why<br />please conact me !!<br />i want to replace the item
2423,5,"I own a classic Lincoln Mark VII and needed this switch to replace the original headlight switch, which developed an overheating issue and began to fail. This switch is for some reason listed as a Volvo switch, but it's not. I even Googled Volvo interiors to confirm this, even though I already knew this was for a Lincoln and not a Volvo (this item is so OEM it actually has the Ford logo and original product number cast right into the metal of the heatsink.)The important point with this switch is it was the only one with the heat sink. The reason the original switches failed is they overheated, yet every single replacement switch available new-in-box today is made without a heat sink except for this one. Standard Motor Products even makes the switch without the heat sink now, and that version is the only one available in stock anymore. I was very lucky to find THIS item, because it was the last one. While I can find many replacement Lincoln Mark VII headlight switches online from a variety of manufacturers, this is the only one that has the necessary heatsink, and this one was the last one. Interestingly, the merchant here is Auto Barn, and their warehouse is driving distance from my home. I went there in person and for some reason they were not able to procure this item for me, saying the only way I could order it was via the Amazon storefront. While I don't understand why this was so, I am happy to report the item shipped fast and arrived a day or two earlier than expected. I have been driving around with this switch in my car for over a month now and have observed no problems at all. I am very fortunate to have found this when I did, and very happy with my purchase and the overall experience."
2424,5,"Completely satisfied with the look and fit of this plate. Easy to follow install, plate bends with ease. Wish there was an option to have four visible lock bolts color matching black, but nothing a little duplicolor black cant fix. Worth every penny, would absolutely buy from seller again!"
2425,5,"Wasn't sure what to expect.  Material is like fire hose.  Thick, but plyable.  Kind of a PIA to install, however once I got the hang of it they went on easily.  Should last a long time."
