,star_rating,review_body
973,4,"Description didn't specify, but these are 18.5&#34; wide x 24&#34; high. Looks good so far, have not mounted them yet. They're are as good a quality HD mud flap as is available for my lifted 2500 HD 4x4. Making a removable mount so that rocks and stones will be blocked from hitting my boat. Nice cheap price too."
974,5,"a tight fit, and works like it should, repairs the broken EOM fob."
975,5,Exactly what I needed for my car. The seller was extremely helpful. I'm very satisfied with the purchase.
976,3,I use these when airsofting with my nephews or occasionally on a half helmet ride around town.  they fit perfectly over my prescription lenses.<br /><br />They really keep the wind out and provide 360 protection from whatever comes your way.<br /><br />They do tend to fog up with ease
977,5,Just what I wanted
978,4,Love the bling. But the little cover button you put on to cover the screw.  Don't stay in they come out very easy.
979,5,"As a shade tree mechanic, this thing is smarter than I am.  Already very helpful, and a lot more to learn."
980,5,I love it exactly what you need for a decent lift
981,5,great
982,5,Very cute & sticks well to the back of my car. I really like it. It also arrived very quickly.
983,5,We love it and the service was great!
984,4,"The product is very much as described. It comes with the shift knob, 3 inserts for different sized shifters, a screw to keep the insert attached to the knob and a visual instruction on how everything goes together. For the product I received, the knob was more purple than green. I am sure each knob is a little different and every customers experience could vary."
985,5,It's coolant. Nice that you don't have to dilute it.
986,5,"works great, was able to figure out what was wrong and replace the part myself, saving a lot of money."
987,4,"Sometimes a bit wobbly so as to lose connection, but nice for traveling to be able to run the GPS and also charge a cell phone at the same time."
988,5,great fit
989,5,"Dun product, paw shipment 'eq puS 'e'. yIvoq SuvwI' provider tlhIngan wo'."
990,5,"Battery was used in a Back-UPS ES BE350 that uses the smaller 1245 12V & F2 terminals, perfect fit !"
991,5,Very nice!
992,5,"Cute, I Love it."
993,5,Excellent fully recommend them
994,1,"I was shipped a kit with an incorrect water pump. Certainly not for any Honda engine I've ever worked on. The rest of the kit was of questionable quality. Nothing was made in Japan or the U.S. I wouldn't feel confident running the belt on an interference engine.<br /><br />Vendor did issue a return label, but it was very inconvenient to be shipped the wrong parts and ruin a weekend install. Happy accident, I guess, since this kit isn't up to snuff. Ended up going with the Gates kit; much better quality, U.S. made belt, bearings and water pump."
995,1,"Even though the box said it fit a 2007 Nissan Xterra, the anchor holes did not match."
996,5,light is very bright looks good and works just as it should and it was delivered right on time I will be buying another
997,5,Perfect replacement for my 69 Chevy truck.
998,5,"Perfect replacement, Japanese made!"
999,5,"Impressed how well it fit, item description was perfect."
1000,5,"I've had a good experience using this on the interior surfaces of my 7-yr-old Highlander. It goes on easily, with the consistency of lotion, and doesn't take much work to wipe on. It is in fact dry to the touch fairly quickly. I'd say the results were good, though not dramatic - perhaps my car surfaces just didn't start out worn enough for dramatic restoration. The smell isn't overwhelming or unpleasant (reminds me of leather, or maybe I'm thinking of leather cleaner) and didn't linger too long on hands or in the vehicle. The UV protection is nice, though I can't really verify its effectiveness anymore than I'm certain what protection I get from my own daily application of sunscreen. But if you want a bit of polish after detailing the inside of a vehicle, then I'm certainly pleased with those results."
1001,5,"I want to thank Diode Dynamics for these great products, this 2013 Dodge Dart is my first ever new car and these pieces really set off my interior . With the black interior and the red color of the car, these pieces set it off perfectly. And the aluminum door pockets and red LED lights in the interior, I cant get over how great it looks. Thank you so much.  George Call"
1002,4,Good quality and we are vey pleased
1003,5,"I ordered this kit to keep my wife's bottom warm here during the brutal winters of the upper Midwest.  The kit was relatively easy to install in a 2009 Prius and it works great.<br /><br />********IMPORTANT TIP********<br />I gave this kit a five star review BUT ONLY WITH THIS WARNING....the goofy little connector they provide to tap into the fuse block is pretty much useless.  I'm not sure if it is because a Prius uses the low-profile type fuses but after modifying the connector so it would fit it worked its way loose in a matter of a couple weeks.  The old saying &#34;Happy wife, happy life&#34; is true and a wife with a cold bottom is not a happy one.<br /><br />Here is how you can rescue the situation:<br />http://www.amazon.com/Littelfuse-FHA200BP-ATO-Add-A-Circuit-Kit/dp/B0002BGELQ/ref=sr_1_1?ie=UTF8&qid=1421074619&sr=8-1&keywords=add+a+circuit<br /><br />This is little adapter (or something similar to it) lets you add a circuit to a fuse block with absolutely no muss and no fuss. The whole install would have been about half as easy if I had one of these ahead of time.  Get it and get this kit, too!"
1004,5,For the price these are amazing
1005,5,"Outstanding set of affordable heavy duty jumper cables for use on car, pickup, etc.  I am very pleased with the length and the gauge on these cables.  And for the price they are half or less then what I would pay for in auto parts stores.  The length is very handy to have and makes it so much easier to hook up from one auto battery to the other without worrying which direction you are parked or how close you have to get or on what side.  The cable ends, that clip on to the battery posts are very heavy duty and solid, easy to open and close and they clamp down really tight and hold exact to deliver a good jump charge.  Also come with carry case that is nice and handy to have.  I would recommend these to anyone they work really good."
1006,5,Installed easy and works great on my Sonoma. It seems like it's well built.
1007,5,It is am awesome product
1008,5,This product is exactly like ones you buy at GM. The best part is it was only a fraction of the cost. Very happy with my purchase.
1009,5,This fit my 71' aircooled VW just fine.
1010,5,Amazing tool. Top quality
1011,1,Not enough options for mirror mount. No mont to fit higher end auto's etc. Ie mercedes benz
1012,5,works great. thanks.
1013,2,"The picture shows u bolts,washers,lock nuts for mounting with the Hopkins 20019 .The unit I received had no u bolts ,washers or lock nuts"
1014,5,"These towels appear to be of excellent quality. I was particularly impressed that they included an instruction sheet that provided care instructions for microfiber towels. It contained information of which I was unaware. Thank you, BooYah."
1015,4,"Ditto - 6&#34; long, not five, 3&#34; in diameter, high polish aluminum tube that comes in a cheezy drawstring bag -"
1016,5,Excellent goggles!! Delivered fast! Very satisfied!
1017,4,Haven't used it yet but it's what I was looking for.
1018,4,Works and looks great on my 2014 Jeep Cherokee...  It does have a little wind noise at speeds over 75 mph.
1019,3,"its alright, but ,  I thought it would be a little more sturdy.  still alright tho."
1020,5,Good
1021,5,Exactly what I was looking for. The quality was actually better than I had expected for what I paid.
1022,4,"Made of plastic, but it seems durable.  I just hope that the silver stays on in the weather."
1023,5,Great! strong and well made good design although is a bit heavy if you plan to take it on and off often... After the first 1800 miles on our trip is holding really well I would recommend this rack if you want something strong and well made!! Love it !
1024,5,fabulous
1025,5,Great stocking stuffers!
1026,2,its to small
1027,5,work when I got it shipping was here literally right away great purchase definitely would do it again
1028,5,Great prices and prompt delivery!
1029,5,"Fast shipping, quality product."
1030,4,There is a tutorial video on YouTube. Done it within an hour.
1031,5,Perfect gift for anyone
1032,5,Perfect for the S 550. Good value for the dollar  :-)
1033,5,"Fit our 2014 crv perfectly and works exellent! Great value, great price! Same item at the dealer was 200+ dollars, saved a lot of money going with this one!"
1034,5,"Great, but it is $5.79 at AutoZone... just see their website."
1035,1,You can buy a cheaper set for like 45 bucks and there better than these for 70 dollars
1036,5,strong and durable.
1037,5,Excellent !!!!
1038,5,"Excellent. Buy Hengst it is a 1-to-1 fit. Good buy, good price & delivery."
1039,4,It fits well & being leather it keeps me warm.
1040,4,Good fit but there was no hardware
1041,5,Great value
1042,5,If you have a car that has a brake dust problem this is the solution.  Just clean the wheels very good then spray a light coat.  For best results let cure for an hour and repeat.  I always let the final coat bond over night.  When it comes time to wash you can either use a quick detailer on just the wheels or just spray the wheels and the dust will wash off with the water.
1043,3,second time i got this for my mother… last one got hot and melted a bit
1044,5,Noticeably brighter than the stock incandescents and a pure white color. They look great.
1045,2,"We were really disappointed in what arrived. The floor mats are lighter weight than we hoped for and did not have the depth we needed to keep dirt, stones, and water from getting underneath the mats. The bag of retention clips was torn open, so this product came &#34;slightly used.&#34; Apparently someone else didn't like these either. We haven't decided if we're keeping them or not."
1046,4,"A little thinner than I expected for an all weather sticker, but my son loved it."
1047,5,"Nice 3rd light cover plate. I have a 2001 Toyota Tacoma 4x4 and the 2001 3rd brake light is very difficult to take off..it's not like the later models where you can just take the 2 screws off and remove the complete light..To do that you actually have to remove the inside of the cab up top. there is bolts on the 2001 SO, the cover worked well!!! You can still see some of the side of the original light but I liked the way it made that look on my truck..."
1048,5,Great deal on quality wipers.
1049,5,Works as expected.
1050,4,"Well Made, but I should have bought an adapter to fit 1/2 &#34; A/N fittings or fine NPT Threads--(my mistake)"
1051,1,"I bought 4 of these last winter for replacements for my Polaris snowmobile lights. I used it for probably a total of 10 or 20 hours last year and maybe 2 hours this year and then it died. Luckily, I had a couple extras still. I will update if the next one lasts only this long. I'd love to return this one for a refund, but of course its over 30 days from an Amazon perspective and not sure if it's worth the warranty claim for a $8 bulb. Lets hope it was a fluke and the next one lasts as long as it should"
1052,5,The carrying bag could be bigger. But I like it.
1053,5,Everything works great easy install.
1054,5,These are great! I put on on my hard hat and all the guys at work leave me alone now!
1055,5,Works great
1056,5,Product just as described. Would purchase from this vendor again.
1057,3,It's a bit snug but should wear into place nice. Add plexy-glass and now it's like a full door. I'm happy with it.
1058,5,"This sensor, while designed for a BMW, was successfully installed in my 1986 Porsche Carrera and works just as expected."
1059,5,"Perfect fit, simple installation."
1060,3,"Pivot hole on the passenger side mirror arm was drilled wrong, had to drill a hole 180 deg. from the hole that was in the arm"
1061,5,Excellent
1062,5,Top Quality.  Delivered on time.  Exactly as advertised.
1063,4,Not as described for adjusting low beam headlight. #2 Phillips is what you should use.
1064,5,Works great no problems
1065,2,"The fitting is nice.... but it's the wrong one for the part number.  This is supposed to be a 6 an male to 12 an male straight cut o-ring.  I received a 1-1/16&#34; straight cut o-ring to 6 an.  The part number is wrong, but the description is right.  No big deal.  I'll return and hopefully get the right fitting.  I'll post back with my experience.<br /><br />On the plus side, I did order another fitting which was the right one.<br /><br />from Fragola catalog:<br /><br />AN Size: -6, SAE (O-ring size):  11/16-12 (12), Part number: 495114BL"
1066,5,"Works great, and fits perfectly in my 2002 Kia Rio."
1067,3,Not quite the right fit but it works.
1068,5,very reliable!
1069,5,"Excellent product, excellent seller. Fit my car perfectly. Thanks."
1070,4,Price was good...very plain black cover... no frills but does the trick...came home and my wife had already took the old one off and installed this herself...probably better than I would have...I would buy this again! By the way we installed this on our 2004 Sport model Rav4...
1071,5,OK!
1072,5,Great bulbs !!! Easy install
1073,5,Great
1074,5,Perfect digital fit liners for the Honda Odyssey.  Doesn't get any better.
1075,2,very hard to make fit
1076,5,Great cover
1077,5,"My first purchase had a faulty part, and I ended up just buying a new bulb to avoid the hassle of the return process. Kensun had contacted me and I just ignored it as I already decided to fork out the extra money to get it installed. Well, that was like a year or so ago, and they recontacted me to see what they could do to make things right again, because I wasn't thrilled that they couldn't just send me a replacement bulb so I was not a completely satisfied customer. Having never had a seller go so far out of their way to satisfy their customers, I must say Kensun is the best. Most would have just let it go after so long, but they were determined to maintain their reputation for customer service.<br />So as for this product, I did love the improvement the lights made, but at the time I drove an old truck with dulled headlamps so I didn't get to experience the full clarity of the light, but even so, I saw a pleasant improvement above any halogen bulb. Took around a minute to warm up, I found properly mounting and wiring to be kinda of a challenge but eventually I got it and had no problems. I will say if you are tempted to test the bulb prior to mounting the ballasts, don't. Have them properly mounted to the chassis for grounding before applying any power. I had a 4th of July moment in my driveway when I did that. As an electrical engineer I knew I should have, but I let them float and when it touched the chassis it sparked up in my face and blew a fuse. Patience is not my strong suit. Anyways, these were definitely an upgrade over any halogen bulb out there, and made an improvement even with my old headlamp assemblies all scuffed up."
1078,5,Very good
1079,5,Removed all the fine scratches and swirl marks and gave a excellent finish
1080,5,Perfect.
1081,5,I found VW Golf R rubber floor mats at Fowlers VW! Good pricing for the hard to find product. Thank you!
1082,5,"Although I haven't used it thus far, it will be put into use for the next camping season. It appears to be well constructed of a heavy gauge plastic and the wheels appear substantial enough for hauling short distances.  All of the fittings were included and hookup is simple enough.  I'm sure it will perform, as advertised, for its intended use."
1083,5,Thanks
1084,5,"On time correct product, happy over all"
1085,4,Easily installed looks great.
1086,5,thumbs up
1087,5,"Great filter and a perfect 1:1 oem replacement for a 94 Geo Metro. I repair metros as a hobby. I recommend relocating the fuel filter to under the hood and buying a cheaper wix inline filter. If that is beyond the scope of your abilities, this works great on a stock system."
1088,4,"Works just like it's supposed to, the only gripe I have about it is the rubber cover slides off easily."
1089,5,Great
1090,5,Great
1091,2,Could never get it programmed.
1092,5,"great product, excellent quality"
1093,4,Fun
1094,5,this is a life saver if you want to keep batteries at the proper level this is it
1095,5,Heavy duty - excellent quality
1096,5,keeps all the yuppies away from my race car
1097,5,Exactly as described
1098,5,"Super simple to install.  Superior quality.  Also, no regrets going with the 25' cord model which allows me to charge my car whether I back in or not, or if I park on the opposite side of my two car garage.  Long enough to also snake under the garage door to charge vistors' vehicles in the driveway!<br /><br />***NOTE*** Ignore the 14-50R pigtail & receptacle that appears in the &#34;Frequently Bought Together...&#34; section.  This is a 30-amp unit and IS NOT ideal to be on a 50amp circuit which is what all the electricians was quoting to install based on the connector cord & receptacle I had on-hand..  A 3-conductor 14-30R pigtail with 14-30R receptacle is what you will need."
1099,5,use this everyday. make my life bettrer
1100,5,Perfect fit
1101,5,Bought two orders . Nice solid tool. Hope to never use it but have piece of mind when I travel now!
1102,4,"This was exactly what I was looking for for my boyfriend (probably the biggest HIMYM fan ever). The only reason this did not get 5 stars is because there was slight chipping on the blue paint but no big deal, I am sure it is going to get worse anyway."
1103,5,exactly the look I wanted.  key socket fits nicely into the tight holes in the wheel.
1104,1,Don't do it.<br /><br />I bought the K&N engine air filter for my 2013 MDX... mileage went from 17.5 to 15... ran 3 tanks through.  Went and got an OEM and it went back to 17.5.
1105,3,"The first time I purchased this tape was in July 2014. The second time I purchased it was in October 2014. I was pleased both times. The tape was very heavy, thick, had a neat tear and excellent coverage over the black surface I needed it for.<br /><br />The third time I purchased was in November 2014, and boy has it changed. Now it's very thin and no longer cover the black surface I used to use it for, as the black now shows through the tape, and, it tears ragged.<br /><br /> All three times was purchased by Amazon.<br /><br />Could it be that the manufacturer was getting so much business that out of greed they change the texture of the product by making it thinner and cheaper to produce more tape, save more money, yet make more money in the long run?<br /><br />In any case, it no longer serves the purpose I need it for. Guess I'll be searching for a different manufacturer."
1106,5,"Perfect, this is exactly as pictured."
1107,5,"There are thicker and softer ones but these serve their purpose and its a great value for the price. I use them everywhere for cleaning - bathrooms, kitchen, dusting, kids room."
1108,5,As described; fast delivery and easy to install. The mats fit very well and keep all of the dirt/ snow and slush off of all of the carpeted areas. You need to remove the factory carpeted mats before you install the liners. Happy!
1109,5,"It took me months to decide how to add DRLs to my Nissan LEAF, since Nissan doesn't offer them in the US.  I originally had 2 sets of those cheap China LED strips ready to go in, but now I'm glad I changed my mind (there's just no comparison).<br /><br />This design also doesn't show any individual LED bulbs, just a light bar, which makes you stand out from the DRL aftermarket crowd.  If you put them in the right location, it would even look OEM.  Color temperature wise, the bulbs seem to match my OEM LED headlights (which are around 5000 K).<br /><br />The entire assembly has a very high quality feel, with a painted aluminum housing, glass lenses and quality wiring.  The lights are much brighter than those Chinese LED strips, plus the brackets do a great job securing the lights.<br /><br />*** Installation ***<br /><br />Installation took me a long time for several reasons.  The bracket is recessed, so the front of the bracket doesn't line up with the front of the lens.  This makes it extremely difficult to guess where to mount the bracket, especially when dealing with a rounded bumper.  I also decided to use screws instead of tape, as I deal with a lot of snow & ice.<br /><br />Also be aware that the lights aren't removable once you install them in the bracket (DON'T test fit them), so you only got 1 shot to get this right.  I wish some sort of template was included, as it could have saved me a huge amount of time & stress.<br /><br />The holes in the brackets make it also impossible to use a standard screwdriver bit.  The only bit I could make work was the &#34;DEWALT IMPACT READY FlexTorq Bit&#34;, combined with a DEWALT Right Angle Adapter, because I was dealing with such a low-profile bumper area, my regular 90&#34; adapters couldn't even fit.<br /><br />I also had to slightly angle them, so they would follow the contour of the bumper.  I was concerned that this would make them less visible, but it looks like the beam angle is wide enough to compensate for this.<br /><br />*** Wiring ***<br /><br />The 3M wiretap that came with the kit did not work for me (in fact, I had to recover it, and use Liquid Tape to repair the wire).  I ended up using T-taps which can be disconnected, allowing me to remove these lights without worrying about wire damage.<br /><br />The lights are designed to be driven by the included controller (do not hook these lights up directly to the 12V battery!), so you need to make sure you have space to mount this unit somewhere within reach of the battery and fuse box.<br /><br />These lights are also advertised to be compatible with electric vehicles, which they obviously are (this was a real problem with the DayLight 8 & DayLight 4 lights), but you do have to tap the headlight wire as well, since it wouldn't work by just measuring the 12V battery load.<br /><br />*** Performance ***<br /><br />While these lights are very bright, they can't be a replacement for headlights (obviously) and fog lights.<br /><br />I also appreciate how the lights dim when you turn your headlights on, as they are very bright at night.<br /><br />The lights stay on for a short amount of time after your vehicle has been turned off, which is a nice feature, but I wish the timer was adjustable.<br /><br />Note to Nissan LEAF owners: charging your vehicle, turning on HVAC remotely, and some other scenarios, can trigger these lights to come on.  I like it for various reasons, but you might not.  I guess it's detecting major fluctuations in the 12V battery, enough to trigger the controller.<br /><br />*** Conclusion ***<br />Would I buy these lights again?  Probably.  I haven't found any other lights which look this nice at this price level.  These can be difficult to find (they are imported), and pricing seems to have gone up, making purchasing these a difficult decision.<br /><br />I really like the 'bar' look, as the individual bulb look is just too cheesy IMO.  I wish the lights were just a little bigger<br /><br />I purchased mine via Prime ($219) from Chok Holdings back in August 2014, so it was easy to return them if something did go wrong, but it looks like this is no longer an option.<br /><br />Pros:<br />* They look fantastic.<br />* High quality housing, brackets and wiring.<br />* Compatible with electric vehicles.<br />* Dim when headlights are in use.<br />* Stay on for a short amount of time after turning off vehicle (this might be a con for some people).<br />* Low power consumption.<br /><br />Cons:<br />* Price.<br />* Can't be removed from brackets without damaging bumper (if using screws to mount) and the product.<br />* No templates included.<br />* Bracket design could be improved."
1110,1,Rusted within the first week on the car.  Terrible product
1111,4,"While a bit costly I've seen about a 1-2 mpg improvement while highway cruising with my 2014 Subaru BRZ.<br /><br />I'm only giving this four stars because I have not run virgin oil analysis (VOA) and used oil analysis (UOA) and therefore do not have tested evidence to rate higher.<br /><br />This oil was well recommended on Subaru BRZ / Scion FR-S / Toyota GT-86 forums.<br /><br />Also, I like to give the best to my engines, and considering the breakdown seen between VOA and UOA on some leading brand oils in the FA20 while this one holds up extremely well in other people's tests, I would say it is well worth the additional cost to protect your engine."
1112,1,Worked okay. ..one time.
1113,5,Very nice
1114,5,great product!
1115,5,Good quality
1116,5,delivered fast and the fit was great!
1117,4,A stud is a stud
1118,5,No more squeaking noise!  Minimum brake dust as well!  Got the brakes for all 3 of my cars (different fitting) and way cheaper and better than local shops.
1119,5,Very bright and nice!
1120,5,"Not as much space as I expected, but it fills up the space under the seat.  Overall, nice product."
1121,5,Works great!
1122,5,I work on it all from D11 dozers to f150s. I use these all the time. Unbelievable value and quality. The size range is awesome and the fact they didn't skip any sizes like all the other manufacturers are doing will insure me buying alot more gp products. I grab all the new guys and make sure they know about this set and brand.
1123,4,All Ford parts and labels
1124,5,COMPACKED AND EASY TO USE
1125,5,Well Pleased
1126,5,worked perfectly.
