,star_rating,review_body
0,4,Excellent look and feel. Installation was easy my only small dislike was the exposed back portion of the rear seat cover.
1,5,Just what I needed for my cars!
2,5,Great value for the money! Product came new and was what described. I took parts to mechanic to replace and saved 500 dollars with parts and labor from what I was originally quoted.
3,4,It's cute
4,5,Perfect fit.
5,5,Shipping was fast. Few days and it was at my doorstep.<br /><br />The product was easy to install. About 5 minutes tops. Would recommend to anyone. Thanks guys.
6,5,"Best gadget ever! Hope I never have to use it, but if I do, I have one! It has a seat belt cutter, It helps to break out the car window. Great add on for you car emergency kit!"
7,5,Great
8,4,"I loved this with all of my heart and soul. I always felt like a #BOSS when people would get in my car and see my phone floating in the air. It matched my interior even if I didn't have my phone on it. I could not sing ENOUGH praises about this mount...<br /><br />... Until I took my case off and saw the back of my phone was scratched. You have the option to stick the magnet onto your phone, it's case, or just leave it between the two. For aesthetic purposes I decided on the last. Apparently that's the worst decision, because now my phone has scratches on the back. It's nothing too serious, but it bothers me enough where I feel the need to keep a case on 1000% of the time now. No more naked iPhone joy for me.<br /><br />So my suggestion would be to purchase a back screen protector (they sell those, right?) and hopefully that'll save your phone!"
9,5,and still bright as the brand name bulbs
10,5,GREAT FOR ALL ENGINES TO PROTECT THE METAL PARTS
11,5,Literally indistinguishable from the OEM part.
12,3,Only used it once sofar. Seems chincy. Not sumthing i would purchase to use alot
13,5,"Great Brakes! Great package deal! Lotsa bang for the buck. These seem to be of a much higher quality than the price would suggest. They arrived at my door in around 2 or 3 days, and were on the truck the same day. And the shipping was free as well!. Months later they are braking as smooth as day one.. The drilled/slotted rotors are really nicely machined, and seem to be of a high quality metallurgy too.. They never seem to be too oxidized after sitting for a while... I think they'll last a lot longer than the way more expensive ones I usually buy at my local parts stores.. Highly recommended!"
14,5,Great to use on swangers....
15,5,water tast real good
16,5,Perfect for my wife's CRV which we use for diving and the dogs
17,5,Everything I thought it would be !  Great price and right on time .
18,5,Great product.  Took a couple of trys to sync but it was easy and has good range.
19,3,"it really works only for a week, after that it was blurry again, basically you get what you pay for.. :("
20,3,"Shoei only warrants their helmets for 5 years from date of sale or 7 years from date of manufacture, whichever comes first. The helmet I got was manufactured in November of 2012, so clearly these are OLD STOCK which isn't indicated anywhere in the item description.  I have a call into them to see if they have one manufactured within the last 60 months, but I doubt it."
21,5,"As descibed, good quality, and arrived on time."
22,5,excellent!
23,5,Good
24,5,I got too admit i was a bit nervous about ordering this muffler for a low price but i was surprized in the quality of this muffler it came in the mail pretty fast  nd in good condition ..i would def buy another one if i had too great product.
25,5,favorite! keep it on me everyday. I feel much safer at college
26,3,"We like the concept and the price, and it works but sometimes the image freezes for a second.  if you are very close to your target when this happens, you could hit it."
27,5,"Installed on a 2007 KLR 650. Easy install, though i did have to shave my throttle tube just a hair to get the right grip to slide on.  Also had to trim the ends of the grips to get them to work with my bark busters, but that only took a minute to do.  Fired them up and they get warm pretty quickly. The only downside was finding a good spot for all the extra wiring, but I tucked it under the tank, and the install looks clean and functions well."
28,5,Perfect replacement & easy to program.  Instructions included with purchase.  Easy to follow.
29,5,WORKS GREAT
30,5,"Back to original ride after 300,000 miles"
31,3,Bulbs give out the perfect brightness and are bright white.  Unfortunately I am getting a bulb out warning no my ram 1500.  Philips needs to make a canbus version of these.
32,5,Nice to find one that screws on instead of using sticky tape. Fits and looks great. Great product.
33,4,Look good - Easy install. Not as noticeable as I thought they would be.
34,1,"Returned the first one for being faulty. Got the same results with the replacment. Checked the product to make sure it was for my car and engine, it was. Stated it worked for 1999-2000 Jettas 2.0 but clearly it does not. Or, dare I say, the extremely low priced part was just junk to begin with. My conclusion came as I was driving and the car lost all power, was able to get it started but would not stay running. Pulled the maf harness from the sensor and voila! The car started. Actually ran better than it ever did with this maf installed. Idled rough but never stalled like with this sensor plugged in. Not even worth $28...."
35,5,Good so far
36,5,All ok
37,4,Easy install and a lot of light<br />Currently just using 2 of them for back up lights for a pickup<br />But I'll be using the rest of them soon
38,4,Started unraveling as soon as my husband put a beer in...
39,3,"Works great and it is a great color, but the lock symbol is already fading off two months later."
40,4,"Feels great!  I have a tendency to dig my fingernails into the steering wheel, and this prevents me from doing any permanent damage."
41,3,Work great can tell  different with the original key
42,3,My son loves it
43,1,"I'm disappointed, IT DOESNT FIT MY HONDA CBR 600RR I really was excited for the product to come and it doesn't fit. And it's a fake carbon fiber."
44,5,Awesome grip and low noise. Recommended.
45,5,"Nice size, went on easily"
46,4,good cranking power and fast shipping
47,5,"It works well enough, but somewhat inconvenient to have to raise hood to get at it."
48,4,The quality is great and is very comfy to grasp. The only reason one star off is because of the rubber smell even after washing and air drying it out in the sun. It doesn't smell too bad after washing but still leaves the smell on my hands.
49,5,Worked perfect no problems.
50,3,"I received the decal in a timely manor, and thankfully that it was the color i ordered. It has been on my jeeps windshield for months now, and covered regularly in mud. It has held up very well.<br />The issue in have with this decal is that it was double imprinted. You can see hi haters twice but only one set of letters were laser cut. It looks bad up close."
51,5,Everything Fine
52,5,You have to love Bilsteins. Always worth the extra dough. Make my old truck better than new.
53,5,Fit perfect
54,5,Part worked great
55,3,very thin plastic
56,5,cheap and works
57,5,GREAT PRODUCT
58,5,Came in within 2 days. Front one didnt line up with holes but aftet some drilling it fit perfect. And they look great
59,5,Just what I expected!
60,1,Does not fit CJ7 or YJs. Maybe you should add that to the description.
61,5,nice
62,1,"I have to admit the quality is good, but the first problem is the color is much more orange than gold.  Not as pictured.  The second and biggest problem with these is that they are advertised as adjustable, but they are still not suitable for small hands.  The closest/smallest setting on these is still farther out than my stock clutch lever on my 2014 Honda Grom."
63,5,Fit just perfect.
64,5,great!
65,4,They make it so easy to order.  With the pics of the bulbs and the color of bulb you what your orderin .
66,5,This worked perfectly!  My  truck bumper looks like brand new - was so easy to apply !!!
67,5,"look great, work well, easy to install"
68,3,It's Ok.
69,3,"Wasn't an exact fit, particularly between the seat backs"
70,5,Fit my 2005 WRX perfectly and fixed the P0031 CEL code.
71,5,Very nice product!
72,4,"Really helps take the pressure off my lower back, this has been extremely helpful in reducing pain from sitting at the computer for long periods of time working."
73,5,"Excellent shield, works great and looks even better.  I've had compliments on how &#34;cool&#34; my helmet looks because of it.  It provides decent relief from the bright Colorado sun, and is still ok for night riding.  It's a bit dark, but you can still see at night.  Being the reflective iridium, it can be a little difficult to see the knobs to install on your helmet, but I knew this going in, and it looks great.  The only other complaint is that I swear bugs are attracted to it, never used to have so many splatters on my clear shield!  However, it is still a nice shield, and I like it much better than my clear one."
74,5,worked perfectly and fixed my traction control light that was on
75,4,waiting to use it until I get my car rebuilt.
76,5,They fit great!
77,4,nice light
78,4,Great kit with just about everything you will ever need if stranded for a short period of time.
79,2,"I love, my lexen leds they set of my road king , just the right  amount, of lighting, looks sharp"
80,5,fit my 2004 ford focus perfectly!
81,5,It work awesome! Fit perfect and zipper and straps durable! It poured on way down and nothing was wet! Easy to put on and off and folders compact to store!
82,5,Satisfied...
83,5,works well
84,5,it is what it is.
85,5,Excellent
86,5,Fit perfect and better quality than the one that came with my exhaust.
87,5,"As advertised, nice fabric, looks good and works perfectly"
88,5,It's so cute......loving it '
89,5,"works great, easy install improved ride"
90,5,Easy to install and worked very good
91,4,"Well I'm about 80% happy. They look kick ass on my my truck when it's not raining. I've had these on my truck for a couple weeks and, well there's been moisture in my corners pretty much the whole time. They adjusted easily, they are a little brighter than stock. I will be ordering different corners cause it kills the front end of my truck"
92,5,Perfect fit on the 2012 BMW 528i RWD
93,5,Happy
94,1,JUNK
95,4,Handy to have to hold drinks.
96,5,Very cool product at good price. Thanks. ✫†✫ Visit www.Lord-Jesus-Christ.com ✫†✫
97,5,Always use it.
98,5,Great wide angel mirror
99,5,"Good product , easy install"
100,5,"Great product.  Not like the flimsy ones in auto parts stores.  Well worth the price, looks great on my truck."
101,4,OK
102,5,Looks great and came on time
103,5,Good
104,5,High quality and works great.
105,5,"Great product!!  Use mine on the pillion seat fastened to the sissy bar on my Road King.  The lumbar support was fantastic.  Just took it to Sturgis, SD, and back, riding about 4300 miles with it.  Large roomy, and with my application, easy to use/secure.  I'd definitely recommend to a friend."
106,5,This light came as described and very well packaged with a excellent price .
107,5,Adds a clean look to the interior very happy with my purchase
108,5,"I put these on a 2013 KLR650. Worked great. I'm 6'2&#34; - 190#. The stock bar height was just too low. Very uncomfortable for both highway and off road, especially standing. I had to eliminate a cable tie or two to keep everything moving free. I really didn't think a 1.2&#34; riser would help all that much, but it did. They look good. My bars and top tree are black, so they look almost factory. My only problem was the shipping. They came from Oregon and went to New Mexico. Took almost 2 weeks. There wasn't any other shipping options, just USPS. No next day, no 2nd day, no express, no choices. I like to get what I order ASAP, regardless of cost, just that kinda guy. All that aside, the risers are just what you need if you're a little taller than average. Try these before you go with the 2&#34; pivoting, more expensive ones. I think you'd have cable issues with those anyway."
109,5,"With the fire burn bans this has made camping enjoyable. Absolutely love it.<br /><br />Pros: Nice flame, warm, light, hose lenght, and small,<br /><br />Cons: Loud (breather valve hisses), small"
110,5,I was very satisfied!
111,5,Just perfect for what I needed. I needed a short hose for my water softner install. Arrived quickly.
112,5,"I purchased two of these to dry my dogs after their baths. They are so much easier to use than bath towels. It only takes one to dry each dog instead of two regular size towels. I love the fact that I can squeeze the water out and use it again and again until the dog is dry. I then rinse each one in warm water, ring it out again and store. My husband couldn't believe that something stored damp wouldn't attract mold and mildew, but they don't. I just wish they made them in a larger size."
113,1,"One spark plug done, and the extration tip is so worn it won't grip a second plug. 60 bucks is a little steep for a one and done tool."
114,5,Very Nice
115,3,Not the quality expected for the price. These aren't bad but they are definitely not great. The shades are very thin and doesn't provide enough protection due to the fact that they still let a lot of sin get through.
116,5,works great this gasket.
117,1,These brakes did not fit as specified (2010 VW Jetta TDI).
118,3,It work what suppose to
119,5,"Yes, yes, yes, buy this for your license plate light(s).  As long as trigger-happy cops like to use an tiny insignificant violation like a burned out license plate light to pull you over for no real reason, it pays to virtually eliminate the risk altogether even at $10 a pop.  Sylvania is the real deal.  Don't trust the off-brands if you don't want trouble."
120,5,"Barefoot Graphic did a great job with this design and with customer service response. Had a little hiccup, but they took care of the problem promptly. Now, for my opinion of those who reviewed this product, give it a bad rating, without buying it. They need to mind their own business. Don't write about your political correctness junk on this review section . If you don't like it, don't buy it. I'm sure there is a &#34;BUCK FUSH&#34; sticker somewhere on Amazon."
121,4,It's a chain and it works good. I used it on my go kart and it seems to be working great
122,5,Good durable battery
123,5,"Excellent, just as pictured and just as described, nice and heavy and nice and shiny"
124,5,Great filter good price
125,4,Fits the front window of my car perfectly.  Only wish it were a little more pliable.
126,5,"I honestly had no idea a tool like this exsited until I came across it while browsing Amazon. As soon as I saw it, I had to have it. This is a precautionary tool for me, and thankfully, I haven't had to use it on my own vehicle. Having said that, I wanted to test it out once it arrived, and my father has a few junkers lying around and he allowed me to test it out on the passenger side window. I really expected there to be hesitation and a lot of force needed to break the window, but Tools of Life has made a product that truly works. I hit the window with what I'd call &#34;medium force&#34;, meaning I didn't really exert myself, and to surprise, it shattered that window that a professional baseball player had taken to it. It's my opinion that every family, or anyone, with a car, should HAVE to have one of these. The peace of mind it gives is invaluable. I keep mine in my purse at all times, because my purse is ALWAYS with me. Should there ever be an emergency, I'm covered."
127,2,"It's awesome, but with regular use, the pictures fade after about a year, which is actually pretty disappointing because it's not cheap compared to other more generic versions of steering wheel covers."
128,3,seems to do the job
129,5,"I put these pipes on my 2013 Kawasaki Vulcan VN900 Custom.  They went on easily and sound GREAT!  Strongly recommend getting the Cobra Fi2000 PowrPro Tuner and Cobra PowerFlo Air Intake Kit and putting everything on at the same time.  I got all three installed easily in a couple hours.  They work extremely well together and have given the bike extra, sustained performance.  NO - I do not work for Cobra."
130,4,I purchased 1 and i loved it so much that i purchased 2 more. i gave it 4 stars because it has no grip.
131,5,Perfect.
132,5,"great parts and well designed. Fit perfect. Only issue took no Amazon prime, slow delivery, but price was right!"
133,5,good distribute!
134,5,For the price compared to quantity you can not go wrong here.<br />Relays are great it you want to switch higher voltages on or off using a small voltage.<br />These are rated at up to 240 volts. I have only tested 120 and it worked flawlessly.<br />I can switch them on and off with a 5 volt microcontroller.
135,5,"Best I can say is you get a great price and quick delivery. Marine grease is marine grease, if you get my meaning."
136,5,"It arrived with a defective pump, the contents dribbling out from the pump handle. What I was able to try is a completely inferior product when compared to Zanio's or even Mother's detail spray products.<br />Garbage....one star only because it's the lowest rating allowed<br />Ok, I was a bit upset that the first time I used it the spray trigger exploded in my hand and all over the place, so that first review was a bit of an emotional one. I have used it since and have to admit it is as easy to use with similar results as the Zaino product I have used extensively in the past, good product, sorry for the over reaction..."
137,5,Best price I have found for this item.
138,5,"Everything for install was included. High quality aluminum. My pop up camper will love this, and so will my trans."
139,5,got these for my 2005 Toyota Avalon and love them.  Fits prefect looks awesome.
140,5,This spare tire hoist/holder fit perfectly on my 2003 GMC Envoy.It was just what I needed to get the spare tire out of the back of my suv.I would order again from Dorman.
141,4,"Half the price of Oreilly auto for the same, part.  Ceramic=less brake dust.  Fits the vehicle."
142,5,"I love these lights!  I always get compliments and asked where I got them.  I did have to back down the wattage on the lights.  We started out just a little too bright for my taste.  Once we replaced with 15 watt bulbs, it was perfect.  Great Product!"
143,1,"Based on my experience, this quality of this product is poor.  It flops lops over and does not remain stiff and in windshield.  As a result, I consider the product to be useless and would not buy it again."
144,4,it worked ok
145,5,Perfect fit replacement.<br />I'm surprised that GM hasn't made a detail change to this model van.  Auto designers seem to change things just to be changing them sometimes.<br /><br />Not only was the part exactly the same the color was too!
146,2,"Giving 2 stars as it will not be an issue if hit by foliage when off roading as far as height, and I do get in some stations most of the time, BUT my reception is generally atrocious!  In all fairness, I do live in the pines, so radio signals are not necessarily the strongest, but it's not super snug when screwed in, and even in more areas it doesn't pick up much."
147,5,great quality and price!
148,5,Along with the baron big air kit cleaning up he clutter.  These two side pieces dressed the area up with minimal detraction from the engine. Great!
149,5,"work like a charm, Thanks"
150,2,"These are pretty cool - but they don't always work.  I purchase two sets of these, and I have one stem that works great.  But - they are so cheap - if you really want them, then just purchase multiple packs to get a couple that work."
151,5,"good quality, simple, not overly hot or ackward"
152,5,Perfect fit on my Lexus IS250 and very good material. Good stopping power and they include all the hardware.
153,5,very easy to install
154,3,"Received this product today. Shipping was fast, packaged well, had issues putting it on. The front bucket seats went on perfectly. Looks great, the back seat though was a nightmare. The bottom goes on just fine. The back part of the back seat doesn't work. Nothing lines up like it's supposed to. After about an hour in the heat we made it work. We had to make holes for the headrests to hold the back part that just sagged. We made it work and it looks good. Haven't had anyone back there yet to truely test it out though. The fabric snags/catches some as well. All the head rest covers fit perfectly. I love the colors. And love the feel of the item.  Had a struggle with my Toyota rav4. But it eventually worked."
155,5,"Exactly what I ordered, exactly what I needed. Thanks!"
156,5,"At first I was just as skeptical as another reviewer on here thinking &#34;With all of these good reviews and barely any criticism, this company had to have hired paid reviewers&#34;, but I went out on a limb and tried it anyways. I am glad I did. This thing works wonders. I have had the leather chamois in the past and they seem to dry out and get brittle pretty easily and I have had other synthetic chamois in the past that didn't work worth a darn, but this is like the best of both worlds. It works as well as any high dollar chamois that I have had in the past and if you keep this in its container I don't believe it will dry out any time soon. As an added bonus the company checks with you within days after your order to see if you are satisfied. They actually seem concerned about their customers! I will be purchasing more of these in the future as gifts and to keep around the house."
157,1,Very poorly made
158,3,"The carbon fiber style bar ends for my 2009 Gsxr 600 look great on my bike! I only have one con about them. Instead of having an allen key type of screw in them, they have a phillps head screw so it's a lil hard to screw them in really tight without stripping the screw. Other than that they're a great addition to my bike. I would recommend getting them if you need a pair."
159,4,simple and easy to use. provided the data i needed.
160,5,Great
161,5,"Bought this to use on porch/deck of cabin on a lake.  Looks great, rain goes right through, lays nice and flat, doesn't blow up in the wind.  I think we will be able to use for many years."
162,5,Very good product.
163,5,"Soft, smooth and fit a 2003 Durango pretty well."
164,5,"These are super solid tusks, but the instal isn't very easy. But overall i'm very happy with them."
165,5,Great..thx
166,3,"Great sounding pipes, but get VERY VERY VERY VERY HOT and instantly discolor."
167,5,fit perfectly on frig. draen
168,1,"I was very disappointed with the shipment of Archoil AR6400D professional diesel fuel system cleaner that I received. I ordered at the same time two bottles at $25.49each. These were delivered separately, one day apart.  One bottle was ok, but the other bottle that I received was either old stock or counterfeit. If you look at the attached pictures, you can clearly see the differences between the two bottles:<br /><br />1) Pic 1 (front label): Bottle on the left has a glossy, professionally printed label. The label on the bottle to the right has a dull, worn out label that looks like it was printed on ordinary paper. Note the glossy label has rounded edges while the old/fake(?) label has square edges.<br /><br />2) Pic 2 (back label): Similar comment as in Pic 1. Furthermore, if you look at the middle portion of the bottle on the right, it seems the instruction section was misprinted.<br /><br />3) Pic 3 (overhead, cap off): Bottle on left is sealed. Bottle on right has no seal. this resulted in some spillage inside the package. I do not plan to use the contents of the unsealed bottle as it could be contaminated with substances that could harm the fuel injection system of my vehicle."
169,5,"Looks amazing and all of my Whovian friends love it too. The blue really stands out on your car and its easy to read. My state (the same as the picture) doesn't use any tags so it doesn't block anything for me but I would be careful and check for your own state or country's laws. And don't worry, you wont get into trouble or having the word &#34;police&#34; on your car because you are not trying to impersonate an officer. 10/10 would recommend. I like this one way more than the metal unofficial ones."
170,5,"if you have kids you can appreciate how handy this can be. of course you could use a bag, but this doesn't just fall over, spill, or look as cheap!"
171,5,Parts were on time even early. They work great.
172,3,"these are too big for the toyota corolla, and I even asked.."
173,1,It was the wrong size for my car. I needed one to fit a '98 Honda accord.
174,1,"I installed these on my 2003 Silverado.  In less then a years time they were warped.  The truck is not used for towing, only light hauling occasionally.  After 11,000 miles I am going to have to replace them.  Save your money and buy something of better quality."
175,5,Great item
176,5,good quality
177,5,excelente
178,5,easy to install
179,5,"very happy with it, was a birthday present"
180,5,Prof of all 2 years working
181,5,We have the only Kia with a mat black on the hood. Looks great thanks
182,5,Works well.
183,4,Works well
184,5,Its a belt and it works
185,5,Perfect....
186,1,had to send back did not fit my 2004 sieanna van
187,5,Working perfect
188,5,Great addition to hear the motor open up and improve throttle response.
189,5,Works great on my 2002 Bonneville. A good thing to have in your car just in case.
190,5,very useful
191,5,Good product..
