,star_rating,review_body
1786,4,"After reading the review of this product I was excited for it to arrive at my doorstep. I had been looking for a tire dressing that is high gloss and long lasting. Upon arrival, I applied it to my tires using an applicator which was specifically designed for the job. There were several bumpy areas on my sidewall so I was a little heavy with the product. It rained for three days after my application. The rims on one vehicle turned black. The rims on my other vehicle were already black, so the fun off wasn't noticeable. After driving the vehicles I encountered a large amount of product to have been spun off all over my freshly waxed door. Subsequently, my advice would be to be mindful about the amount of product you apply and wipe off any excess. On the plus side, it gives you a fresh looking tire which has now been looking good for two weeks."
1787,5,This is a good product. It replaced the original perfectly. It has been on my car for a fewcyears so it is durable. I would purchase this product without hesitation again. Good quality and craftmanship.
1788,5,I got this from autopartstoys and was so excited to put it on. The company had already finished the first three steps and included a retractable measuring tape for me. They were super easy to finish putting together and to install on my car. Love them!
1789,5,I put these on the front. Work great and fit well. I recommend them for the front as they are a little thing for the rear.
1790,4,These are really good wipers but I can't say they're the best. They are a really good value though for being as good as they are.
1791,1,"This stuff is garbage.... You would be better off with black spray paint. It does not cover well, it comes out in splatter form and then does kind of even its self out. The nozzle constantly clogs. It is dries very soft and is not durable, it scratches very easy. As some one else posted use the rustoleum bed liner, it sprays on much better and dries to a very hard and durable finish.  This stuff is more like a rubber under body spray."
1792,1,"This part would not work for my vehicle and I had to return it. When i ordered it, it stated it would fit my Truck but when I went to install, I had to return it!"
1793,3,The ride is better that the original shocks on my 250 but the shock bodies have begun to rust already.
1794,5,Perfect looking. And easy to attach.<br />Will not weather and remains looking as good as the day you attached it.
1795,5,"This bumper is awesome. Easy to install and better protection compared to any others i've seen. After having to winch up steep hills through snow and pushing buddies up some ice spots, i'm very impressed with how it has held up."
1796,1,"The price was right, but did not work, would not program. Ended up using the new contacts on my old electronics."
1797,5,works just great...used it all winter on my bike...if you own a atv..boat...camper...motorcycle...the price is awesome..a must have...arrived when they said it would...i only order from amazon
1798,2,"I purchased this for my 2011 dodge ram 1500 quad cab.  It was sent out quickly, but they sent me the rear guards for a quad cab and the front ones for a crew cab.  I called and had them send out a replacement for the front guards to swap out and they sent me ones for a regular cab.  After i called a second time to try to switch them out, and they told me that the quad cab ones were sold out.  I got my money back and had to drop off the other wrong guards at UPS to be sent back.  After about a week and a half of dealing with this i have nothing to show for it. They were very nice on the phone and did send the replacements out quickly.  Just wish they were the right ones."
1799,5,"This is a two part spray that needs to be combined prior to use. It is easy to do, but once combind you only have a 48 hour pot life to use it. That being said this is what it is a urethane spray. Do not put it on too thick or it will become spongy and soft like a skateboard tire. It is great for little touch-ups. I pulled all the trim from my jeep, and painted it to match the exterior color of my jeep then used this stuff to give it a glossy coat. It worked great, and went on super clear. Make sure you give it time to harden, and make sure your prepwork is there. I also gave it a light sand and buff once it had hardened, and it turned out flawless. I can't say enough about how handy this stuff is. I wish it had a longer pot life, or they made it in a smaller can, but all in all a great product."
1800,5,Setup was a breeze! worked like a charm for the fraction of the price! I would recommend for anyone who is in need of a replacement.
1801,5,Look good.  Fit perfect.  Shipping was as expected and no problems.  They add a little bling to the drab looking stick mirrors.
1802,5,"these led switches work well, the led is perfect on them and they are small enough to mount anywhere you want"
1803,4,Wasn't as big as I thought it would be. In that as bigger person it's harder to get over my head and it's not as tall on my neck as I was looking for. But it is warm. and I use it under a scarf. We've had a brutal winter and it helped to keep me warm.
1804,5,"They are a great way to keep the floor clean and fit just right. Easy to install, clean and look good."
1805,5,"These are very nice, warm riding gloves. I will say I normally wear an XL glove but the L fits me better in these."
1806,5,Bought this to replace  the original plastic BOV that came with my Ripp supercharger.  Works great and love that it's adjustable.  this thing will not be failing the way the Bosch ones did.
1807,4,"I vomited on my leather jacket. Classy, I know. I used this stuff to restore the pliability of the leather once I had removed the vom. It's not quite new feeling but very nice."
1808,5,it was bigger then i was expecting but thats ok looks great on the back windshield of my stang :) very happy :)
1809,5,"Don't bother with getting the non-long life bulbs in such applications. Just get these, install them, and forget them. Brighter and more reliable than any sub-$100 LEDs."
1810,5,"Worked great, easy install. Saved a great deal of cash by buying it here, and installing it myself, versus going to the stealership. Buy with confidence."
1811,5,"Best wiper blades I've used.  Easiest to install, too. Almost no streaking due to design, and I'm talking about driving in rain, sleet, snow, salt and ash on the roads.  I hope they keep making these blades, because they're far superior to ALL others I've used."
1812,4,I use this on an RV refrigerato.r  Very helpful.  Provides helpful information as well as current time.  Provides inside refrigerator temp.
1813,4,Fast shipment!!! The product was in perfect condition. It took me 15 minutes to install with the proper tools. It wouldve been 5 minutes if it wasnt for the rubber seal. The rubber seal doesnt quite fit the space between the fas cover and the edges of the gas tank opening.
1814,2,"Bought to replace a 1999 Subaru.<br /><br />Physical size and dimensions are generally correct, but it does not at all fit in the brackets for the Subaru.<br />The number and function of the wires is the same, but the clips at the end are wrong, meaning I'll have to splice the ends of the old ones on.<br /><br />Overall, this antenna doesn't fit precisely in any vehicle.  It's just a standard replacement with a bendable bracket, and screws so you can try and &#34;Make it fit&#34;.<br /><br />Good luck!"
1815,4,At first I wasn't sure it would fit on my bike (1997 Honda rebel) but it did and so far it is working great. Nice and easy to install.
1816,5,"So easy to apply. I applied to some motorcycle spooks, screwed it in and now it won't come out. Well unless I try really hard. The point is it makes the bolt immovable when you want it to and doesn't make it impossible when you want to remove the bolt."
1817,4,The seat cover had a loose seam on the drivers side.  I decided to keep it instead of the hassle of returning it
1818,3,"Pretty cheap & chincy,Bulbs are low wattage, blink too fast to be safe,had to fabricate mounting bracket,wires are not installed inside the light bar as pictured in the ad.I guess u get what u pay for,but be pretty handy with tools if u expect to install it on a Yamaha&#62;"
1819,4,"I was very happy with the quality of the jumper cables and flashlight. The first aid kit is ok, I think I need to beef it up a bit with some antibiotic ointment and a few more bandaids and tape. The case is very nice alot of room tho throw in some flares and the protective auto triangle's. I would have given it easily 5 stars but the first aid kit has minimal supplies. On the good side it's a easy fix to go to the store and purchase a few more first aid supplies. And to add the screwdrivers that were included were of good quality. I have no problem recommending this product,"
1820,2,I just used it for the first time(3-15-14) and the metal that you put your foot on to put up stand up with bent. I did not expect for it to be so weak.
1821,2,"I had to send the product back, when I ordered the directions for installing were misleading.  In order to install you actually have to take off your bumper and drill holes... too much work!!"
1822,5,Fit my 2010 F150 Super Crew perfect. Keeps the mud and ice off my running boards as this is what I was looking to stop.
1823,5,"Trunk and cargo area lights seem to be an afterthought, almost as if car-makers are saying \\""Throw a low-wattage fixture back there and we'll have one more 'standard feature' to pad the list in the brochure.\\""  That all changes when you plug in these li'l chunks of the Sun. Because of their extra length, they're particularly suited to horizontal installation as in dome, trunk and cargo lights.  If you can plug them in and they fit the enclosure, they're perfect for many cars made within the past 10 years and beyond like the trunk light in our 2004 Honda Civic sedan and the cargo light in our 2013 Subaru Impreza hatchback.  The pure white light complements the LED dome and map light bulbs we installed, spreading that white-hot LED bling into the dark forgotten regions."
1824,3,"The color is still not the gold it may seem in the picture, but they sent me a brand new one with the right size this time. sticking it to the clear paper was hard to do, and the size is a little bigger than the cover size but its an okay product."
1825,4,"The cable on the regulator broke on my rear passenger side window.  I drive a 2002 Grand Prix GT (4 door, obviously).  This part fit perfectly and took about 45 minutes to install.  I've never tried keeping the old motor, it seems like it's worth it to just replace the whole thing even if your motor still works.  With my luck the old motor would die 2 weeks later anyway.<br /><br />Be sure to buy some of the GM trim panel retainer clips, you will surely break some of them removing the door panel."
1826,5,Works great easy to wire up and matches my current ultra lite gauges perfectly. I was worried bc most recommend different brands of wideband air/fuel gauges but I am pretty anal about having all my gauges match and I don't regret it.
1827,5,"Not only is the price the best around for these riding glasses , but the shipping was incredibly fast. Very happy all the way around with this purchase."
1828,4,"This mounted easily on rear tailgate of 07 Wrangler unlimited x. It took me 2 hr to install, but I was getting a lot of nuisance phone calls at the time. Do duct tape it in place as you install. Stretch it really tight as you place each screw so it doesn't sag; I started to the right and moved left. Some have drilled the holes with a slightly larger bit than recommended, I did fine with the recommended size. It does take a lot of control to drill in the self taping screws: they are cheap and soft, and will strip easily. It might have been a tad easier with a bigger pilot hole. Drive them in slowly: it is very easy to round out the top, drive them in crooked, or over tighten. If you over tighten, they will pull through the grommets: I had a few dip deep into the grommets. They are holding for now, but I may have to put in a few washers if the grommets pull off completely. I have a third row in my jeep so the bags fit very snugly: perfect for keeping everything still. The bags are smaller than I expected, but the MOLLE straps will let you attach the bag of your choice.The big bag is holding a tow strap, gloves, jumper cables, and a D ring, small pack just has some bungees. The bags have an incredible assortment of internal compartments, but I have everything stuffed into central compartment. Bags come with shoulder carry straps, but you have to pack them inside or they will hang down too low. I am very happy with purchase because this stuff is not in my passenger compartment anymore and it doesn't fall out when I open tailgate."
1829,4,"The seat covers are awesome,  they fit my seats well, and they look cool.  The only thing I noticed was that in the picture there is gray checking up the center,  behind the design,  but the covers that I received didn't have that.  Besides that (which really wasn't a big deal) I love my seat covers!"
1830,5,"This tool os price less when it comes to the a/c system on your cars. The quality is above the average China made product and it works as advertised. If you want a time saving tool that is quality this tool will do it. Myself, I wanted to be able to change leaking schrader valves without discharge and recharge of the a/c system and it delivers."
1831,5,"I used this item to replace the tubes in a 12&#34; fixture.  I am pleased with the amount of light.  It is a warm white.  I would like to have the cool white, but it is not available.  I will purchase more in the future to reduce the 12 volt DC load of our RV."
1832,5,"The dealer wanted twice as much for the same hose. Replaced both fittings on the radiator without any problems along with replacing the hose. Also wanted to replace both fittings on the transmission. The transmission seals were extremely difficult to remove, because they are a press in type seal and took some thinking on how to press the new ones in.<br /><br />Its now about 3 weeks in service and no leaks."
1833,5,I have an HHR which is a cross-over vehicle. I am also on the shorter side when it come to height. I loved the extendable and yet sturdy handle which allows me to get all that midwestern winter off of my car.
1834,5,The fit was perfect and they were easy to install. Works great and keeps my hood up properly now. Thanks!
1835,5,Perfect fit and durability.Material is made up of high quality. Saved me from this nasty NYC weather this winter . Recommend!
1836,5,My best friends mom loved this. Her car has tinted windows and when she put it on the window she was afraid it wouldn't show up. She was thrilled that you can see it and read it thru the tint...
1837,1,"I never really got to use it. It stopped charging almost immediately. I did not buy through Amazon and after reading the internet review horror stories about Wagan's customer service on this product I decided not to bother contacting the company, It was an impulse buy for me; I wish I had read it's reviews first. One star is not a low enough rating option for this product. Something in the negative star range would be more suitable."
1838,5,"Easy to install took within 2-3 mins very silent and works very well, no streaks when raining... though i could have bought a 20 or 21 inch."
1839,5,Its legit! We had an ice storm hit my town and my window cling broke. I ordered and got in withing a couple of days! I had someone install it for me for a h2 hummer  . Thank you
1840,5,"This is the real deal,, great for black paint or any other color for that matter.  We use this to put on a final shine just before delivery of a new car at the dealer where I work.."
1841,5,"Exactly what I needed, must cheaper than buying local. Gate makes the best hoses, don't buy a cheap import, when you can get the real thing."
1842,4,"They fit perfectly and the arrived very quickly. It was easy to shop for the replacement and the price was one of the better ones.Will soon be purchasing new ones for the hood, as well."
1843,3,"These are for very small gauge wire. The description for this type of connector should always include the supported wire size and amperage rating. There are also no instructions for installation. You need to sort out which fitting holds the male pin vs. female pins and the proper sequence / orientation. Once you have it down, they work well.<br /><br />Seller should add supported wire sizes to the description"
1844,5,Bought this for hubby for birthday. He loves it! Jeep looks great now. Couldn't be happier with it. I would recommend.
1845,5,"Great product, no dipping necessary! You can Plasti Dip just about anything, here are a few thing's I've tried so far<br /><br />Rims - Hard to get out of tight spots but looks great.<br />Ez-pass - looks awesome in stealth black<br />Bottle of Jack - Plasti-Jack*<br />Roof - Hasn't leaked since<br />Strawberries - Ziplocks are for squares. Strawberries are some other shape.<br />Spray Paint Can - pwned<br />Hand - Latex gloves? What am I a caveman?<br />Caterpillar - Plasti-fly? still waiting...<br />Fire - Just try it.<br />@$!& - Don't be a fool Plasti Dip your tool!<br /><br />*Plasti Drink responsibly, Plasti-Jack and Plasti-Dip do not mix. See above."
1846,2,Doesn't work well. It's brittle and cracks easily. It's also a bit thick and does a great job of depressing the padded panels you try to remove. But I was able to work with it.
1847,5,"These are very nice.  They fit perfectly and seem like they will be durable for several years.  At this price, they had better last.  These won't slide around at all."
1848,2,"For the price, i expected some quality..but i got zero quality......on one cover on of the bungee's snapped, then one of the clips was sewed so poorly it literally came undone, and a different clip snapped and broke, all this happened during installation..."
1849,5,Put them in and went to work...that's a 700 mile round trip and the truck has a new peppy feel again...mileage improved! Very happy<br />with these sensors.
1850,3,"i say so because i noticed some compression imoprovement for say 1000km ,however upon investigation it seems my smoking 4banger was a result of a blown turbo and head gasket so not so sure if it went well with my turbo or not"
1851,4,"The fit and the color were fine. The velcro tape did not stick worth a darn on a clean dash, so I am going to buy some better 3M tape so I can get it to secure properly."
1852,1,"I concur with the previous review: this plug does NOT fit my Mazda B2300, as advertised.  I needed 14mm, but this one is only about 12mm."
1853,5,"This winter in the northeast has been pretty bad. With an SUV and a normal size brush I had a real issue getting my car clean every time it snowed, which was almost every day at one point. This has saved me tons of time and was able to push very heavy wet snow from the top of my SUV without much effort, The swiveling brush head works well depending on if you are using it as a broom or a brush. It seems pretty well made and hopefully will last me a while, I happened to get this very cheap which makes it even better in my case."
1854,5,It's amazing like having a new jeep again. I forgot how nice it was to have a liftgate that stayed open by it self.
1855,1,"All I used my bottle for was to spray a diluted carpet cleaner on the stains on my white carpet....The sprayer stopped spraying within 20 uses......As far as the warranty goes, they got ya there! Cost more to return than the bottle cost....."
1856,5,"Got them faster and then they said putting them on now.  Putting them on now, Will make my car look brand-new again"
1857,5,Good product!!!! A+ good response and low price I really recommend it to every one !! Add 2 mpg and much power
1858,4,"This is a great tool for self-defense. The only caveat is that someone has to be close enough to you to use it, which isn't super ideal, but it is better than nothing. I still have my pepper spray, and carry both just in case. For someone who works very odd hours, I like having something to protect myself if need by. It's also quite innocuous, which I like."
1859,5,Easy to install and they work as good if not better than the originals. I would recommend these to my friends and anyone else that rides.
1860,5,they will see you coming and in style like no other i recommed everyone have light like this on their bikes easy to install and look great
1861,4,"I ordered three of these - one each for myself, my daughter and Goddaughter.  Mine only lasted a year but was great while it worked.  My daughter and Goddaughter are still using theirs and it has been a little over two years now."
1862,5,"Best replacement wiper I have ever used on my Infiniti QX4 and Chevy TrailBlazer. Wipers are silent, not the slightest squeak. Clears rain effectively with very little to no streaking. I've used RainX in the past and the last set was so bad, I'd rather deal with the rain than have to use my wipers. Excellent buy!  UPDATE: 6 months, 1 very rainy spring, and 2 cross-Texas road trips later, these are going strong and still quiet, no squeaking, no streaking. Other expensive brands I've tried haven't last this long or performed like new. I don't think I'll put another wiper on any car I own unless it's a Bosch."
1863,2,"I like swiss tech's utilikey, however I received this tool as a gift, and was rather unimpressed. The light is more dim than other keychain lights, the tool itself is very thick and heavy considering how few functions it has. The screwdriver(s) are weak, slippery and uncomfortable to use. The blade is too small to be useful for more than a box cutter, and is disproportionately small to the rest of the tool. The bottle opener is a bottle opener. Nothing special.<br /><br />It's assembled well, I suppose, and comes as advertised, but you could do a lot better. Spend the extra $10-15, and pick up a leatherman style, which is more useful, compact, comfortable and much higher quality."
1864,5,"The cat back system fit perfectly, no cuts needed and sounds like a hemi! Big response when u hit the gas pedal"
1865,5,We were slow to rate this on because most inverters have problems get hot and don't last very long. We have had this on for 2 years now and use it all the time. Very well made and performs great.
1866,3,It's okay but a downgrade from a quality German made car and then installing a Chinese made rotor. Not too confident about the rigidity of their product.
1867,5,Using as wall art instead of license plate cover. It's basically a mirror with the Broncos logo. Really like how it looks!
1868,5,These were purchased as reading lamp replacements for my truck. Color is a crisp cool white. Installation was a bit dificult but only because of the style bulb no fault of Classy Auto's. They color match my Dome light LED upgrade perfect. Great product all around. I do consider myself somewhat of an expert on LED lighting at this point. Recomendation made!
1869,1,These people are unfair my on timeall I wanted to do was change them for smaller size they wouldn't let me do it
1870,2,cheap  n doesnt fold in not enought ajustment on it
1871,5,"Very well built al carrier. Loaded a large (16in) wheeled scooter weighing 290lbs. Very little tilt or shaking on front hitch. Highly recommend,. Plan to use on front of truck fiver combo every year for 10-12,000 miles a year. Easy assembly, will last for many years of use. Had to trim the corners off the ramp to clear the bottom of scooter plastic bottom. Otherwise, flawless."
1872,4,It worked but I was under the impression that my car had a remote starter. Well it does lock and unlock my doors.
1873,5,"This mat looks like it came with my Ford Edge. The color matches perfectly and the fit couldn't be better. It's very well made, it's strong, and doesn't get scuffed when I throw my gym bag, back pack or suit cases in the back of my car. Sure, my carpet will be left in pristine shape but while I'm using a mat, it's not an eye sore at all, in fact I like the look better than the carpet look. This should be standard issue with the Ford Edge!"
1874,5,called and in 5 minutes had remote programmed.  FREE INSTRUCTIONS  works fine and am pleased with product.  would recommend to anyone.
1875,2,Lint falls off the sponge.  It is hard to clean after use.  Just save your money and use an old T-shirt or hand towel.
1876,3,it is easy to rub the white &#34;paint&#34; off the sticker with your fingernails.  i am concerned the sticker won't last on on the outside of my car for that reason.  time will tell.
1877,5,"Easy to assemble, sturdy and very practical...just how gifts has to be in order to please my hubby!!!  This can help him a lot while he is on the road from one customer to another. He likes the convenience of being able to use the ipad without talking out the cover . Like another review says get the heavy duty .  Recommended !"
1878,5,Open box...wow looks great. Went to install ....have wrong part....just my F---in luck! I am waiting for a credit to reorder same.
1879,2,Bought this for a gift and my mother did not think it got very warm. Nothing more to say. ...
