,star_rating,review_body
0,5,"Very satisfied. The M4U 1's are my return back into full-size cans after years of using in-ear monitors of various quality up to Etymotic ER-4's.<br /><br />I had 3 uses in mind – open office, train commute and digital piano playing. For me, they are great for two: open office and piano.<br /><br />Pro:<br />- balanced, tight sound<br />- excellent for digital piano playing (the Kawai CS-10 hybrid sounds incredible on these)<br />- no obvious coloration, works great on all kinds of genres from classical and opera to EDM<br />- clean and understated classy looking<br />- comfortable fit<br /><br />Con:<br />- just too big for me to travel with, went back to in-ears for commute<br />- on a hot day things get a bit sweaty"
1,5,Great headset case
2,4,"These are a more comfortable than the original pads, which I'd been using for a few years.  But honestly, I've been loving my monoprice headphones so much that I almost felt guilty for only spending 18 dollars on them.  Dollar for dollar, that's probably the best audio purchase I've ever made.  For a few bucks more they look a little less nondescript and I can wear them for longer."
3,5,I love this speaker!  It's at a  great price for the quality of sound it delivers.  Oh and did i mention it is water proof? Like what else could you want?  Seriously happy with this Photive product.  Thank you.
4,5,"Just ordered a second one to replace the one I have had a couple of years. Not certain if it is the charger or the computer that is in default but at this price, it is worth ordering to find out.  Definitely a good price."
5,5,Has been a big help in finding my husband's keys - he misplaces them ia couple times a month and can spend 15 minutes looking for them.
6,5,Overall good quality just a little thin on the area where the female end goes into the male portion. Very Thin but as long as you are careful they work just fine. Hope this helps.
7,5,"works great to pull in stations 65 miles away and beyond but be careful with splitters and long coax runs, you lose a lot of levels (db) when using those.  A mild 3.5 to 7 db boost works good too."
8,5,very good job
9,5,"Work great, sound great.  The carry case is a pain the behind, but I'm over it."
10,5,I've only used it for a couple of minutes but I can tell you it is a great Ipod dock! It sounds great and looks very stylish. The remote control works great and the FM radio is a nice extra. Definitely not portable as it is quite heavy but overall is a great product.
11,5,Love it. Size and the super sound
12,5,"I'm a Truck Driver and needed something lite and durable for my Rig. This product was easy to mount, shipped quickly, and holds perfect."
13,5,"Finding the right code for my Samsung was difficult; however, once I found it, it works just as advertised."
14,1,"After a few weeks I smelled plastic burning, opened up the lamp enclosure and the wire prongs that attach to my TV had fused together. I pulled out the lamp and the connection broke because the connection had melted together. I had to pay $200 to get a technician to replace the burned out parts. My TV works now but will not ever buy a cheap generic lamp even though this one wasn't that cheap but there are ones out there for $20 bucks from china."
15,1,"Extremely disappointing. Even the XBA-1 sounds better than this.  Highs are almost non-existent, and this results in a muffled sound that is nearly unlistenable."
16,5,Happy with it.
17,3,Poor sound quality due to shock proof material. Audio volume was also a major disappointment.
18,2,It was a good charger until I took it camping and it started smoking.
19,4,Good liked them
20,5,Very good quality.
21,2,wish it would have done more ended up buying a speaker switch instead this product just didn't meet my expectations
22,4,I love them. But they aren't as loud as I'd like them to be.
23,5,This screen really is fantastic! I couldn't be happier with it. Price is on point and couldn't get much better 😊
24,4,"These have help organize my many, many DVD collection. The only thing is flaps do not stay shut with the little tab. Have re ordered them, and will reorder."
25,3,Perhaps the product is excellent. The challenge is it is quickly becoming obsolete.  Bought it to get local stations for emergency weather updates.  I can only get a couple of auxiliary stations.
26,5,"This is an amazing little speaker, the sound is crisp and clear, any and every song sounds amazing. I'm into a lot of rap so I was expecting a little bigger bass but this is still an outstanding speaker, Bose has the best products."
27,5,AWESOME LITTLE MOUNTS FOR MY SMALL VIZIO SURROUND SPEAKERS
28,5,"I don't consider myself an audiophile, but these were quite an upgrade from my old headphones. The sound quality is amazing! I won't say that these don't tangle, but they're easier to untangle than other headsets/corded products I've owned.<br /><br />I bought them thinking they had a microphone that I could use with my cell phone. When I saw that they didn't, I thought about returning them. I'm glad I didn't. I'm glad I decided to try them.<br /><br />It's amazing how immersive an experience these earphones provide. Now I understand why people seemed so tuned out when they're listening to music -- bobbing heads, mouthing along to the music. I thought they might be a little crazy... but now, I'm one of them!"
29,5,YES! Quality built.Works well.
30,4,Not a loud as I wish it would be
31,4,Not sensitive enough for fine tuning but helped with location of antenna. Better than using the TV for  location.
32,5,Awesome
33,1,"Crapped out after &#60; 100 hrs of use, and this was a second or third replacement, of one these same p.o.s.'s that actually melted- that's right- it freaking melted, not just a little, but the whole ac adapter box looked like an ice cream sandwich left out n the sun. It's no worse than the other one they sell on here that's 12v 8 amps, neither work for long if at all. Really not sure what to do, need to run the appliances, guess I'll be searching ebay to Office Depot for 1 that'll work. I'm sure it's too late for a refund, maybe a replacement but I'm a lil concerned this Chinese made cheap crap might burn down my house"
34,3,"Great product for the first couple of months. Easy to pair, good music/listening quality. But, all of a sudden, the left side stopped playing music & hasn't worked since. I am still using the right side, but it is now a slight inconvenience as i like to have both in while working"
35,5,It works great and is so convenient!! Thank you for a great product at a great price too.
36,5,"Adore it. Sounds like a dream, super durable. Buy it."
37,5,Got this as a back-up cord for my Apple TV so I don't have to fish out the original cord every time I want to take the Apple TV somewhere.  It works just fine.  No issues.
38,5,Was as advertised
39,5,"These are being used in an outdoor solar lamp. After a few months, so far, so good."
40,5,Works good. Has adjustable volume and adjust to head size. Use this for my 18 month old and it was a little big but still worked.
41,4,"I don't think that it has too much base, it's just sounds right especially for a bigger room. Nice update of previous SRSX5<br /><br />UPDATE<br />Yesterday I turned it off and today I could not turn it on. It just didn't work. I tried reset and clicking all the buttons but it didn't help as well. after disconnecting it from power source for a 30 min I was able to turn it on...<br />I will see how it goes, but looks like it's not the last time I have a problem with it."
42,3,"Product was as listed on Amazon.  However, to me the sound was a tad fuzzy."
43,3,"If you need a headset that just works, this is for you.  But if you are really active and moving while wearing this, id recommend something else.  The buttons on this are loose and cheaply made so they rattle.  When I strenght train and strain to get the weight up or if im grinding my last rep, the buttons will rattle like a MF and ppl around you will notice.  But worst of all so will you and it gets annoyi g.  Then when you run, it rattles with each step.  Not good for working out."
44,5,it is perfect my grsndson lovrd it<br />slim snd compacted.grest valur for money
45,4,"Works well, but the sub becomes disconnected from time to time."
46,5,Works great! Great replacement!  no issues.
47,5,Outstanding
48,4,"Ok so I haven't opened a record player since I was a kid. My last one was a fisher price. So she i heard people saying this was more a toy than anything. It didn't really phase me. I'm just a casual listener, and liked the idea of displaying this near my Funko pop figures.<br /><br />The speakers aren't the best (no bass), but they're better than the ones on my phone. I didn't Experience the skipping on new records like others did. Everything played perfectly new or vintage. The 45 adapter is included, but I wish it was one of the metal ones they sell separately, just personal preference. The player has Aux in which I hadn't noticed in the description or reviews, so I was a pleasantly surprised.<br /><br />As far as the build quality it could have been better. The leatherette was wasn't glued down properly. It had scuffs, glue runs and imperfections from what was most likely a rushed build. To spite that, I am pretty happy with my purchase. I can get over the imperfections, and its a great conversation piece."
49,5,"Received my headphones yesterday. Charged them up and listened to a few songs. So far my expectations have been met and very happy with the headphones. I cannot remember if these need a burn in period like some headphones. If they do, can't wait to hear how they sound. Right out of the box I was impressed with the overall sound quality and the comfort while wearing them. No problems pairing them to my devices. Carrying case is nice as well.<br /><br />My only complaint so far has nothing to do with the headphones. I am a Prime member and paid extra for next day shipping. Ordered on a Friday and supposed to receive Saturday by 8pm. Did not make it and did not receive until Monday afternoon. Did not feel it was fair to downgrade my rating on the headphones due to shipping issue. Will think twice about paying extra next time."
50,5,Good product.
51,5,Great cable...works as advertised...throughput adequate for my needs
52,1,"worked well for about 5 months and then died (about the same time my Direct TV HD DVR malfunctioned critically. Don't know if the two are related.) thought it was just my cable box but when I had that replaced I plugged the new one back into this and it did not work either. Maybe it had gotten dusty, don't know. But will be investing in something a little higher quality."
53,4,I have used these before and they are great for keeping cords where you want them.  I use them in my vehicle to keep my usb cord to my phone out of the way.  I use them around my charging station to keep the cords from draping on the floor and getting broken which can get expensive.
54,1,"I have very small ears and was hoping these would fit but sadly too big.  Yurbuds did say take picture of your ear and they would help you with fit, but just wrote back that there was nothing they could do for me..."
55,5,"At first I thought these headphones were purely wooden for style reasons, but turns out “wood provides the best sound reproduction there is”. Having used these headphones the sound quality is impressive however not more so than any other quality pair of headphones that I own, personally I really like these headphones but would recommend you choose them because you like their style and look, as the sound quality is excellent but comparable to other quality sets out there.<br /><br />In the box you get the headphones, a small hessian ‘eco friendly’ carry pouch and an extra set of large rubber buds and small rubber buds; the mediums that come fitted are perfect for me so I always end up getting rid of these spares.<br /><br />For me the best thing about these headphones is their look; I really like the wooden styling, they are different to any other headphones that I own and to me they really look sophisticated as well as understated.<br /><br />The sound quality is excellent through the bass tones and higher ranges, so they’re suited for all types of music as well as great for plugging into my tablet for when I watch films on the move.<br /><br />All in all these headphones are a pleasure to look at as much as they are to listen to, if you like how they look you will be very pleased with their performance. Recommended.<br /><br />I was kindly provided a sample by the manufacturer to review; the opinions expressed here are entirely my own view of these headphones."
56,5,I lost the charger
57,4,My patio now has music
58,1,"Although your description says it works in EU, the list of countries on the package does not include France.  Will it work in France?  I'll find out soon."
59,5,It's a Mediabridge product. What more can I say ......
60,3,"Paired with an Apple Watch, the Bluetooth connection only works when my Apple Watch is on the same side of my body as the Bluetooth transmitter on the headset - which is the opposite wrist that I wear it one. I was willing to overlook that because I liked the sound quality and they fit my ears great - they didn't slip or fall out when I ran and they were very comfortable. Then sweat happened. I sweat a lot from my head. These headphones could only handle it for about 3 weeks. Then they started not holding a charge for longer than 20 minutes. Now they won't turn on at all. I'm not even going to bother with calling JBL to get a replacement after reading the other reviews. If you're using these for an activity where you don't sweat much or you are just a naturally light sweater, these will be awesome for you. Otherwise, don't waste your money."
61,1,"Did not work, screen was fuzzy and after trying to get help with it from computer experts We tried to return it and they wouldn't return it."
62,3,"Arrived very quickly as stated,  not very sturdy,  wobbles from side to side,very difficult to put together for the pieces do not fit well ! I guess for the price its not that bad,  if you don't need instructions to put things together ! The stand came with no instructions but like I said some people might not need them!"
63,4,"The first pair of these I bought sounded really bad (no bass at all) and after I returned them and posted a negative review, the company contacted me and offered to send me a new pair for free. I took them up on the offer and tried out the new earbuds, which sound much better than the first pair. Kudos to Symphonized for making the attempt to have satisfied customers."
64,5,"replacement purchase, no issues"
65,3,"Lagged a lot. It's a durable wire, however, when we used it on our Samsung TV, the picture lagged. We thought it might have been the cable box but when we switched it to another cable, it worked perfectly fine. Then we put this cable back and it didn't work well at all."
66,5,Needed this to replace my older receiver so I could have an HDTV.
67,5,use it with my wii works great
68,5,Great product. Great price.
69,5,"Works great, wonderful sound, easy to use."
70,4,"Okay, first and foremost, I am not an ultra sophisticated audiophile. I searched for many years for a headset that was the equal to an ancient pair of RadioShack Realistic Powered Headphones with BaseBoost that I had used and loved for nearly 15 years before it finally bit the big one.  I like my music loud, clear, and with plenty of serious base. Yes, such a lowly brand made what to my experience was the best headset I ever owned.  To replace it, I bought expensive headphones from AudioTechnica, Sennheiser, Panasonic, Sony and more recently, Sol Republic, but all left me wanting more base, more volume, more clarity and that seemingly unattainable- more UMPH.  Hundreds spent, all for naught, my ears left drooping in disappointment.<br /><br />Then on a whim, I decided to throw caution to the wind and try Bluedio's R+ Revolution.  In a word, it really was a Revolution!  It was as if the Audio Gods heard my cries and decided to throw me a bone.  Oh what sound!  And the features! And the battery life!  What bliss!!<br /><br />Well, now the good folks at Bluedio have the updated UFO series.  So, is it worth it?<br /><br />First, by way of comparison, let's review the specs of the R+ Revolution:<br />-Has the same frequency response and THD as the UFO.<br />-Comes with Bluetooth 4.0 as opposed to the UFO's Bluetooth 4.1.<br />-Has the same audio jack as in the UFO.<br />-Has the same battery life, which is still astounding!<br />-Supports NFC for easy Bluetooth pairing.  Note that the UFO series doesn't have NFC.<br />-Supports USB audio when connected to a PC. The UFO series doesn't support USB audio, just USB charging.<br />-Includes a micro SD card slot for stand alone play feature with built-in equalizer.  Micro SD is not included in the UFO series, but does have 3D audio sound capability that lends a Concert Hall quality to your music and is great.<br />-Microphone included in both units for picking up calls on your mobile phone.<br />The R+ Revolution sounds aboutthe same as the UFO- I say about the same and it's likely because the speakers in the R+ headset are well broken in and the UFO speakers are brand new, so they should eventually sound the same in terms of loudness and clarity.  By way of testing on the UFO, I used a Windows Lumia Icon phone which has great sound, an HP Envy Recline PC with built-in Beats Audio sound processing and an Amazon Fire HD tablet.  Testing was done using audio cable and Bluetooth for comparison and I found you can get higher volume and sound via Bluetooth on the UFO or R+.  Sound is clear, base is booming, mids are decent.  Using phone\tablet\PC equalizer functions helps you get the sound just as you like it when you are connected via audio cable.  Easy peasy,<br /><br />The UFO series headset is well built and much lighter than the R+ Revolution.  It's very comfortable to wear for long periods, important when you also wear glasses as I do, as other headphones can cause pain when pressing against your ears while wearing eye glasses.<br /><br />So would I pay $200 for the UFO series.  Depends.  If I didn't need Micro SD card or USB Audio or NFC Bluetooth pairing, then the UFO series would be just the ticket since they are more stylish and lighter to boot.  But having been exposed to the many features of the R+, I can honestly say that for me, the new Bluedio headset is a bit of a simplification that shouldn't cost $200 if what you are getting is a Bluetooth 4.1 chipset and slightly better build quality and materials, which is why I gave it 4 out of 5 stars.<br /><br />Either way, if you are looking for a great pair of Bluetooth headphones that helps cut the chord to your phone or other devices and are looking for sound quality that is equaled to wired headphones, then by all means give Bluedio a try.  Bang for the buck, you won't find better sounding Bluetooth headphones for the same price."
71,5,These worked great. I needed a new set of headphones for the airplane. I watched a movie with them. Sound was great. I owned a more expensive set before and debated whether or not to spend the extra money and am very happy I didn't.
72,4,Bass is pretty good if pushed harder inside. Sound quality not bad for the price.
73,5,"Was a great speaker but it died on me when I tried to charge it the second time.<br />Sound is loud enough for music<br />Phone calls weren't so great, I couldn't hear the person on the other side and they couldn't hear me.<br />All in all decent speaker just wish it wouldn't die so fast"
74,5,"It was easy to install the mount and to hang the TV (60&#34; Vizio) on the mount.<br />The mount is strong and does not sag even when fully extended.<br />I find that it is not difficult to reposition the TV up or down if you firmly grip the top and bottom of the TV.<br />It is also easy to move the TV side to side by gripping both sides of the TV and turning and pushing/pulling it to the desired position. (I am 6'4&#34; so I have ample reach to maneuver the TV by myself, those with a shorter reach may need another to help assist in positioning the larger TV's)."
75,5,Awesome product! Fast delivery!
76,5,Great product!
77,4,"This inexpensive In-Ear Headphone set provides surprisingly good audio fidelity, especially given the price. I now have two sets of these and I keep them stashed for handy access in my car and at work (who knows, I may buy more to stash elsewhere - like my girlfriend's car). A pleasant surprise was how comfortable they are in my ear, but your mileage may very on that. When I first received them, I did an audio comparison using 'White Rabbit' by the Jefferson Airplane as the audio source. I compared these to my Sony Headphones, an Apple earbud, and a Koss earbud. To my surprise, they beat the Koss earbud. (imho) I'm giving this set a solid 3 stars for the sound which I think is pretty good for a set of earbuds... and another star for the comfort. (actually, only a half star) Honestly, I don't think you can go too wrong if you buy these."
78,4,"Great sounding speaker, compact and all around no complaints.  Do seem to lose bluetooth connectivity once in a while but only for a second and not much.  I had the beats pill xl and got this to replace after the recall on the beats.  Much cleaner sound at higher volumes.  Beats would force too much bass and distort, infinity cuts the bass back to avoid distortion."
79,5,Excellent products!
80,5,I love these headphones. The sound is excellent for the price and they are cuter than I expected.
81,1,"Save your $$$. Really horrible earphones. It actually hurts your ears to put them on, forget putting them on for an extended period. Secondly, they keep slipping from your ears. Had to return it."
82,5,"Works just as it says it would it converts RCB to HD and can be a little touch so you just want to make it is secure because if you touch the screen may go back to no signal. Works quickly and surprisingly when I plugged in my apple TV to it, it adjusted to the size of the screen and left no unseen edges"
83,5,"Fits perfectly on my headphones that recently had its original foam torn and broken. It's not the thickest, but its substantial enough."
84,5,I bought the speaker based on the comments of other buyers. For the price YOU cannot beat it.  It is a great product.  I already want to buy another one for work.
85,5,"These headphones work great for me!  My ears must be oddly shaped because earbuds just do not work for me, and I don't want the headband version while I am at work.  These sound great and stay attached.  What more could you ask for in a pair of headphones?"
86,5,"An excellent resolution to my needing more volume and not disturbing my wife.  fits VERY well, battery last a LON time, and very comfortable to wear.  No complaints.  I was so impressed I bought a second set for the bedroom TV."
87,4,"Sweeeeeet headset!!  For the price, you can't beat these headphones. Good sound through Bluetooth connection. Haven&#34;t heard the corded sound yet..assuming it should only sound better that way. Decent bass response. Not overwhelming like other overpriced, name brand headphones. I'm not an audiophile, by no means but I know a great buy when I see it and hear it."
88,5,good ! the sound is very good!
89,4,"I opened it and plugged it into a couple of old Polk RT5s. Incredible power for such a small amp. I did end up buying an eq to tweak the sound, but its a great little amp for the price and size."
90,4,Works but you have to sometimes toy with it with some TV's to get the sound to work by plugging and unplugging again and again.
91,1,Didn't work. Threw in garbage. Wasn't worth the effort to try to return. No Zero star rating?
92,1,It only last me 3 days after that it's not working at all.
93,5,This is the best money I have ever spent.  They are easy to use . And aren't too bad to look at and all my CDs are stored according to genre.  I love it.
94,5,Worked great.
95,5,"Nice and long , reliable and a fraction of the price you will find at a brick and mortar store. I use it with a DISPLAY port adaptor on my MacBook Air and it functions flawlessly."
96,5,"It if, it came on time. Really impressed."
97,1,Poor....no directions. No software
98,1,There's a lot of feedback and it doesn't work with some devices
99,5,"Yes, it is good, nice bass, right level of middle and high frequency"
100,5,"What a great gift for someone who does not even know they exist.<br />I have bought a lot of Belkin products, and all were well made for the price, this too.<br />My daughter loves it, and her husband is an IT guy and didn't know these were available. Usually he is helping me, it was nice to return the favor."
101,5,I love these cans! But they are a little hot in the summer.
102,1,It fell apart and never worked.  This was a total BUST!
103,5,"Real APC genuine battery, excellent quality. Just as shown on site. I am an IT professional with over 30 years experience and the APC brand is worth the few extra dollars. spend the money and get the best. They definitely last longer and are better made."
104,4,"I contacted Amazon because I thought the Digital Audio Player was defective, but it was not. The headphones that came with the unit were defective, but the player itself was so worth the money I paid for it. This is the second unit that I've owned, with the last unit purchased 7 years ago. I was lucky to have found this unit at a reasonable price on Amazon. The only reason I didn't rate 5 stars, was because of the defective headphones. I will continue to shop with Amazon."
105,1,Junk. Use the freebies at the theatre.
106,5,Great sound from a little speaker. Love it!
107,5,excellent
