,star_rating,review_body
895,5,"I tried another well-reviewed product, and this one seems a much better combination of low price, small size, quality build, great and balance sound, enough bass to hear a jazz bass solo, and classical organic music. It's really am amazing combo for an audiophile on the go! I think one would have to go much larger -- too large for convenient travel - to get more bass. Put it in a corner and the overall balance is very listenable, even to an audiophile who needs clean, full sound and is a critical listener for years. Great choice!"
896,4,They work great love them
897,5,"Sounds great, perfect for beach or on the go"
898,5,"Verbatim make the best cd-r's and especially dual sided dvd's.<br />If you want something you can rely on get Verbatims. I've yet to have a &#34;coaster&#34; with these, which is why I buy them."
899,5,I was very pleased with the sound quality and the time that it took to get from Japan here.  You did a great job and thanks.
900,3,"Cuts out every once and a while from 10-15 feet away.  Maximum range on this is DEFINITELY 33 feet, it's unusable at 30."
901,2,"....sounded good while they lasted, I brought 2 of this model, one for my son...that pair one side stopped working, my paint noise reduction stopped working, his pair lasted a year, mine 18 months. The price now is a lot lower than what I paid. I feel like my money was wasted. I will say when listening on a plane the quality with the noise reduction was very good, the sound quality was very good. Long term use for the price was terrible."
902,5,"Love this thing!! The only issue is the cord that plugs into your iPod is a pain in the ass to get it back in it's spot to close the door for water tight seal. Other than that, it's amazing!"
903,4,Great head phones but converter causes a bit of sound loss
904,5,it works!
905,4,Picks up a lot of channels for sure. I live in southern California about 45 miles south east of LA and I get tons of channels.
906,5,"Had to add a signal amplifier because of my distance from the towers, but this is the only antenna that I could find that will pick up all the stations. I would buy it again in a heartbeat.  Easily mounted it in my attick."
907,5,using them to run pc to a 70 vizio and 55 sony lcd have had zero issues wow great quality I will be buying more to rerun every cable in my house if you think they are cheap made they are not but to be honest I thought they would be glad I was wrong
908,4,works as needed
909,5,"I have searched many online stores for the right power supply for my Shuttle SN78SH7.  I ordered items that appeared to be the right match, but I ended up returning them because they don't fit in the slot and some are completely different PS all together.  I was very happy to receive this PS that is exactly the right PS for my computer.  It is an updated version of my old one but nevertheless, it is the right PS - connectors, mounting slots, etc.  Thank you for meeting my needs."
910,5,"I have Sony products for years, you really can't beat Sony for quality.  Also, they arrived promptly and as the ad stated they would."
911,5,Remote arrived on time and works perfectly.
912,5,Really cleaned up the rear of my TV...I no longer can see any wires.
913,2,"The antenna would only pick up the local Fox and CW channels. Most of the broadcast towers are southwest of my home. Unfortunately, I could only face the antenna north or west. As a bird flies, the towers are about 30 miles from my location. Apparently, too much interference lies in the path of the signal. Regardless, I still cut the cord. Amazon Prime is my friend, along with Netflix."
914,5,"Excellent MP3 player. I bought one for myself and for a friend who loves it. The mobility is excellent, the radio works very well."
915,5,i am very happy.  Fast delivery and excellent quality.
916,4,"Great product with crystal clear high quality sound and zero static.  The wireless signal allowed me to walk an estimated 60' with several walls along the path.  My hearing isn't as good as my wife's so I primarily bought to use with the TV so I can turn the volume up without being too distracting to her.  However, my TV didn't have the headphone connection and only had the digital 'Toslink optical' out.  Since the transmitter didn't have an optical or hdmi connection I had to purchase a digital to analog audio converter which didn't work at all.  I purchased the DBTech from DBROTH here on Amazon and I was only able to get audio to work on the right ear of the headset.  When I bypassed that device and just plugged up to my Samsung tablet the sound was absolutely great.  I'll have to return the DBTech converter and try something else to get it to work with the TV.  If the Sennheiser transmitter would have given more connection options I would have easily given this product a 5 star rating.  Once you are able to get the 'audio' sourcing and cabling issues resolved this is a 5 star item that costs MUCH less than other highly advertised sets such as the Beats Audio.  These are very lightweight and comfortable."
917,5,I dont have the watches yet but the others are wonderfull
918,5,"The bulb came on time, installed easily and works great."
919,5,Great headphones!!
920,3,"It's a nice little device, but it stuck to the wall then fell 10 minutes later and then the sound got a bit muffly and it still is a bit! Plus, when you turn the volume all the way up, it makes it basically where you can't understand anything because it's so muffly. :( At a lower volume, it's OK, but I'm one of those people that likes it loud, and it doesn't seem to do that well enough for me."
921,5,works exactly like advertised. great addition to the bathroom!
922,5,"Ordered this for my surround sound in my barn. It works great upstairs and downstairs and the sound is amazing ( used RCA jack on my receiver). This will go through wood but not metal, the siding on my barn is metal. Played spiteful from my iPhone for 6hrs+ no issues at all."
923,1,erroneous.
924,5,Ibought this product along with the Digitrex Digtal Analog converter box
925,5,"Great items, had a minor problem and I contacted the seller they got back to me in a timely manner.  I would suggest this item works great with Samsung note 3, and Samsung S5"
926,5,sturdy and good looking
927,1,Battery life is horrible.  Only about 20 minutes - not exaggerating.  Returning immediately.
928,5,Super deal and works well
929,4,Needs cross fade feature. Other than that its great.
930,4,"Let me preface this by saying I am in no way involved with the hi-fi audiophile subculture, and am reviewing this from the viewpoint of your run of the mill 'I only listen to music from my phone' consumer.<br /><br />These headphones are, quite obviously, a very nice looking piece of equipment. Real walnut panels, steel construction, plush pleather cups and headband cover. Light, for all that steel and wood. On my pair, I noticed a fair amount of seeping out where the padded pleather meets the steel headband, an aesthetic niggle, it seems quite securely attached.<br /><br />My other concern is the wire between the cans and headband. The cans can swivel towards each other, and the only thing stopping the can from going all the way round is that wire. Seems like a definite stress point.<br /><br />All said, the sound quality is wonderful. Not the ear rattling bass emphasis of Beats, SOL Republics, or even a pair of Skull Candy Hesh's I got from Target for $40, but they are aiming for clarity, not overwhelming bass. Not that the bass is weak, it still resolves in a sonically pleasing way, but if you are looking for some shaking in your ears, you won't be thrilled. They have something of a mid range hump keeping from being truly flat, but like my preface states, I'm not looking for true studio quality.<br /><br />As John Q. Consumer, not an audiophile, not someone looking to wear headphones for the supposed prestige of the brand, not someone who listens to EDM and hip hop exclusively, I can recommend these. They are comfy, sound good, and have what I can only call a 'handsome, manly' aesthetic."
931,5,they met my expectations
932,1,6 months later and it wont charge.
933,1,"have had several of these which functioned ok for light duty - most recent purchase ate two sets of batteries in one week, obviously something wrong / shorting out - sent back - maybe try one more and see if get lucky?"
934,5,Pretty good bluetooth  device. ..Just as good as any of the other major brands. ...
935,5,Super cheap worth the money
936,1,Worked for 7 minutes then broke...
937,5,Perfect exactly what I needed for the one television. Didn't realize that I needed a Male Connector for the other television. I will have to return one cable.
938,2,"I was so excited to get this because I don't have cable. I tried it in 10 different areas but unfortunately, all I could get were shopping, Hispanic, and religious channels; not one regular network channel."
939,5,As expected! Great value!!!
940,5,"By far the best sounding Wireless headphone.  It is also nice that I have multiple sources plugged into it and can change from the headset. Distance isn't quite what it says, but I could go 60+ feet from the receiver in my house. If i needed more I would listen somewhere else."
941,5,"Bought this because of reviews and Tripp Lite name and reputation. I don't know anything about the engineering behind it but it works, no problems, no buzzing, nothing weird. Would buy again if I had to. Owned six months."
942,5,Seems well made.
943,2,"Worked only once, then the smaller connector came loose.  We're returning it because it is worthless."
944,4,Everything was as advertised and worked well.
945,4,The only thing it is missing is a USB port for charging my phone. I can definitely read it at night even without the red display on the ceiling. The low setting for the display might be too bright for someone wanting a very dark room. It does have a setting for the display to turn off automatically. Add a USB and this would be 5 star.
946,5,"My previous receiver was an Onkyo NR-709, which while being 2-3 years old, is roughly equivalent to this receiver, and in some cases  is better than this receiver, while at a lower cost point.<br /><br />So lets go over the basics.<br /><br />- 7.2 Channel, lets you bi-amp front speakers if you want<br />- Multiple zone, including multiple hdmi output for zones (this is unique, but maybe not worth it)<br />- Connections (MHL, Airplay, Wifi, DLNA, Bluetooth)<br />- Fast on screen display.  Quickly shows up, easily selectable, fast switching.<br />- Almost everything else you'd expect in a modern receiver (6 hdmi inputs, 2 outputs, various optical/component/composite inputs for video and audio).<br /><br />So far this has kind of seemed like an upgrade in some respects, especially with connectivity, built in wifi/bluetooth/airplay, etc make this really nice to integrate into my network.  But other things it feels like a side grade or event a downgrade.  For instance you can name and setup most of your inputs, but when you select the input it doesn't usually show up on the text on the receiver itself.  I used to fumble hitting the different buttons on the remote until I found the right one, but now you click on watch, which brings up the on screen display and you select from there.  It works and I've gotten used to it, just feel like I miss the label of what is current selected (maybe there is a way to do this and I just haven't figured it out).<br /><br />Sounds quality is quite good, although the speaker setup uses Sony's own audio setup with their own mic.  The good news is that it is incredible fast.  Bad news is that it might not be as good as Audyssey, but I can't tell, so we'll go with good enough.  Choosen different 'reference' rooms and such seems a bit of a gimmick, but overall the sound feels quite good and for some reason seems a bit warmer to me than my previous receiver.<br /><br />It feels like it's roughly inline with offerings from other companies, butpotentially not standing out.  The zone 2 HDMI seems to set it apart, but otherwise this is a good looking good offering in this price range."
947,4,"Exceeded all of my expectations, especially for the the price that I paid. I would recommend these to anyone. A+"
948,1,"I am really enjoying it,However I cannot appreciate having to send the defectived tape player back. That is costing me money and I don't think that is fair at all"
949,1,Did not give me 1 channel!<br />Probably ok for non mountain areas<br />I get 2 channels with an old antenna on the roof!
950,5,"I like it very much, there is only one thing which is that will be better if has a battery to be played without conection.<br />Beside no complains at all. Good job."
951,5,"Lucky to find a 13v replacement battery to fit my old (but like new) Craftsman drill.  Product arrived as scheduled, well packaged, and was what I expected.  A few hours on the charger and I was ready to go ...  :)"
952,5,"This is fantastic for travel, as it has USB ports so you can easily charge your phone/Ipod. No complaints at all! Been using it for the past four months living abroad with absolutely no problems."
953,3,"It's okay for what it is, a budget low power amp. I am using to drive two Yamaha outdoor speakers. Sound is mediocre and vloume has to be cranked up for only moderate sound levels."
954,5,"This product does work for me big time. It is just what I was looking for, at a great price. Not much more to say, other the I have a McIntosh Amp and Sennheiser head phones. GREG"
955,5,This speaker has great sound and still fits perfectly in my medium size purse. I plan on purchasing another one soon.
956,5,I forgot how vivid the colors were until I had to replace the bulb.  This one works great and much cheaper than the Phillips
957,3,"The Sennheiser IS410 Wireless Ultra-lightweight Assistive  Listening Stereo works just fine, however, they did not<br /><br />send me any earphone cushions to go with it.  So I rate them only a 3 star since they did not send me everything the<br /><br />unit claims it would.  Without the earphone cushions it is painful to use the unit.<br /><br />Raphael  Chrastil<br />P.O. Box 88<br />Dorchester, NE.  68343<br /><br />order # 104-1863509-1425828"
958,1,Knock off - Replica beats by dr. dre.<br /><br />Buyer be aware !
959,4,"I read on another review about them being a little heavy, they are more than most. After I changed the ear bud piece(double budding buds) they fit in my ears better and you can hear the highs as well as the good bass. The volume(up & down) control works okay on my BlackBerry 9900, but not switching tracks did not. To answer a phone call while they are still plugged in worked okay too. This model was only made for Apple & Android phones. Koss does make good quality sound headphones, that's why I wanted to try out this model Ear Bud plus Microphone to use with my cell phone, I have NOT had anyone say to me while on the phone...&#34;What did you say&#34; only &#34;where are you I can hear some birds&#34;...lol I was outside at the time...:)"
960,4,The headphones work well.  I did have a little trouble adjusting them to my small head. The sound through the headset  is excellent.
961,5,"This is the first turntable I've owned since I was a kid (it's been a few decades), but turning this on and delicately dropping the needle to the vinyl again was so much better than jumping back on a bicycle could ever be.  This component is super-solid; it is everything that is advertised and more, from the sturdy construction to the pop-up light to help you perfectly set the stylus at the exact spot you want, it was a fantastic father's day gift for me.<br /><br />Remember back when you would walk across the floor and the record would skip?  The legs on this thing act as baffles to absorb basic shock so you don't have worry about it.  And now I can pull out the old LPs and 45s and convert them easily to MP3 so I can enjoy them in the car.<br /><br />All the great features I loved before in a turntable are here in this one -- perfectly set the arm pressure with a slight twist of the counterweight balance; perfectly adjust the speed with the strobe light -- but get this, wanna know what John really said at the end of Strawberry Fields?  Just flip the switch to reverse and play it backward.<br /><br />Anything bad?  No.  The only thing I can think of is that it would be nice for the arm to auto-retract at the end of the album, but no biggie. This is high-class retro at its best!"
962,5,This is a great little speaker. I love the clarity! I also love the amount of volume you get from this.
963,5,Now I can watch my movies in the comfort of my favorite spot on the couch LOL. I would definitely recommend this to other people! No quality lost whatsoever. High quality product.
964,1,Didn't work and parts were missing.  Tried for several days to figure out how to work it to no avail.  No instructions came with it.
965,4,"These rechargeable li-ion batteries are great for medium to high use scenarios (I use them for powering a wireless mic).<br />The charged voltage is 8.4V, which is good (better than 6 cell NiMH batteries which only give 7.2V).<br />These batteries, however, are bigger than typical alkaline 9V batteries.<br />Mine measure 0.692&#34; x 1.030&#34; x 1.800&#34; (excluding terminals).<br />This very slightly exceeds in thickness (0.689&#34; max thickness), but should just fit in most devices.<br />It will usually be tricky to get out though.<br />Capacity is far better than NiMH alternatives (600mAh vs 300mAh), and even exceeds standard alkaline cells.<br />So they're good, as long as they fit!"
966,1,Blew after a year . Not happy with  it . It sucked in my tj. Wrangler . A slight step above stock but not impressive.
967,3,"Decent mount but on my Polk Speaker that weighs exactly 10lbs, it can't hold it. Everything slipped out of place and then stripped when trying to tighten more. Would be good for a 8lb speaker or less."
968,2,"listed as 66lbs. capacity but box says 45lbs. and hardware kit was not complete for proper mounting. I wanted to use this for an older(and heavier) flat panel. This mount was inexpensive and appears to be a decent value, however,  I'm not confident enough to use it for my application. I guess I would use it for a lightweight unit."
969,5,"I had an Edge on my Integra (Onkyo) receiver, then changed to an AF-1 but still had a hard time picking up KALW, the oldest non-commercial station west of the Mississippi: lots of hiss from their weak signal, so I took the dive into the FMPro.<br /><br />Aesthetics prohibited putting it high up on the inside wall, and when it was down low the signal was really bad, so I mounted it outside, horizontal, pretty much facing San Francisco.<br /><br />Clear crisp signal now, ready in time for Sunday morning's Philosophy Talk program.<br /><br />Do note that cable from the antenna to the receiver is not included so there is some additional expense involved."
970,5,"I'm not a Polk fan. In the past every Polk speaker I heard was overly bright and fatiguing to the ears. With these, I'm now leaning toward changing that opinion.<br /><br />These are not bright, nor muddy or boomy. I would say they are just right if understandably lacking in the low end. For surrounds they are perfect as those channels are dominated by the higher frequencies this speaker reproduces so well.<br /><br />Well made, solid boxes, perfect compact size, and they look good with and without the grill."
971,5,Good quality. It works well for drowning out my kids noise and its okay when I mow the lawn while wearing them.
972,3,"I bought two of these, one for wet cleaning with distilled water, one for dry.  The only complaint is that the pad wants to separate at the edges in the wet mode.  Otherwise it seems to do the job on vinyls.  I also use the dry brush to clean my bigscreen TV."
973,5,I ordered this adapter just a couple of days and it arrived in great condition. I was able to connect it to my tv with 3.5 mm adapter  and was able to make it 'wireless' right away. The range and sound quality is pretty good considering it uses bluetooth 2.1
974,3,"As with most of the reviews I would say it's usefulness will be hit or miss.  The primary reason I purchased was that my Fox affiliate had a very, very weak signal and this did help mildly but not to the extent I was hoping (any weather/wind still seems to degrade my signal significantly.  For 11 or so dollars I would say it's worth a shot, just don't expect miracles."
975,4,"The product provides multiple channel, but is not any better than another cheaper model I purchased for another television. The best thing about the product is that is thin and can mount is tighter locations."
976,5,"My son is Spiderman super fan, the headphone is a good quality one, sounds is great. The best gift for my child"
977,1,"I am not using it as much as I expected because my old clock radio is still working, however I think that it will be just what I wanted once I get used to it.  I'm afraid I still have not yet figured out all the intricacies of using the alarm, not that its difficult but because I am an old lady.  Please excuse my rather lame evaluation.  Just say I like it!"
978,5,"This is simply a very short 14/3 extension cord.  I bought 6 of them to hook up to six 12V lights that have the transformer on the plug, right where it goes into the wall, or power strip.  (This was for an exhibit at a trade show)<br /><br />The transformer is very wide so you can only put two of them on a six outlet power/surge strip.  I didn't need or want to pay for a longer 9' or 12'. extension cords. I simply put the six 3' Tripplite cords into the strip then put the 12V transformer into the cord on the other end.  Without them I would have had a large, expensive, and unwieldy &#34;daisy chain&#34; of at least 3 power strips to accomplish the same thing.<br /><br />These would also work well with some of the &#34;offset&#34; plugs that come with computer equipment that cover multiple outlets on your power strip.<br /><br />Highly recommended for this type or application!"
979,5,I wasnt looking for anything special but the nyne bass caught my eye only because it looked cool and easy and convient for traveling. Sound quality is amazing i would recommend this.
980,5,"Walk into  any big box retailer or electronics store and ask if they have any dual driver earbuds. They won't have any idea of what you are talking about. I guarantee it. Nine times out of ten, they will simply walk you over to the Beats by Dre section and tell you to buy Beats, based solely on the fact that they have a nice display--so they must be the best. And they are the most expensive, so they must be the best. And they have a cute, fashionable, lowercase 'b' on the side. So they must be the best.<br /><br />This is a terrible way to make a purchase. Don't do it that way.<br /><br />Online customer reviews are driving product knowledge--and that is how I learned about dual-driver earbuds. The technology is simple to understand. When you look at these earbuds, you can literally see the split delivery system coming from each driver.<br /><br />You don't have to be an expert to appreciate good sound when you hear it. Listen to your $10 earbuds. Then listen to your Brainwavz R1 earbuds.  You will immediately know that you made the right decision. It's that simple.  Yes, there are single-driver earbuds that will produce comparable sound, no doubt about it. But listen to some old favorites on your playlist and sometimes you will hear things on the track that you never heard before.  It could be just a few seconds here and there. But I believe the dual drivers make a difference.<br /><br />Good quality, good performance, good affordability. I like 'em."
981,5,"Devices:<br />-Bose Bluetooth v2.0 (Right Ear)<br />-Jawbone ERA (older model)<br /><br />This is a neat little case! It's crush-proof for when I throw it in my backpack, yet not too thick for when I carry it in my pocket. I got 2 of these (1 for each device) and I found that they are big enough to hold both of my headsets in one case! Great investment if you carry a bag everywhere and use a bluetooth device regularly."
982,5,Fits my K240 AKG headphones perfectly without any wasted space.  The case is well built and should protect headphones well.
983,5,"These earbuds have very good sound quality (to my untrained ear), are more durable than most, and are a great price.  On top of all that they have an ergonomic design that is unlike any others I have purchased.  One earbud is offset to the right and one to the left, which makes for a much more comfortable fit."
984,5,hook up was easy all paper work included came with charger cable. all warranty info was easy to read and understand.
985,5,I was considering Bose for my theater system. I came across this Klipsch system and took a chance on it......turns out it was a great decision. It's a great system and I could not be happier with it. I have been recommending it to all my friends.
986,5,"Easy to follow instructions with sturdy construction. Looks great!!! If you are looking for a great mount for a really good price, then this one is for you."
987,5,Very easy to instal. I have samsung 55'' . It is holding it on strong. My friend put it on for about 15 min. So far so good
988,5,I like the way these are made!!! I have two as I may need a spare for a second tv...Good Product
989,4,"These headphones are great for the money, I really like that they have batteries in the headphones so it doesn't use that much of my phone battery."
