,star_rating,review_body
892,4,"I got this alarm clock after my old Emerson failed me. Failed as in the daylight saving time was set to the old standard and twice a year I had to manually changed it and that day I was late to work.<br /><br />I read several reviews and opted for this simple one and paid extra for the color I wanted.<br /><br />Pro:<br />- Easy to operate<br />- Gentle on the eyes (I find green is better than blue or red)<br />- Dual alarm for my spouse and I<br />- Large numbers<br />- Compact<br /><br />Con:<br />- Dim (I read about the light intensity and I do agree it's dim, I prefer it dim but even I think it would have a larger range instead of dim or dimmer)<br />- Small off button mixed with other buttons (but it's concave so not too difficult to find)<br />- Buzzard weak (I read it was more of a peeper and it's true, not the abrasive sound I've grown to love)<br />- On knob delicate, to easy to turn by mistake, I liked the slider (but if stiffer with a click would be fine)<br /><br />I have used it for several months now and I would order again, found the same model at target also."
893,5,"The ear buds came with multipel sized gels to change so they fit my 6 year old daughter as well as my 13 year old son, the sound is also great, I will be ordering a set for all 4 of my kids in there favorite team. No more fighting over who's ear phones are who's."
894,4,Works fine but keep in mind there are only three battery-protected outlets. The other three are surge only. Plugged the USB cable into my Mac. It detects the unit properly and my Mac's UPS service default settings are perfect for me. I using this to replace a Cyberpower UPS which fried on me after seven months.
895,5,Other rechargeable batteries don't seem to have a high enough voltage to stop my camera from a premature death by power loss. These Eneloop batteries are terrific. Long life during use or just storing the batteries in the camera with power turned off.
896,5,A little pricy but an excellent investment for the &#34;thunder capital&#34; of the U.S. (central Florida) - feel a little more secure with my electronics...
897,5,a gift which allows you to set the time yourself without having it done automatically so you can be 5 minutes ahead
898,4,This is an OK Radio.I expected better and louder sound.I do wish I ordered the CD Player as well. Don't know if I can add this CD player to the Radio
899,2,cNet gave this a very high recommendation so I purchased for home use.  Very surprised upon receipt. Did not fit well and the sound was nothing special -- about the same as a pair of $39.99 in-ear buds. My old etymiotics and shure models much better. Would not recommend at this price point.
900,5,"Received very fast, works as described, no problem in pairing with my HTC Desire Z (T-Mobile G2).<br />Charges very fast too."
901,3,The touch screen is either extremely sensitive or the mp3 is defective. It will randomly try to recalabirate itself everytime you try to change a setting or add items.
902,4,These are the best case I could find for DVDs that allowed me to have the original movies fact sleeve. Great to keep the DVD/blueray/ extra discs all together. The tab to close doesn't hold we'll when taking the case in and out if my storage box so I just fold the tab inwards- works great.
903,5,"Worked great for passing cords through a wall into another room.  One room is cold, the other is warm so using one of these on each side did a great job of letting me pass the cabling through without ugly holes and cold air blowing in."
904,5,"I was initially a little daunted by the number of protector sheets provided, but once I sat down with the Motorola to apply them, it became easily obvious where each was to go. I am QUITE impressed with the quality of manufacture and the PERFECT fit of each piece. Also impressed by the full side coverage the product gives, not covering just the touchscreen face, but the sides and the back bezel, too!<br /><br />Easy to apply, and easy to smooth using the tool provided. I'll order from you again.<br />DAB"
905,5,"I received these for Christmas so my review is not a verified one but these are so stellar I had to write a review anyways.<br /><br />One of the first things you will notice about these is they do not need to hook to a normal stereo to work like most other headphones.  You can hook them to any device (HDTV, DVD, computer, TiVo, Xbox, etc...) that has a toslink optical audio output.  You can also hook them up with standard red/white RCA cables but then you don't get the advanced sound with dolby digital.  I have mine hooked to my TiVo, Xbox 360 and BluRay player with a 3 way optical splitter.<br /><br />Let me say that I am a headphone person and have used MANY MANY headphones over the years and these can match the sound quality of any of them.  Crisp highlights, good bass and the headphones cover your ears completely blocking out most outside noise.  Of course sound quality varies for each person but I am very happy with it.<br /><br />The wireless distance is OK but not the longest.  They work perfect in my living room and a little down the hall but when I am in my kitchen, roughly 30-35 feet the sound gets spotty.  The same when I go to my computer room, you have to stand on one side to keep the signal active.<br /><br />I have 2 different wifi routers in my home, one two feet from the base unit, and notice no wifi interference at all.  My iPhone and laptop have no problem connecting and staying connected when using these. I am adding this as I see some reviews stating the opposite."
906,5,It was the right product that I was expecting. Perfect for my Onkyo! I love it and recommend it to everybody.
907,5,I haven't attached these to the wall yet but i have mounted one the the speaker and let me tell you. For the money there is no way you can beat them.
908,2,the hdmi curves towards my tv not away from it. doesn work on my 24&#34; sony or my 60&#34; samsung
909,3,station tuner turns very hard and does not receive nearly as many stations as my small sony..would not buy again
910,5,This item arrived quickly.  It arrived in excellent condition.  It worked exactly like it was supposed to.  The item met a special need very well.  Thank you Amazon for having it.
911,5,This is a very fine product for those wanting a good AM/FM/MW/LW and SSB radio.  The receiver is one of the best that I have every heard.
912,3,"This remote works well with all of my devices, but it is very difficult to use because the navigation pad (the round area with the arrows) is way too small and I often click the OK button in the middle while I am trying to navigate.  Vice-versa, sometimes I try and hit the OK/Select button and I press one of the arrows instead.  My fingers are not big, so it isn't a matter of me having fat fingers.  The navigation circle is just too small.<br /><br />Aside from the above issue, the remote is okay.  The backlight function operates fine, although the Channel Preset and Guide buttons' icons are not backlit because the buttons are red instead of being able to be lit from behind like the other keys, which is a strange choice.<br /><br />Overall it is an average, inexpensive remote that is hindered by the navigation pad being too small."
913,2,"I chose this because of high reviews and the length of the cord is awesome, however mine failed, and I am not as impressed as I was upon buying it"
914,5,"Good solid product at a good price. I used these to connect the antennas on two Shure SLX receivers. They have been operating well, and this is much cheaper than buying Shure's kit if you already have multiple single receivers and need to connect them. We also had the BNC cables so this was a no brainer."
915,5,HDE Mini DisplayPort to VGA Female Adapter for Mac<br />HDE Mini DisplayPort to VGA Female Adapter for Mac<br />HDE Mini DisplayPort to VGA Female Adapter for Mac<br />HDE Mini DisplayPort to VGA Female Adapter for Mac
916,5,The product fully addresses my requirements and i would recommend it to anybody with similar requirements. Please keep it up.
917,1,This was a piece of junk I could easily rip apart with my hands.  I wanted something for use with a phone and an earpiece.  The cords with 3 sections on the male side carry audio only.  I just threw away in the garbage can after it arrived.<br /><br />There are a lot of bees going around.  You have to get the kind with four sections on the male part to use as an earpiece plug in for use with and earpiece and a phone.  The cords with only 3 sections on the male piece will carry audio only.
918,5,"i loaded this myself with music and use it in my car all the time.  i wouldn' consider myself a techie girl, so it's easy to use and has been durable.  my mp3 slot in the car hangs out the front of the dashboard and it's been whacked byt he kids more than once.. still works!"
919,3,"These were much bigger than I thought they would be.  On the positive side they are thick, great quality, and have a hard outer core.  So even though they are bulkier than I would normally like they will work fine for what I need them for.  The black one is for my son because he is is always losing the covers to his ear buds so this will help with that plus it will protect his earbuds in his backpack.  I took the pink one because I needed something to protect my $100 Bose ear buds in my backpack for college so they aren't smashed and this will do the trick.  If you are looking for something that will fit in your pocket to protect your earbuds then this is not for you!"
920,5,"Okay. First off there is something people should know. There is a difference between the ACTUAL detox headphones and the knockoffs. The ones that are coming to people broken are the knockoffs. There is a huge difference in quality with the sound and the construction between the knockoffs and the actual Detox Pros. Yes the Detox headphones are essentially Dre Pros but black. DETOX IS A LIMITED VERSION. Only a set number of these were made and won't ever be made again hence the extra 100 dollar price tag.<br />Now to move on to the headphones themselves. These things are great, best sound quality of any other headphones on the market. The lock in system where the audio cable fits into the headphones can be switched to either side. The swivels on the ear cups make it easy for me to switch one ear up to listen to the speakers playing the music while the other side stays close to the head and still stays at clear high levels that I can hear over the crowd and stage speakers. The construction of the phones themselves are steel and aluminum making it a very hardy headphone. You actually have to try to break these things to mess them up. The stereo jack comes in 2.5mm with a slip over 3.5mm converter, these things are also gold plated, allowing for the best connection. People complain about the comfort level but the headphones due come tight, so obviously if you have a big head they might cause some discomfort. Fortunately for me my ears fit into the cups and I have had these things on for 4-6 hours both in and out of a DJ booth with zero discomfort. The cups come off so you can wash them. I paid 500 dollars for these in store, the original price being 600. Yes they are crazy expensive but think of it like a Eddie Van Halen Guitar, sure you can find cheaper guitars that do the same thing but its suppose to be something of a collectors item. If you can find someone selling their pair pick them up, but if you just want the same function without the extra price of the Detox logo go for the regular Dr. Dre Pros.<br />I will say everyone eyes these things so keep an eye on them."
921,3,"This is the second Skullcandy headphones i get. The first one last almost three years, what is a good time considering i used them continuously. This new pair looks very delicate and made without resilience in mind. The sound is good thou, and the mic does its job."
922,5,"I purchased this product so that I could run back-ups from my laptop. They worked great and I am happy that I purchased these. Buy from Amazon with confidence, as I do!"
923,3,Cool but meh. Very glad to have 3D on your home. But its a lot of pain to find game titles and active the whole system.
924,5,I bought this for my Grandson's bedroom so he could listen to music at night. It's sturdy and the sound is very good for the price.  I would certainly buy another if I were in the market for one!
925,5,I've only have for like 3 weeks but it has never haven me a problem since I bought it and compared to another hdmi I purchased in the past from Ross this one is much better quality :))
926,4,"for the price, exactly what i expected,ordered 12 pair received four pair, refund was swift and i cant complain too much, 4 stars for the shortage of plugs"
927,1,"I would not recommend this subwoofer to anyone! I purchased this sub to complement a VIZIO Sound Bar. After hooking it up and giving a listen, there seemed to be no sound coming from the subwoofer. Holding it in your hand you can feel some vibration, but you have to strain to tell it is producing sound. This product is \\""rated at 75 watts\\"", but it has an output that sounds lower than my 10 watts computer speakers. The Insignia Subwoofer has a \\""standby mode\\"" and if you put your television in mute, then the sub goes into standby mode and doesn't come back out until you get up and push a, very difficult to find, button on the back and wait for the blue light to go on. I couldn't even tell that it was not working for a half hour until I noticed the blue light wasn't on. It is that low. Save your money! Do not buy this!"
928,3,it does what i bought it to do so im quite satisfied with thus purchase not much else to be said about it.
929,4,"Just what is adcertised, they work perfecly with my iphone and the look is good too, nothing over the average but good enough"
930,5,"I have had bought tons of HDMI cords over the past for new Tv's i have gotten and for phones and i have to say  this is the best one i have had (some how my HDMI disappearing )  for the price and picture! love and the service department i give a A+, life time warranty for the under 20$ price awesome! i would definitively recommend this for someone who wants great quality video for the best price."
931,2,"Found the bass just too much, music sounded muffled. Also was uncomfortable after wearing for extended periods. Bought it from third party with restocking fee, so will keep them, but will continue searching."
932,5,"When my Bose Sound Dock stopped working, I took it as an opportunity to upgrade to a more portable alternative.  After many hours of google/YouTube research, I decided on a less expensive alternative then my amazing wife surprised me with the SoundLink II.  I am not a technophile with magic ears, but I do love music.  I must say I am completely satisfied with the rich full sound of this speaker.  I have no complaints, only praise to Bose.  If you are looking for a portable speaker, spend the extra cash and get the Bose SoundLink II."
933,5,Keep your Roku away from prying eyes and sticky fingers with this handy Roku Mounting Kit.  Fits like a glove and keeps your Roku safe and sound.
934,5,Exactly what my husband was looking for. Works great ! thanks for the quick mailing...we are happy with your service..thanks
935,5,Have only used for 1 run so far.  Ran 7 miles and these headphones never felt loose or at risk of falling out.  Much better than anything I've tried so far.  Sound quality is good as well.<br /><br />The headphones didn't fit me directly out of the box. I spent a few minutes of frustration trying to get them to fit as pictured on the box.  Once I changed sizes of the supplied accessories (eartips and ear clips) they fit great.  I would highly recommend spending some time to get the perfect fit.  The supplied case is an added bonus when on the go.<br /><br />I tried taking a call using the supplied speaker built into the volume control and the sound quality was horrible.  There was a bad echo and strange noises coming through the headphones.  Not sure if it was just a bad connection on my iPhone or a issue with the hardware.  This isn't a big deal to me since I rarely talk on the phone while working out.<br /><br />Would definitely recommend these to the runner who can't quite find a set of headphones that meet their needs.  These just might do it!  They worked for me.<br /><br />Amazon Prime shipping was fast as usual!
936,5,"These were OEM batteries at the best price that I found. Worked perfectly, better than aftermarket batteries.  Included the harness as well."
937,5,item is above expectations. found out it also works as a universal remote control for TV... only once it was delivered! awesome !
938,5,"I bought this for my school's auditorium, so we could hook-up a laptop computer to the projector and two LCD TV's.  I had to buy an HDMI splitter to go to the TV's, but it works great!  It certainly helps make our presentation look much more professional."
939,1,"I dislike these headphones so much, I am compelled to make a (very rare) product review.  I was using Apple iPhone earbuds.  They aren't great, and so I decided to try something new instead of constantly replacing them.  I tried these.  My requirements were that they have decent sound and a mic for phone calls.  Okay, so they have decent sound, but they don't stay in my ears (I'm constantly pressing the earbuds against my ears, and, yes, I tried all the different nubby things.), they have terrible phone call sound, and there is no external volume control on the headphone wires to adjust the volume without going back to the phone to do it.  I think I could have lived with everything else were they not so insanely uncomfortable to wear and keep in the ears.  So, no.  I don't recommend these.  I'll go review something I actually liked, now, so I'm not the chick who only leaves bad reviews."
940,3,"So first off let me say I had the beats by dre solo for months and i grew to hate them so i gave them to my brother and months after i ordered these. They came in a few days ago so here i am. The build is great it feels solid unlike the beats which are skinny and the earcups will come out of place with a enough force like say if your friend sits on part of it accidentally. These have a solid feel and a good weight and the cushion just feels amazingly soft. the cushion on the solos is falling off and it isn't as good. Also these have just as much of a bass kick as in the bass will tickle your ears just as much as the solos. These are excellent for hip-hop or metal which is what i use them for. The sound quality is better and the cord doesnt tangle and the ear cups don't create suction on your ears like the solos which is a great thing because the sound gets uneven and it sucks so overall i prefer these over the solos any day buy this and you won't regret it<br />UPDATE: 11/21/12 After a month of use i handled them too rough and snapped them, the build quality isn't as strong as the beats solo hd. I dont plan on using my warranty or fixing them just because i want something to bigger and more comfortable"
941,4,"I bought this tv for relatively cheap at $1200 shipped to the door including taxes, so my review takes that into account as well.<br /><br />1. The good: This TV has a lot to offer, like the LGs and Samsungs it also has the 2d to 3D button that will give some depth to 2D picture. The TV is light, and thin...plenty bright for a living room with lots of windows. Sound is awesome. It supports HDMI ARC which allows it to control certain home theater equipment automatically which is totally awesome. However you do need to buy a special HDMI 1.4b cable [[ASIN:B0019EHU8G Mediabridge Ultra Series - High Speed HDMI Cable with Ethernet 6 Feet Category 2 Certified - Supports 3D and Audio Return Channel]] <-- this one worked great for me, and it was cheap.  Sound wise the TV is great but i still paired it up with a small system.<br /><br />Mounting: the TV that I got did not include the base in the box, sony swore up and down to get it to me, but had a back order of 1-2 weeks. I chose to just get a wall mount and mount the TV. The OmniBasics wall mount i got that had a swivel arm, does not fit the TV perfectly because the TV's VESA mounts are made for rails to handle TILT stands, but its ok It fits with the arms showing a little bit on the bottom. But I thought Oh well it can swivel in and out and I am happy.<br /><br />The 3D glasses look awesome, they are almost stylish... and 5 minutes of charge is all it needs for a whole 3 hour movie.<br /><br />2. The bad: The Sony Entertainment Network or all the apps that make this TV fun is a very sluggish interface. I ended up just attaching my old ROKU XD which works a lot better.  It says Motionflow XR 480. but NO its not a 480hz tv, its only 240hz but still is better than most 120hz and with the price I got, I am happy.<br /><br />Additional 3D active shutter glasses are very expensive.  The Menu system is not easy like my Philips TVs or LG TVs. Sony makes great hardware but besides PS3 they don't have good software or GUI development folks.<br /><br />Tech support for Sony is off-shore, hence, not very good. While I don't mind someone in any part of the world helping me, I do take issue when I have to repeat my issues, name and phone number over 4 times to get the rep to understand me on top of when I am already frustrated with a missing part in the box (the stand or base of TV).<br /><br />3. The ugly: There really is isn't any so far.<br /><br />Other thoughts: The energy label says the TV uses $14 of electricity in the US for a whole year, which is awesome.<br /><br />UPDATE: 1-month later still no stand from Sony after being promised overnight shipping several times. I just ended up mounting tv on the wall. Tv is awesome for gaming on my PS3 as well. Blu-rays look awesome!"
942,1,"I asked a lot of the antennas, since we are a long way from the radio stations. However I thought they would at least improve reception, but  that did not happen."
943,5,Was everything my daughter wanted/expected. Plus it arrived 2days earlier than expected even using the free shipping! We are very satisfied customers! Slightly less expensive than the in store selection.
944,1,They shipped me a broken item and service was terrible. apparently it is my fault that it is broke because when opening the package i scratched the paint on it.
945,4,"I had another pair of NR10's for about 3 years of moderate use until the right cable broke from the earphone.  The noise isolation on these are great - on par or a tad better than Etymotic Hf2s.  However, they're much more comfortable in my ears.  The volume control is a nice touch when someone is trying to speak to me or I am listening to something else in my environment. I even ended up getting these after trying other much more expensive earphones/canal phones that offered headset capability because of the comfort and noise isolation.  The wire will wear out after a couple of years of moderate use, especially if you roll them up in your pocket as oppose to putting them in the case.  They work well on buses and airplanes when there are chatter bugs or cranky children aboard.  They're definitely great on the subway, and in subway stations where some lines screech to the point of poking holes in my eardrums.<br /><br />UPDATE: As expected, the cable broke off of the earphone after 1 year of use. Given the constant need to replace this item I gave up and found a more durable earphone."
946,5,"I purchased these via Amazon Prime (no shipping woot woot!) and am super happy.  They're great for blocking out noise.  Excellent, in my opinion (I have limited experience).  They have great bass response (for the price) and even vibrate enough to feel deep tones on the rubber touching your ear canal.  I appreciate this because often bass is felt best when it is 'felt' by the skin and not heard.  At the same time, the volume doesn't have to be too loud.<br /><br />There is a little bit of 'tin' in the sound, I'd say the volume peaks at around 50Hz and 6000 KHz.  However, this can also lend itself to increased fidelity when on the move.  As long as you're not mixing sound with these, they'll be excellent... for the price."
947,5,"I needed speakers for my son's computer. Long term goal is to get excellent Amplified speakers, like the Emotiva Pro. Temporary solution is that I had a pair of excellent Paradigm LCR-450 Speakers in the closet. Paradigms will eventually go into a second system in the den using this amp and decent CD player.<br /><br /> I got the amp in and hooked it up to the computers earphone output jack. This is not the best option as the USB output into a D/A converter would be much better. This is, as I said, a temporary fix until I can get amplified speakers for the computer. This amp is much better than the much more expensive Marantz SR-880 MK II that I had the Paradigms hooked up to. That Marantz could not drive the paradigms at decent levels without overheating. Even coming out of the computer headphone jack the sonics are much more palpable, rhythmic, with great bass and excellent treble. No listening fatigue after two hours of listening, and the amp stayed nice and cool, never showing any strain. I am thrilled with this purchase! All things considered, this was the least expensive option to get my son some great sound, put perfectly good, and expensive, speakers back in service, and not waste money while keeping the goal of building my second Den system. I am glad I did some research and discovered Emotiva prior to making any purchases. Their customer service is second to none, and you get to talk to real, knowledgeable people who are honest, and who try to save you money by giving intelligent feedback and suggestions. Warranty is excellent too! I suspect I will be getting several more Emotiva products."
