,star_rating,review_body
1123,5,"I've had this radio/cassette/cd boombox for 3 years now and it still performs exceptionally.<br /><br />There are many rare features on this unit that have long disappeared from other so-called boomboxes, such as a line input feature and a multiple equalizer/ amplifier system.  It also has a sleep feature (which I've never bothered to use) and has an impressive 4 speaker stereo output.<br /><br />The deal maker for me was the line-input jack (which, as been already stated, is the 1/8 jack.)  This is precisely what you'll need if you're going to connected it to your computer.  I had been sitting on boxes of interviews on cassettes that I had no way of transferring.  This radio instantly gave me the opportunity to digitize the recordings along with software I previously installed.<br /><br />The sound is rich and woofer system is indeed deep.<br /><br />If you're in need of a cassette deck with a line-input but don't want to spend $150+, this is a great alternative.  (I bought mine from BrandsMart in Miami for $69.99 and that was their stock price.)<br /><br />Great deal, nonetheless."
1124,4,"Im not fimilar with all the terms so reading the manual was a pain! We spent nearly two hours and couldnt get it to work and read everything in the manual which wasnt much help. It tells u, u can do this but go to page ** and then tells u what it does but to use it go to page ** and so on. And by the end we still couldnt figure it out. So we called tech support and they were great! Within 5 mins we had a person walking us through and helped getting it going right. The problem was our fault for not having a correct cord so ran to walmart and fixed it right up. Cord was only ten bucks so not a big deal. theres So many options and things u can set up on it seems confusing at first but its only day two and we are already getting use to it. Gave 4 stars just cause the manual is so confusing. So far so good!!! Would recommand purchasing. Our reason for getting was to get surround sound on video games like ps3 n 360. We just had a dvd player with speakers and would only put sound through the front two speakers. Now we have sound through all speakers for movies, games and tv!!"
1125,5,"My son loves this!! He can turn it sideways while still charging to view his youtube movies. It is compact in size...doesn't take up a lot of room on his bedside table. It travels well. We haven't had it long, but he is totally happy with his so far!! He has had other player/chargers and they did not fit his needs as well as this product does. We highly recommend this to anyone!"
1126,3,"I've had the headset for 5 weeks and used it for many many phone conferences.  I like the sound, the comfort, the range, and the freedom that wireless brings.  However, the battery life is awful.  The unit simply does not hold a charge.  I'll use it for a 1 hr meeting, set it down, turn it off, and leave for the day.  The next day during another 1-2 hour phone meeting the unit simply quits.  That can be very very annoying.  There is no warning, no beep, no solution, other than to plug it in and wait a few hours for a charge.      The USB cord that comes with the unit but is only a couple of feet long.  You can only listen while the unit is plugged in so continuing a conversation is not possible.  Bottom line is be prepared for the unit to cut out in the middle of a conversation.      It would be nice if I could change the batteries myself in the unit once they ran down."
1127,5,I have this binder for a year.  I love it so I want to buy more.
1128,5,"Greetings,    I have had no problems with the HP ink combo packs.    I recommend them for use."
1129,1,Ordered this item from seller and it did not charge and the batteries did not charge on my other charger. Called Kodak who said that if I send them the item postpaid with a fee they would look into it but it would take 4 to 6 weeks. I contacted the seller who promptly replaced the item at their expense and the replacement product was as bad as the original. I gave up on Kodak.  Jrw
1130,5,Vega rocks! I have tried other amps and was not at all happy with them. Take this amp and the cls 215 or the xls 215 and rock the house. I own all denon and vega equipment all over my house and will never consider anything else unless someone can compete and so far that has not happened.
1131,5,"ONE THING I CAN SAY ABOUT THIS BLANK MEDIA, ITS GREAT! I HAD NO PROBLEMS PLUS IS CHEAP AND VERY USEFULCOMPARED TO HP AND TDK, I OVE THIS BLANK MEDIA"
1132,3,It's an okay adapter but I should have paid a little more attention to the pics instead of the description. There are only 3 conductors on the male plug so it is not compatible with volume and song control.
1133,3,"The best thing about these earphones are the adjustable volume (sometimes you just don't want to pull out the device you're using and adjust the, sometimes inconvenient, system volume).  OK, like everybody's said, you might not use this for jamming Daft Punk at the loud gym.  Also the the wiring inside the earbud won't last too long.  Yet, I bought a replacement set (in an emergency) at the drug-store for $25 (what a rip-off); and, I'm getting 2 backups here, right now.  Well, I was going to but found a similar product I would not have to pay extra shipping for.  I like a slider volume control better than a wheel (which can get adjusted, blasting your ears out, on you while you move around)."
1134,5,"I'm totally pleased with this product. Nice design, clear picture as well as quality. Comes with a car charger for emergencies.    FYI: Get an external antenna... RCA Ultra-Slim Indoor Digital Flat Antenna - $9.99."
1135,4,"rt.Almost exactly what I need. Not very fansy sound, but good enough for its price."
1136,1,never got a chance to  use it received a defective one. had to return it.  Sanyo customer service was not very helpful.
1137,4,"My first impression was, \\""Where's the bass?\\"" In an effort to find out, not only did I give the BackBeat Pro in-ear-monitors (IEM) a breaking in, I tried them with 3 of the 4 pairs of tips they come with (I didn't try them with the child-sized tips). I also tried them with different kinds of music (bass-heavy dance, rock, and instrumental classical as well as opera), from different sources (two different classical stations available via the web, music played via Windows Media Player, and music played on my Sony MP3 player). After a breaking in period of less than 8 hours I thought I detected a slight improvement, but so slight that I found myself on the verge of returning them.<br /><br />It then occurred to me to try, as a last resort, the tips from IEM I own that fit me perfectly, those being the largest size tips that come with the JVC HAFX66 and the Sony MDR-EX082. I changed the tips, put on a bass-heavy song on my MP3 player from a live album by the German group Seabound, and finally BASS. I'd tested the IEM with the same song just a few minutes before changing the tips, and the difference was night and day. Having the just-right-for-me seal in my ears made all the difference between virtually no bass and the bass I would expect from IEM with a list price of a hundred bucks that are not marketed as being bass-heavy IEM. And I could not get that seal with any of the tips included with the BackBeat Pros. (Obviously this is subjective and has to do with my ears. Someone else might find one or more pairs of tips that come with the BBP's perfect for their ears, bass-wise and otherwise. I noticed that the tips that come with the BBPs lack the rubbery, \\""sticky\\"" quality that the JVC tips as well as the tips on the Sony buds that I mention below have. That rubbery, \\""sticky\\"" quality makes for a better, tighter, more lasting in-the-ear seal, in my experience. And I did try wetting the JVC tips before insertion after getting unsatisfactory results without wetting them, and it made no difference. Also, I've found that I get the absolute best sound when I use Comply T400 Foam Tips - size large for me - with the BackBeat Pros. Using the Comply tips brings both the listening experience and the noise isolation to a whole new level.)<br /><br />I find the BackBeat Pros to be excellent with mids and highs and good enough with bass. They may not have bona fide \\""reference\\"" quality sound, but they do have exceptionally clear sound and presence. I have also found that I can listen to them at much lower volume levels than required for the other IEM I own (the aforementioned JVCs and Sonys, and Sennheiser MX51 earbuds). Roughly, volume level 9 on my MP3 player with the Altec Lansings is as loud as volume 15 with the other buds (the maximum volume level that the MP3 player can go to is 30).<br /><br />These IEM have balanced armature speakers or a balanced armature transducer design. Balanced armature transducers are typically found in better-than-entry-level to audiophile quality IEM. (One can read more about balanced armatures at the Wikipedia entry for headphones.) In Altec Lansing's BackBeat line, which consists of 4 models (Classic, Plus, Titanium, and Pro, in order of least to most expensive), only the BackBeat Pro model uses the balanced armature transducer type. The others use dynamic transducers, typical of entry level IEM. The balanced armature transducers in the BackBeat Pros deliver sound that, with a proper seal in the ear canal, I find remarkably clear and present. Altec Lansing suggests that the BackBeat Pros produce \\""reference\\"" and \\""studio\\"" quality sound, and while that is an exaggeration, I find their fidelity impressive, and exceptional for the price I paid [...].<br /><br />Amazon is offering the BackBeat Pros for [...] until 2/22/10 as part of their \\""Our 10 Best Headphones Deals Right Now\\"" offer. I may order another pair or maybe 2 at [...], to have handy for gifts (they come in a nice box and with the included soft, padded andzippered carrying case make an impressive presentation). At this price they are a steal (at a list price of [...] they are the most expensive earphones in Altec Lansing's current catalog, and while that may be an inflated list price, it's not ridiculously inflated in the way that JLabs list price of [...] is for two of their IEM). I would, however, tell gift recipients that in my experience, they sound radically better to me with different tips, and that if they find that they are getting virtually no bass, they should try them with tips other than those supplied with them (alternative tips can be purchased at Amazon, Radio Shack, etc., such as Comply T400 Foam Tips, which fit the BackBeat Pros perfectly).impressive presentation). At this price they are a steal (at a list price of [...] they are the most expensive earphones in Altec Lansing's current catalog, and while that may be an inflated list price, it's not ridiculously inflated in the way that JLabs list price of [...] is for two of their IEM). I would, however, tell gift recipients that in my experience, they sound radically better to me with different tips, and that if they find that they are getting virtually no bass, they should try them with tips other than those supplied with them (alternative tips can be purchased at Amazon, Radio Shack, etc., such as Comply T400 Foam Tips, which fit the BackBeat Pros perfectly)."
1138,1,"The battery was well packaged, fast shipping. I enjoyed it very much, but my happiness didn't last long after 2X uses of battery. After 1 day, my battery would not charge anymore. As of now, I am trying to contact the seller for another one as mine might have been defective, hopefully they will replace mine.     The battery lasted about 2.5 hours with internet & video playback. When I first got it, I made sure to charge it 100% then when using I empty it completely to 9% before charging again.     I'll keep everyone posted as I am trying to contact the seller, but as for now my rating for this product is not so great."
1139,1,"I did not like this Body Glove product because of it's shape.  I like to keep my liner notes with my CD 's and this holder did not have square holders inside the case.  I like Body Gloves products when I can find them, this item just did not do the job for me."
1140,5,"I have purchased from Amazon for four years.  I make four to five purchases a month. This is my first and probably only review I will give!  I have purchased stuff from Amazon before just to throw it out. I don't want the hassle of returning product. I am very lazy.  I thought fifty bucks. Maybe it will work maybe not it's only money.  Chuck it and call Comcast if it doesn't.  I have a attic with an ADT outlet right next to my home networking panel so it was a quick install for me to run the extension cord from the ADT outlet to the network panel that houses the phone and cable lines.  I have 9 flat panels all with cable boxes.  The last one we got put us over the edge and we couldn't access ON Demand or the higher channels (100 and above) on any of the TV's.  We were pulling too much energy from our cable lines and needed something to AMP up the signal.  As soon as I disconnected all the lines from our main 10 outlet splitter and used plugged them into the 8 splitter plus a simple three splitter connected to one of the outlets of the 8 splitter all TV's glowed and channels became available as did the ON Demand channels.  Now we did have our main line running from the pole to our home replaced last year. So, I did know that wasn't an issue. And I include that statement because: the instructions suggest the AMP may not be the solution; the main line may be the fault.  So, if  anybody has any problems or second thoughts it is a great buy.  For those curious I am running two 100 foot lines and the rest are 50 and 75 foot lines as well."
1141,1,"I received my first SanDisk Sansa Clip+ 8GB MP3 Player for Christmas '09.  I saw all the glowing reviews on Amazon so I put it on my Christmas list. It lasted me one week before it shut down and never worked again.  I contacted Amazon, who replaced the player in less than one week.  I had my second SanDisk for one week before it froze up and erased all my music and audio files (which took me at least an hour to dowload onto the player).  I was not hard on this player at all, but I did listen to it a lot when I had it.  The sound quality and ease of use was wonderful, but the durability leaves much to be desired.  No idea if it is a bad design or what the deal is, but I will never by this brand again."
1142,4,"I say one more star better if it had an aux input for a mp3 device. Then it would be perfect. My dad got this for me two years ago for Christmas. Not our taste to be honest but it was cool, too cool to do away with it. It's now out in the dinning area of the house and I use it more often than I thought I would. Like I said though, if only I could plug in my ipod it would be perfect! :)"
1143,3,This is a typical CD/DVD case and for the price is a good buy if you are looking for something basic.  The pages are a bit flimsy - not sure that they would hold up to a lot of wear and tear.  I bought it to store some DVDs that we will not be accessing often so I think it will would great for that.
1144,4,"I wanted to replace my clock radio for one that charges my iPod Touch & has decent sound. After sampling several models at the Apple Store & researching online, I picked this one. As a note, there is a previous model of this unit & there are some major differences. Since both are still available as of 1/14/10, you might want to decide which one works better for you. The differences are:  -The old one was shorter, designed for regular ipods. The Touch & the iPhone stuck out higher then the radio, which meant when reaching for the snooze or other buttons, you may hit the iphone/touch and knock it off.  -The old one has a smaller clock display.  -The old one had a BETTER ipod dock. It actually had a rest behind where the ipod stands, which could be adjusted from the back to go in or out. This to me was an amazing & rather unique solution.    The one I bought, the new one described in this item listing, has a bigger clock display & is taller so the touch and iphone no longer stick out on top. However, the dock no longer has the adjustable backrest like the older model. Instead, it comes with 2 plates, one for the iphone, one for the Touch. If you have another ipod, you'll have to bring your own dock plate.    The main problem with this dock plate solution is that my Touch doesn't fit with the protective case on (I use an Agent 18). Since taking the Touch out of the case everyday is not something I wish to do, I have to use this without any dock plates. The problem with that is the only support the Touch has is the dock port. This is obviously not a good thing in the long term. It makes using the Touch while it is docked a 2 hand operation; one to stabilize the Touch & keep it from pushing back & the other hand to make the adjustments. This is doubly frustrating since they had a much better docking solution in the older model.    I plan on glueing a piece of foam or other material on the radio behind where the Touch would be to support it.    Even with this caveat, I would still recommend this Sony. The price to benefit ratio, to me at least, is great. The sound quality and clock radio functions are excellent, especially when you factor in the price you paid.    Things I like:  -Excellent sound  -Lots of options for the clock radio; 2 alarms, different days of the week, can wake up to ipod, buzzer, or clock.  -Sleep function also works with listening to iPod  -Comes with external AM & FM antennas. Picks up stations I listen to without a problem.  -Electronic tuning for radio stations with presets  -Plays Pandora & other sound apps through the system also  -Buzzer for alarm works great. Starts off slow and low volume. Then increases in intensity after every hit of the Snooze bar.  -Clock auto sets & remembers time if unplugged. Only have to set time zone when you first set it up.  -Remote works with iPod and has decent range.    Things I don't like:  -Docking solution is a regression compared to the older model    Overall, I recommend this unit. If you don't use a case with your iPhone or Touch, than it would get 5 stars, IMO."
1145,5,"First, I am not used to in-ear earphones, so when I tried on Hearbeats, I was somewhat frustrated because they would not fit. However, after about 10 minutes of trying the different ear-tip sizes, I found the right fit.<br /><br />Second, I was not immediately impressed because I thought there would be more bass. However, after listening to a couple of songs, I realized how clear each song sounded. I don't feel the need to turn up the volume on my music player because the sound quality is VERY crisp. Beats sound sharp and intricate details in the music are apparent. External sound is hardly noticeable- so much that I hardly hear myself speaking.<br /><br />The only con is that when I dance or run, these Heartbeats have a tendency to slip. But besides that, Lady GaGa, Dr. Dre, and Monster did a great job with these earphones. Initially, Heartbeats seem overpriced, but they are not. Considering other high-performance earphones, like Bose, the price of Heartbeats make sense. Plus, there's a three-year warranty, and I have not had a pair of earphones that have lasted longer than one year.<br /><br />I would recommend these to anyone who wants to upgrade or replace their current head/earphones."
1146,5,"This has been a real surprise to all of us in our household! We just couldn't believe the sound that comes out of this little two speaker \\""alarm clock\\"". I've been into music for quite some time and have a great deal of audio equipment and for me to say I'm impressed is impressive. I'm very picky with how music comes through speakers. These of course don't have big bass or crushing volume but does get pretty loud and the quality of the music is very impressive. We bought two of these...one for my wife's Iphone and one for my daughters Ipod touch. They both love them! The dimmer on the clock is a really nice touch for light sensitive sleepers. The only thing I don't care for is that there's no battery backup. We had ours unplugged for a few hours by accident and lost time/date. It may have a internal capacitor to keep the time for a short time(like for quick power failures) but haven't tried it out yet. Just have to read the instructions to get the most out of this unit. Iphone and Ipod functions work great as well!! Listen to Pandora for hours on end while it's being charged!"
1147,5,"I live in an apartment in the city and have a surround system I rarely use.  If I turn the system up loud enough to drown out city noises, my neighbors complain, hence, the perfect solution is the Sennheiser wireless.  I can watch movies, shows, music with the headphone on and take care of tasks in the kitchen, throw out the trash, etc. without missing a beat. I'm no audiophile so everything sounds very true and in tune to me, even the surround feature.  In fact, my movie and TV watching experience is enhanced because I never miss whispered dialogue or subtle sound effects with these headphones.  The headphones themselves are constructed in a way that they don't pinch your head and provide just enough pressure from a 90 degree angle to your ears that they are quite comfortable even for excessively prolonged wearing.  I like these quite a bit and they certainly have enhanced my home entertainment experience."
1148,5,"I am very impressed at the sound you get from this item!  I use it at my desk at work and the small size makes it ideal for a small space and makes easy to stow in my computer bag.  I purchased rechargable batteries to make it more reasonable to use as I didn't like the thought of throwing out a lot of batteries.  There is an initial invetment with rechargables, but in the long run they make sense.  Great gift item!"
1149,5,"Excellent product, works great and for many different items. The ability to change the polarity is very good and with the many different plugs makes this a very usefull product."
1150,5,I bought this to extend an HDMI to DVI cable using another HDMI cable and this coupler. It works very well.
1151,5,"I purchased these through Amazon with a bit of trepidation. I had read some of the reviews and they seemed to be a little like \\""Buyer Beware\\"". I have had excellent results with the majority of my Amazon purchases, though, so I decided to \\""Go for It\\"". I must say they have worked perfectly so far. Now keep in mind I only bought the 50 pack but I have used approx. 20, making discs with pictures and videos for family members with 0(ZERO) failures. I am perfectly pleased and thank all @ Amazon for this excellent product."
1152,5,"Well, i bought this receiver after testing a friend's DENON 2310ci with my 5.1 speaker setup. I can say that the Denon, has more features BUT NOT A BETTER SOUND. The sound quality of this Sony DN1000, is amazing if not better than other more expensive receivers. The GUI is pretty good, setup is very easy and it has all the more important things to configure and don't have tons of things to setup. I can´t say about the upconvertion feature, since all my sources are already 1080 HDMI.  If you are looking for a excelent sound quality, easy setup, wants to setup once and \\""forget\\"" the receiver, look for the more important features but not ALL the features, don't go for other than Sony - DN1000.  ps.: i replaced a old 5.1 Yamaha in a box, and compare this Sony with a Denon 2310ci in my house. Use a PS3, a Samsung DVD Player, Macrovision HD cable box and a Philips 42 LCD 120 Hz all connected with HDMI cables."
