,star_rating,review_body
546,1,"This headset is many things and while the sound quality is reasonable for the price, the indescribably short battery life could even be dealt with if it weren't that the design can not be. They will /not/, under any circumstances, stay in my ears for more then about 5 minutes. I can not run with these, I can not sit still and watch TV, heck, I can't even /lay/ still! They will always fall out. And yes, I've tried with and without the wingtips that are designed to keep it in your ear, I've tried with all the different sizes of silicone ear buds that it comes with, nothing changes.<br /><br />I'm not saying that you shouldn't buy this headset, everyone's ears are different, mine are on the small side, just be aware that there may be a high chance of these not fitting right."
547,5,Everything went as planned. No hassles.
548,4,"I purchased these buds to use primarily with my cell phone. They worked great once I figured out that my phone needed to be on speaker. Other wise, trouble free."
549,4,"Bought these for my starting-to-be-hard-of-hearing hubby so that we don't have to crank the TV so loud that I'm blasted away. I thought he'd fight me on this, but he LOVES them...and he's fussy on quality.  I'm so glad."
550,5,"I don't typically write reviews, so this is a rare occasion.<br /><br />These are light and have very good quality of the sound. They hold steady when I move around the gym or run. They feel sturdy enough. They are very small - fit in my pocket easily. They are &#34;street style&#34; in a sense that you can control volume and hear pretty well what happens around you. Lot of competition headphones served as ear-plugs and even when no music was on at all I had hard time hearing anything when walking on the street. Didn't experience any fatigue wearing them while working. Totally recommending and buying another set for my father.<br /><br />The only con that I noticed was the microphone seemed not as great as people complained about hearing me well when I used it for a phone call. But that is a non-issue for me personally."
551,5,good
552,5,"We all know verbatim is the best. Verbs are the best,I never have a error or &#34;coaster&#34;. These play in every machine I have and they play flawlessly.  These are the Bentley of black discs"
553,5,"Battery is great, and very prompt delivery.  It is working very good.  I love to recommend this product to friends & family."
554,5,This product was received as expected and works as advertised. My research surrounding competing products was well worth the time. I would definitely recommend this product to anyone looking for this exact solution.
555,5,Just as advertised.  I had tried other random AC adapters that I had around the house and even the ones that seemed to fit wouldn't light up the charging light.  This one worked great.
556,1,It was broken after one month. (no sound coming out)<br />Sent it back on 12/19/13. It is June 2014 now. didn't get any replacement and no response from the Jlab!
557,5,I love these earbuds! They are small so they actually fit in my ears and the sound quality is great! I have 2 pairs.
558,5,These are the best earphones for the price without question. I bought then because of the price but have been very pleased with the quality of sound and the noise cancelling ability. I use them principally at home since they are too large for travel. Great Bargain.
559,5,"I have to wear these clips bc regular ear buds forever pop out of my ears. These work great, wore them for my half marathon and had no problems with sweat, buds falling out of place, or sound quality."
560,5,This Wall Mount works perfect for Samsung 45 inch TV which we have wall mounted through our 20 year old entertainment center in the front.  It has rigt long arm and does everything what is described.
561,4,"If your looking for the best, why are you reading this review? These are in expensive, rather sturdy so they'll survive my laptop backpack, and the sound they put out is very good considering the price. They are comfortable and lightweight and come in blue! If you pay more than fifty bucks for a set of headphones, your not my kinda people and your sneakers cost 300 bucks. I drive a Chevy and it's not a Corvette but it looks good, works well, and is inexpensive enough I could save up for my Vette, if I wanted one, which I don't.  These are very reasonable and won't hurt your ears on the inside or outside."
562,5,"Hmmm....where to start.  I am kinda a tech-head.  I love technology.  I kept debating whether or not to purchase this product.  Why do I need an amplifier for my headphones?  I already crank it to the point where people can hear my music 5 feet away with my headphones on.  But the more I reasoned with myself, the more I want this device.<br /><br />It has some cool functionality.  So now I can crank up the tunes louder....but surprisingly, I don't.  The sounds through this device is incredibly crisp and punctual.  That's really the only way I can put it.  I actually end up listening to the music at a more moderate level, which tends to bring out the highs and lows.  I no audio aficionado, I just know what I like to hear.  My musical taste range dramatically from techno-indie to pop to 70's rock.  Personally, I think this device bring out the &#34;flavors&#34; in the music.<br /><br />Yes, the device is an amplifier.  And yes, I've played with the volume.  Yes it will turn up very loud, to the point of taking the headphones off and hearing the music crystal clear.  The one major fact in this product is that even at its loudest  setting, the music is still crystal clear, without any distortion.  I also liked the fact that I could hook this up to my computer and be used as a separate sound card.  Works great for that.  I hooked it up to my Surface Pro 2, using Windows 8 and it recognized the device right away and selected as my main sound device...no issues.<br /><br />Very happy with this purchase.  Yes, it's somewhat of a techno-toy....but it truly does what it says....it produces good sound quality and amplifies the sound.  Hopefully in the future, FIIO will come up with a more robust equalizer to customize your listening experience even more."
563,4,"For the Couch Potato who has everything... a Raspberry PI remote!  In the time/space realm of time-wasting, this is really the tops, the Cadillac of time wasting tweaks.  The lawn could be mowed, there is gardening to do... taxes...  but no, it's more satisfying to spend 15 hours tweaking the Raspberry PI so that your *remote* works with it.  The Openelec OS handles it out of the box, but the needed tools are under RaspBMC... the Delorian of the Raspberry PI world.  I2C is the driver that makes this gem work... then plan on spending the next 10 hours messing with various permutations of lircd.conf.  What could you have done with that time?  Written the Great American Novel... watched 20 reruns of &#34;I Dream Of Genie&#34; ... but would all that satisfy you like a marathon MCE Remote hacking session?"
564,5,"I got my DREX61IP today and so far I'm very much satisfied with it. The sound quality is great for its price.<br /><br />I use it on my Xperia Z1, and the only button that's working is the middle one for play/pause. (But it's okay, since it's originally made for iDevices)"
565,4,"i'm a moron for not seeing that before.  also - if you are geeky and want glass, this is plastic fiberoptic.  &#60;sigh&#62;"
566,2,I bought these because they were on the &#34;Amazon lightning deal&#34;  after using for about a week I gave them away to my friend's kids.  The quality of the sound (especially the bass) was not on par with other ear buds that I own.  V-moda makes better quality at a cheaper price.
567,4,"I've got 2012 Toyota Camry. It's got the low end radio in it with a usb and  headphone type aux input. If worked pretty much flawlessly with my iphone 5, but I switched to a Galaxy S4 so had to get this cable.  The cable works pretty good. I didn't notice any electrical/background noise at first. However there is noise, it seems to be when the phone is fully charged at 100%. Even then it's not terrible, kind of a whining noise. Other than that it works good and you can always unplug the USB part of it that's charging for awhile to stop the interference. Of course it doesn't show track info on the radio or allow you to use the radios control to skip tracks,ect. But that's a limitation of using 3.5 aux input cables and not this products fault. I took away one star for the interference noise but other than that it's a great product."
568,4,Did what it was supposed to do.  Used in South Africa to convert USA plugs to functioning connection for charging camera batteries. Like that you can charge more than one appliance in this plug.
569,5,"Arrived on time. Price is right. Construction, flexibility, weight and power handling is just right for its intended light to medium duty use. I use them indoors or outdoors when I need to supply power to a spider receptacle at a respectable distance from the nearest source. The black color is of paramount importance to me as the usual orange cords are too visibly distracting and hard to hide sometimes."
570,5,A quality item. It is priced less than several competitors. It can be labeled without having to apply self stick labes.
571,5,This plug met my expectations for use in Kenya.  My phone and Ipad were easily recharged with this device although I could only do one at a time.
572,5,Love this product! my daughter uses this each night to listen to her lullabies at bedtime. The battery life is great. I plan on using it outside when we go swimming
573,1,I bought this for Christmas for my 10 year od son to use with his mini Ipad. I was amazed by the quality of the packaging and the appearance of the product. However within 2 weeks the left side stopped playing sound and within a month they were not working at all. Would not recommend these to anyone unless you are just looking for a cheap pair that you don't mind replacing often.
574,2,Not loud enough and the mic on the cord isn't good. I had to use the cord off of my Monster headphones to get a better sound.
575,4,AND THE PRICE WAS RIGHT. THIS ITEM SHOULD LAST US A LONG TIME AND PROVIDE US WITH A GOOD CONNECTION FROM OUR PC TO OUR TV.  HAVE A GOOD DAY
576,5,"such a long cord, if you need 50 feet of cord, this is the cord for you! it works, its a cord, it plugs in, and it works, okay that all"
577,5,"After scouring the net I found that they we're the only ones to have what I needed. Great price, and I received it in less than a week.  The entire process flowed perfectly."
578,5,I cant really say to much about this product it does what it says and will save you from not being able to use foreign power supplies when traveling abroad Thank You Very Much
579,3,"Wouldn't have thought there could be too much bass, but these make it hard to distinguish low notes when playing bass guitar; muddy sound playing guitar."
580,5,This is my first ever recited player and I can't be any happier. It took a couple YouTube videos to get itinstalled right but it's not difficult at ask.
581,4,"Just got the clock,pretty good looking and yeah, very loud !! Takes 1 AA battery, easy<br /> to set.Rings for about a minuite"
582,5,"I'm a cyclist.<br /><br />I wanted a single bud headphone so I don't miss road sounds, etc and these definitely fit the bill.<br /><br />GOOD POINTS<br />Single ear bud<br />Good stereo sound<br />Easy pause and skip function<br />Long cord<br />Heavy duty cord<br />Non tangle cord<br /><br />BAD POINTS<br />Don't even want to put anything on here because I love the bud but....<br />If you plan to use this ear bud with your phone, the microphone isn't heard well by the person on the other end of the line.<br /><br />LOVE THIS PRODUCT&#62;Highly Recommend"
583,5,"Really perfect for the AR/XA.  After several applications, and running for several days, I restored an old AR motor with this stuff."
584,3,"They sound okay, nothing special to it. But I mainly got them to not fall out of my ears when running and they do that!"
585,2,"Pros: mic & mute/call/hang up button, ear buds<br />Con: only worked for 2 weeks. Shortages.<br /><br />I've had many of these exact headphones.  But every time they short after a few months,  but this time they only lasted 2 week!"
586,5,Really powerful bass for such a small woofer. My previous system was a 10 year old bose acoustimas and that subwoofer was twice the size but it did not have the range or the power that the outlaw m8 has.
587,5,"This isn't my first time with a great experience with Frends headphones. I've bought these in the past as gifts and they are loved by all girls. Sound quality and material quality cannot be beat. These are by far the only fashion headphones on the market and are definitely a must have for any girl! If you're looking for an amazing unique gift, look no further than either the Frends Layla or Frends Taylor headphones. You will not be disappointed! ;)"
588,5,"I can't recommend these enough. Really great bass sound, which is what I was looking for in terms of the music I listen to (jazz, hip hop etc.)"
589,5,"Item is very robust, configures/setup easily and works flawlessly on Samsung G4 (without additional power). Very pleased indeed. Thank you."
590,5,"Arrived quickly, was as described. Samsung charger used for charging the Galaxy tab.  Works without problems, have been using about 1 month now."
591,5,"I have used these for about a year with a Pentax DSLR that takes AA batteries, and I have been impressed by their capacity given the energy demands of a modern camera. I have not yet noticed any sort of aging resulting in a decrease in the total capacity, although I would not expect such an effect to appear yet. The included charger is sufficient and occasionally noisy---I find it pretty weird that it requires all four batteries to be charged simultaneously."
592,5,These things still hold their charge.  I put them into a battery grip.  I can take around 1000 pictures with a mixture of flash and no flash.  Well worth buying compared to the nikon brand battery
593,5,"Worked exactly as expected and prevents me from leaving things on for more than 6 hours.<br /><br />If you have something like a heater that you want shut off after either 1/2 an hour, 3 hours or 6 hours this little thing is great!"
594,5,Bought this for my daughter when her kitten chewed the wire to her old one. She likes these even better than the lase! They're a tad big on her but realllly cute. Good buy!
595,4,Very good for converting Composite to HDMI. Only issue is a light always on; should have a way to turn off
596,1,"Out of about 12 DVD's that would not play, this unit fixed 5 of them.<br /><br />The parts used to &#34;strip a thin layer&#34; actually left huge circular gouges in the disk. It made it much worse than they were.<br /><br />It took 16 more passes with the buffering disks to get the scratches to a point where they were just slightly visible. The disks were ruined completely, never to be played again. The 'cleaning' parts are a joke as well.<br /><br />Note that most disks (that ended up working) required me to take several passes (at 2 minute intervals each) to get to a playable state. Which is very annoying. Since you have to either sit there and watch it for 2 minutes, or remember to go back and hit the button again to start a new cycle every 2 minutes. At 5 minutes at least you could multitask and go do something else. But 2 minutes isn't long enough to do anything else, so you just have to sit and watch the thing spin.<br /><br />Note also that after a few passes, the buffering disks will smooth out and if it's wet it will grab the disk as it spins and you can hear gears crunch when it does. So you must buy new buffering disks frequently because it doesn't take long for these to 'wear out' and for this to happen (even after sitting 24 hours to dry out). So be prepared to spend money (probably their plan).<br /><br />My recommendation, go buy new DVDs at Amazon.com to replace the ones that won't play, DVD's are cheap now with BluRay being more popular. You will save headache, stress, time and hassle.<br /><br />Now if you're a pro, like a pawn shop, with more than 20 DVD's to repair, then I highly recommend you invest in a quality DVD repair system. Don't buy this."
597,1,"I purchased 4 of these adapters for a mouse that I have used since 1998.  None of the 4 worked, but as inexpensive as they were, it would have cost as much to send them back as it did to buy them so I just threw them away.  And yes, the old track-ball mouse works, I had to buy a cable for it and it works just fine.  These adapters just didn't."
598,5,"I used this in a Hadron Air to fit more than two drives. As the space is extremely tight in there, utilizing a Right Angle connector can be beneficial. Other non-angled molex to sata adapters work fine, but this is great."
599,5,This is one of the very few cables that actually doesn't tangle.  The quality was excellent!<br />ansk ;ldlk;d df'l';l 'ld';
600,5,headphones are amazing their clear sounding they have the best base I have ever heard so far!!! I am very happy that I got these they work and play amazingly well you should buy this.
601,5,It does the job. I was able to mount a 42 inch TV. Half on wood and the other half I used Toggle bolts in drywall. If I need to mount another TV I would re-order this.
602,2,I ordered this about a year ago and had no issues with the cases. They are flexible and hold my Blu-rays. So I needed more and ordered another pack about a month ago from Amazon. When I received it a couple of the cases had broken latches so the cases wouldn't stay shut. Not satisfied.......
603,5,Great headphones! Very durable. Sound is amazing. Very comfortable. Quality costs a pretty penny. These headphones were well worth it.
604,4,"This thing just comes in a plastic bag - the sticker on said bag has a barcode and reads simply, &#34;Component A/V Cable for Playstation 2 - NEW&#34;. There's no company logo on the actual plug either; just the arrow on the top that shows you which side should be facing the top when you plug it into the PS2. While Amazon mentions the distributor, I have no idea who actually manufactures this thing. It says nothing of substance, which is unfortunate because this IS NOT plug-and-play, so to speak.<br /><br />Here are the super-simple instructions it SHOULD have. You must first boot up your PS2 with the normal A/V cables without a disc in (or with the disc tray open), and go to 'System Configuration', than change your 'Component Video Out' settings from RGB to Y Cb/Pb Cr/Pr. Now turn it off, plug in the Component Cable, turn it back on and go to the &#34;Component&#34; Video Mode on your HDTV - the PS2 picture will be coming in clear as a bell (that's a saying, right?) Why couldn't this have said that - just the slightest piece of paper with this crucial information!? Whoever made this is a lazy, suspicious manufacturer...<br /><br />BUT IT WORKS! IT WORKS SO WELL! So I don't know why they're acting like they have some shoddy product worth hiding! PS2 games no longer look &#34;blurry&#34; or &#34;fuzzy&#34; on my HDTV, no ghosting or any other image issue that they previously had. They look as sharp as, or sharper than, anything else from that generation - the Dreamcast/Gamecube/Wii/Xbox1. If you've downloaded PS2 games from the &#34;Playstation Classics&#34; portion of the PSN on your PS3, than it's a very similar quality of visuals. It's a MARKED improvement over how things look traditionally. So I highly recommend the cable - this thing gets the job done, for sure, and it's super cheap.<br /><br />The PS2 library is LEGENDARY - this is serious contender for best console of all time, along with the PSX and SNES, so if you want to enjoy your games on modern TV's, youhave to pick this up. Not to mention, picking up older games from the massive library is a great solution if you're looking to game on the cheap, or miss genres that are badly supported on newer consoles, like jrpgs. This is a game-changer; it pulls the PS2 kicking-and-screaming back into the living room along with any other console plugged into your HDTV, all the way up the PS4.<br /><br />But it needs instructions - you gotta know what you're doing first. And you also better make sure you pay attention to the plug; it doesn't seem to quite want to fit in the PS2 at first and needs some gentle shoving (make sure the side with the arrow is pointed up, like the RGB cable already in your PS2!). It seems suspicious, but it's not, and it works really well. Can't 5-star it though, since it's so weirdly presented like a shoddy product."
605,3,"Overall these headphones are not bad. They have decent sound and good bass response. They fit in the ear well and hold an ok charge.<br /><br />My biggest complaint is that the range is completely terrible. Using these earbuds and having my iphone in my pocket, the bluetooth cuts out something terrible. Especially if trying to wear them while doing yard work. They even cutout if the iphone is in my pocket sitting at work. I have to keep the iPhone on the table, else the bluetooth cuts out.<br /><br />Other than that, these are pretty decent earbuds."
606,1,The vertical supports were not drilled correctly.  In desperation I drilled the cross brackets so I could get it together.  At that point the frame twisted.  After I mounted the bracket to my 3/4 plywood  support with 1/4 inch lag screws I was able to flatten the bracket.  I assembled the frame more than 4 times (3hours).  None of the ways worked. The instructions were no help.  I was not able to determine which parts were bad.  I suggest the manufacturer try to assemble this square bracket from there kit something is wrong.  The metal in the frame is thin and is probably cold roll steel it drills easily (have not looked at the drill bits probably now trash). I agree with the other reviewers it really should be a problem attaching 4 screws but it is.  The bracket works even if it is flimsy.  I would not buy this product again.
607,5,BOUGHT THIS UNIT AND HAVE BEEN EXTREMELY SATISFIED WITH IT.  I'VE HAD HOME AUDIO RECEIVERS BEFORE BUT THE PRICE AND SERVICE WAS AMAZING.  UNHEARD OF PRICE.  WOULD DEFINITELY RECOMMEND.  SELLER GAVE EXPERT DELIVERY.
608,1,"I live in the country and zero radio stations come in.  And after playing any CD more than 3 times, the CD's begin to skip"
609,5,these are very nice as far as what I paid for them the only thing I dont like is they are low and not much bass
610,4,A little dark but they fit well over glasses and seem to work fine. I may even buy more soon.
611,4,"Simple, clean, compact. Fits pre-iPhone 5 30-pin hacks. Decent sound for the size and price. I would buy again. Great!"
612,5,Go to the nearest home supply and buy 100' of wire - its more expensive and most of it is solid - this wire is well insulated and well made and costs much less than anything available locally - would recomend.
613,5,These are the best inexpensive headphones I have ever purchase anywhere. Only thing is that they come with no comfort foam pieces so the headphones can make your ears sore with prolonged use.
614,5,I love these headphone. They are cute and perfect for listening to music or watching a movie. The colors even match my bed spread in my room.
615,2,"The lamp i ordered for my Samsung TV simply did not fit. The screw that holds the back (silver part) was in the way of installing the lamp. (My original lamp did not have that screw there). I had to take the screw out, use a saw to cut off the plastic piece, and then TAPE the back on, in order for the lamp to slide into place. Only good part, is that the lamp stlll works, but it was a hassle."
616,5,"LSD--low self discharge--is the new standard for rechargeable batteries that spend time just waiting to be used, like in flashlights or camera flash units, or portable Bluetooth speakers.  The catch is not all LSD batteries are equal.  Capacities are wildly exaggerated in off brand batteries.  I've not compared storage lives, but in use, these eneloops outlast another &#34;brand&#34; which claims a capacity that is easily a third higher than these.  I've bought the AAA size, too, for TV remotes, and they work very well compared to conventional NiMH batteries.  Highly recommended."
617,5,"I use to send satellite channels to rarely used bedrooms, avoiding monthly charges for boxes. Works great. Easy to set up."
618,4,"I'm impressed by the sound - it is pretty good for such a small speakers.<br />Things that cause frustration:<br />* delay during source switching<br />* falls asleep pretty quick, but very slow to wake up<br />* remote is rather directional<br /><br />Overall - hey, what do you expect for $170? You get good sound. The rest is optional.<br />If you can boil your hookup down to a single input, then you are in good shape!"
619,5,Just what I needed to extend my security cameras power cord. It doesn't change your receiving quality of picture and was inexpensive.
620,5,"Reception is very good, sound is excellent, light weight, the flash light produces a strong beam and the solar charger works well. The siren is feature I had not initially tested.  However my grandson found this feature at about 5:30 am on a Saturday morning.  I will attest that it works, no one in the house was sleeping after his test run. It is a great piece of equipment."
621,5,"Finally received this today and hooked it up immediately. I used it to connect my Xbox360 and XboxOne to one HDMI on my receiver. I'm fully aware of the HDMI input on the XboxOne, but I want to use each Xbox separately. Input was correctly sensed when either Xbox was turned on. The Select switch worked too. The best bang-for-the-buck device I've ever bought."
