,star_rating,review_body
1518,5,"I keep all of my music on my desktop computer in the back of my house, which is where I listen most of the time.  Sometimes I want to listen to that music in multiple locations - mostly in my living room which is on the other side of the house.  I have wi-fi, but I do not like the wireless streaming audio options out today.  So, this cable functions as my delivery system - music from my office to my living room.<br /><br />For optical cables, the only thing that matters is if the signal gets there.  Despite the long run (50 ft), this cable works perfect!  Make sure you set the digital output on your computer to a sampling rate that your receiver can receive and decode (44.1, 48, and/or 96 khz)."
1519,5,Great build quality. No image issues. Looks like it will last for a long time. No complaints and would buy again.
1520,3,Bought this to use with my iPod 5th generation and my MacBook Pro 13 (early 2011). Works fine in both. Sound is good and microphone does a good job on Skype.
1521,5,"Seems to work well. No problems that I can tell. Good value, fast shipping. Gee, it's hard to talk about this in to many words."
1522,5,"After all the research and bad reviews on other converters and the naysayers, I picked this one and am happy with it."
1523,5,I have Dish Network with built in Bluetooth. I can now listen to my movies with out the wife telling me to turn down the sound. Saved my marriage! Takes no batteries it recharges off my USB port and last for hours. This product was cheep at the price I paid.<br /><br />Roger1k
1524,5,"Great sound, nice bass response. These are a great value to replace the OEM ear buds on any music player."
1525,1,"These headphones stopped working after 2 days! Not worth the money, just get the original headphones. They didn't even send me new ones like they said they would after I complained about how they broke."
1526,1,Missing power cord and remote.  Very noisy when powered up using appropriate cord. Unacceptable. Quick credit was appreciated. Thank you.
1527,5,"I just bought this and installed it. I have to say I'm impressed, especially with the wireless sub. My wife was complaining not hearing clearly from the (Sony Bravia XBR6) TV's speakers. Here are the pros and cons:<br /><br />Pros:<br />1 - Receiver has many input options<br />2 - Because of 1, my setup was a breeze. My TV, PS3, and HTPC all hooked up to the receiver via HDMI. From open box to fully setup, less than 30 mins.<br />3 - The sub woofer goes behind the sofa in a corner.<br />4 - Unit goes into standby mode when my TV is off and automatically turns on, when the TV is on. I use the TV's remote to control the volume. When I switch input to my HTPC, the receiver automatically switches to that audio connection.<br />5 - Sounds coming from the system are so rich and amazing. I can now hear background musics and sounds, where I couldn't with the TV speakers.<br />6 - I was surprised to find that it also included FM radio.<br />7 - Optical cable was included for digital audio.<br />8 - This is the best part of the pros...my wife is happy with it :)<br /><br />Cons:<br />1 - High Speed HDMI cable is not included. Luckily I had a spare.<br />2 - FM tunner and presets UI could be a little bit better designed. But no big deal. Figured it out as soon as I got the layout of the new remote."
1528,3,well i got my order today well what you know on time but got lost with the 5 e-mails i sent i don't know what to say
1529,1,"took me a minute to figure out why my ps3 and all my other 1080p devices were not appearing on my 1080p projector after buying this cable, until i switched over to my 720p apple tv and it was working fine. this cable can't handle 1080p, on any device i own, don't buy."
1530,5,Belkin ties are cheap and very useful.  I would recommended to everyone.  It's alot cheaper than if you buy them at Fry's.
1531,5,This is a top quality audio cable at a moderate price point. I purchased to connect my smartphone audio to a big stereo. Works as advertised and seems like it will last a long time.
1532,5,This is a very heavy duty HDMI cord that i am glad only took 3 days to arrive at my home.
1533,5,"I tried to use a generic cable to attach my tablet to a TV without any luck. I decided to give it another try with a different cable, and I am glad I chose to get this cable from BlueRigger. The finish of the cable is excellent, and the price I paid for it was great."
1534,5,just what I needed to start using my new TV<br />easy to use - had no problem connecting it to my new TV
1535,5,This was a hard connector to find. I have a 15 foot mini HDMI cable for an old Transformer TF101 and did not want a second cable around for the new tablet so I purchased the adapter.  It came quickly and works great.
1536,5,"My speakers are about the size of the ones in the pix and they have sat on the floor for a couple of years.<br /><br />At that size, it just looks like you forgot they were there.<br /><br />The stands were easy to put together. I can see why people had difficulty threading the wires through the posts. You have to take the posts apart, thread them through the bottom, then through the plastic insert and make sure it is in place, then kink the end of the wires just a bit. Push the wires up through the smaller pipe and catch them at the hole at the top (I used a large paper clip.). Not real easy, but not really hard, either.<br /><br />The glass and metal look goes well with my electronics stand. There are a couple ways of attaching the speaker, but I used the simplest: The sticky tape that came with the stands. The &#34;shelf&#34; on the top is plenty large enough to hold them.<br /><br />Now my speakers look like they are where they should be and the sound for my TV, etc., is actually somewhat better."
1537,5,"What can I say, it's an Ipod and it's very NICE. It has so many feature, it keeps my husband occupied for hours."
1538,5,"Initially I bought these headphones for my daughter who always loses the smaller ones.  When we heard the sound, it was just amazing!  The animal print and the price were added bonuses!"
1539,5,"This antenna is great! It's white on one side and black on the other so that it matches your decor. The reception is fantastic at about 93%. I live in NYC and I have 44 channels for free... adding Netflix and Hulu Plus and saying bye bye, Cable!"
1540,5,"I ordered this bulb when I started to notice the screen on my Mitsubishi 65 inch DLP, flickering. I am very pleased to say this bulb works great! It was easy to replace and now the picture looks like it did when it was new. I actually had to adjust the video settings on the television because out was too bright!"
1541,5,"Like many have said, there's no real reason to spend $20+ on HDMI cables.  You're just feeding marketing hype.  These cables are all you need.  In fact, there's cheaper ones out there that perform just as well, but these seemed like a nice professional set for a few bucks more.  So here's another 5-star rating for this set of great cables."
1542,4,"Very simple device. Easily set up and worked as stated. I use it to convert the signal from a RCA composite video output jack, on a security camera DVR, to a VGA input on a 17&#34; computer monitor. I already had the old unused 17&#34; computer monitor. This StarTech.com converter saved me from spending $100 to $150 to replace the defective original 20&#34; TV monitor."
1543,5,"I bought one to connect my ipad and iphone to my bose quietcomfort 15 headphones.<br /><br />I was able to remove the bose cable and plug this in directly,  the little plug that came with it was just long enough.<br />Paired easily to my apple devices and I used some double stick tape to  hold it up to the left can.<br />Since Bose doesnt make a blue tooth adapter for their cans this is one good option.<br />The only problem is the cable is tough to plug in and comes out easily.  I used a small straw to hold the plug in straight when I inserted the plug in"
1544,3,Fast delivery and excellent customer service. I ordered two and neither worked upon arrival. I kind of felt as though I wasn't believed by the gal I emailed because she said that had never happened where two items were defective. despite that I had prompt service to exchange with the prior company. The item is alright although I thought it would be a little better quality. I may be just a little critical.
1545,5,".......for the money it is a good purchase. Music is clear, dock works well. We use it in our office."
1546,5,"I was doubtful about this product because of the great price. Boy, was I proven wrong! What a great speaker!"
1547,5,"The initial RCA was defective, a simple e-mail was all it took to get a replacement device with no hassle.  I appreciated the committment to excellent customer service for a relatively cheap electronic device."
1548,4,"High quality cable, seems to be put together very well. Shipped very quickly. Would recommend this product and merchant to others."
1549,4,Looks good and solid and it will be installed in the ceiling of my Garage ( Mancave ) so I'll have sounds when working on my Bike .
1550,5,"This is the EU adapter for certain Motorola chargers that accept Motorola slide-on adapters when the flat, U.S.-style blades, are folded."
1551,1,"After my Logitech 550 broke, I decided to go with another brand.  Worst mistake ever.  The functionality of this device stinks.  It was so difficult to program even the basic functions of the remote.  Setting up the macros was rather inconvenient.  And the worst part of it was that the rechargable battery didn't even last a year.  The touch screen was fun, but also was way too sensitive.  It was not user friendly at all.  Don't waste your money on this remote."
1552,5,"Finally decided to purchase a second for my mothers PC. I've had the first one for nearly a year now and it still works great. No issues with compatibility. Using a Corsair non-modular 750w on one PC, and a Corsair modular AX850 on another PC."
1553,5,I have two TVs Connected one a Mitsubishi 65 inch and one 42 inch Sharp LED<br />The Sharp is on a 25 ft Mediabridge ultra series HDMI cable. This Setup gives me<br />HD At both Tvs without paying for two cable boxes.I control both TVs with LOGITECH TV Keyboard
1554,1,In less then six months these the end of the ear bud that goes to the jack was messed up where I could only hear one side.  I attempted to return it to Sennheiser via their return system and they shipped the product back to me without replacing it or repairing the jack.
1555,5,It took me 5 minutes to get it set up and it sounds great. I couldn't have made a better choice.
1556,4,"These headphones are amzing, i heard nothing but good things about them and they were right. the only prop that i woud have whith them would be that you need an amp to get the real jucie out of these bad boys...... man they sound good!!!!!!!!!"
1557,4,They do what they are meant to do. I didn't have a wire stripper so used knife to strip the wire. I would recommend it to others.
1558,5,"These earbuds are very comfortable, have a nice sound and come with several different rubber ear pieces so that you get the right fit. The travel case is nice and is small enough that you can take it anywhere."
1559,5,"Bought this for our college age son.  He loves it and uses it everyday.  He mentioned that the instruction manual is not clear in some places, but he recommends the product."
1560,5,A use these headphones with an Ipod. They are lowder than the original phones. the fit better than the old round plugs supplied by Apple.
1561,4,"i was indecisive and what made me decide between this and another cable witch was shorter and a little more expensive was that i thought they were gold plated , since i thought it could change the sound , but whatever they are good and the sound is alright everything is normal or at least i cant notice , size is a little more i need but yeah , they feel sturdy and hard , good to buy"
1562,5,"Shipped fast! Despite reviews about too short of a cord, I did not find to be true. Plenty long enough for my needs and very good price. Would definitely buy again if this one were to ever die, as it is much more cost efficient than buying one from the manufacturer with an unknown life span."
1563,1,"did not work at all  Good thing it didnt cost much! No, point wasting more money or time to send it back!"
1564,5,"Absolutely to expensive for what you get , but the sound is great.  Its amazing you get so much sound out of those 2 small speakers.  You can hear the birds churp and planes flying when people are talking in the movie or show.  AMAZING !!!!"
1565,4,"i works and seems pretty neat. i purchased it as a gift, so i have only tested it to be sure it works. it didn't work on a coffee mug as shown in the ad. it did work on the empty box it came in, but not on another box that I tried it on. I guess it's just trial and error. the sound is not great, but I'm sure children would have fun with it."
1566,3,"I have no problems with the functions of the reciever, but they have chosen to print the buttons in gray on black. Further the text is quite small, so that in my stereo cabinet, where there is not a lot of light it's hard to read."
1567,5,"These are great speakers for a Home Theater project! Very easy to install and a great cost to value proposition. I like the \\""aim-able\\"" tweeters!"
1568,5,excelente producto recomiendo 100% buy buenos vendedores el producto es de buy buena calidad muy practico de poco peso y facil de instalar
1569,5,"Having never mounted a TV to the wall I was a bit skeptical that such an inexpensive mount would be sturdy enough.  When it arrived I was totally impressed by how sturdy it felt when I removed it from the box.  I was also impressed by the amount of hardware supplied with it, including the 6\\"" level and small bubble level which attaches to the mount.  Once a stud was located, installing the mount was a breeze.  I located the correct size screws and washers amongst the plethora of included hardware for the back of the TV and voila, my 37\\"" TV was on the wall, solid as a rock.  I would highly recommend this to anyone looking for a full motion mount which doesn't require too much of an angle adjustment."
1570,5,"Exactly as descirbed. Used a switch between this and a laser project. If your project requires an external power souce, this is it"
1571,5,I've had these a couple of years and the sound these cans put out is amazing.  By far the best I've heard under 50 bucks.  But the sound quality sounds like it comes from headphones far more expensive.<br /><br />Listening to CDs is where they really shine.  I use them attached to my iPod and laptop quite a bit and it really is amazing how well they work like this also.
1572,5,I had a few difficulties with pairing the device - which were all fixed ASAP by incredibly helpful customer service staff at Hipe.  The device now works perfectly and I'm very happy!
1573,5,"In perfect condition, and no scratches or damage. Does what i need to do so thanks and i would definitely recommend. Thanks"
1574,5,"I love these headphones. I had a pair exactly like that before, got a new puppy and she chewed them up. So glad I could get the same kind again. Shipper was quick and hassle free."
1575,5,I gave this IPod as a birthday gift to my daughter. She loves it. She says that is fast and she enjoys watching videos on it.
1576,5,"They seem to do the trick.  Light, fits both single LPs and double LPs, and looks like they protect the covers quite well from deterioration.  Recommended."
1577,5,After knee surgery I was only allowed to swim laps (not using my legs). It was a death sentence until I discovered this product. Its a regular ipod shuffle but waterproof. amazing. Swimming is not a lot more fun now.
1578,4,"I bought these headphones because I needed some that could stay attached to my ear while I was running or working out. I ordered the clear headphones and they look awesome, so I was extremely pleased. However, I'm not too impressed with the sound quality. The sound very treble-y , and lacks a deep bass that I've grown accustomed to with my other in ear headphones that are made by koss. While the headphones did a great job at staying in my ear while I ran, the ear piece frequently became loose after about of mile of running, and beginning to sweat a bit inside my ears.Although this was a minor problem.All in all I still think these are great headphones for exercising and do a relatively good job compared to other exercise headphones I've used previously. These headphones aren't expensive so I will likely be recommending these to friends. So in conclusion, if your looking for great exercising headphones an aren't looking to spend a lot of money , then these are the best on amazon you'll find. Trust me I already did the research."
1579,3,"Ths housing was slightly to big and needed adjustmets. The handle on the rear of the housing broke off, plastic just cracked from the screw holding it to the housing. After I removed the handle assembly the housing seemed to slid into place a little better, but the screws were not the correct size. Had to replace the scrwes on the housing with the screws from the old housing. The housing also sits a little farther back than the original making it difficult to secure it in with the screws.<br /><br />Once all that was done, about an hour later, I was able to turn on the television. Lamp works well and picture looks as good as it ever did.<br /><br />If you are looking for a cheap alternative, about half the cost of an original replacement part,  and do not mind doing some tweaking to the product, I would try this product. For me it is for an older TV that I did not want to invest too much more money.<br /><br />If you want a no hassel replacement, spend the extra moned on an original replacement part."
1580,5,"I'm not an audiophile, but I like the footprint and power of the amp for what I use it for. I wired two flush mount ceiling speakers and then used mono inputs to my Mac, so now I have iTunes all over my house. Simple and high quality construction. Good and loud with little distortion at higher volumes, though with a young child in the house, I am not playing at high volume that often. Be aware there are not that many inputs, so depending on what you want to use it for, be careful."
1581,3,"Love the sound quality.  But for me, they tend to slip out when running and even sometimes when biking.  I'm not giving up yet, but the Skull Candy ones never fell out..."
1582,5,"I had already bought one of these for my workout room.  Loved it and after a few months was trying to find something similar for my kitchen, only with AM/FM radio.  After searching around and testing two different players with a radio, discovered I have really poor reception in the kitchen and basically got static.  So ruled out the AM/FM and just bought a second one of these.  Figured I can just use my iHeartRadio for radio playing.  (Will need to boost my wifi signal, but that's a different purchase. :))  Sound is excellent and great quality.  We have a one-story ranch house and when I turn it up, sounds great all over.<br /><br />In the summer, I've also taken it outside to use on the patio.  We have an outlet right there behind our grill, so plug in my iPod Touch and jam away.  :)  Our friends can also hook up their ipods or iphones and we get a wide variety of music that way.<br /><br />Comes with a handy little remote.  Its fairly small and was worried about losing it, so got some of the sticky Velcro strips and cut a small piece to put on each so now I can Velcro the remote to the back of the player when not in use."
1583,5,This item worked as advertised and excellent customer service.  I would do business again in the future with this vendor.
1584,5,"I'm pretty sure this works fairly well. I may have lost this one. If so, this review is for a different one that I bought at Guitar Center. If not, this product works well. I think..."
1585,5,"i wish that these cheap cd cases were even cheaper considering the quality, but its still cheaper than what it would cost in the store."
1586,5,"I have had an earlier version of this radio for many years, and wanted to buy a new one.  They are not available in stores, so I gave up.  Bright idea....go online.  I found it, and am delighted.  The sound is excellent, it picks up the stations I want, and  I am really happy to have found it."
1587,3,"I got these to replace my Apple ipod ear buds; these earbuds are slightly larger than the Apple brand , in turn after a few hours they become uncomfortable. They  have good sound , good bass, and has a cool case. I would have given a higher rating not for the oversized buds. For the money you can't beat it."
1588,5,This small speaker produces a good quality sound. I purchased this because my wife has a hearing loss and when I play sound only from my laptop or ipad it is not loud enough. It's small and easy  to use. When placed in the middle of a room it fills the air with clear sound. I first heard this speaker when a college rep gave a presentation to my students. Everyone in the room was impressed and said they will soon look into purchasing this speaker. You will be amazed at the sound quality! Price was also affordable!
1589,3,"Product worked good in the beginning after six months it went bad does not turn on at all no matter what you do, so sad,"
1590,5,"After getting and returning 2 dead ups units from Staples, I did what I should have done at the start and ordered one from Amazon. Came fast, was fully charged out of the box, and works fine. In a conversation with APC I found out that the reason the Staples units were dead is that they had apparently been sitting in inventory since January (it is now November) - the shelf life of an uncharged unit being 6-12 months."
1591,3,"For under $100, this soundbar was worth what I paid and it does an adequate job.  Don't expect window-rattling bass or surround-sound effects but I did get a significant improvement in sound quality when compared to the speakers in my flat-panel TV.  The sound is much richer and the separate bass unit adds significant depth to the sound.  It really is easy to install -just a couple of plugs and in a couple of minutes it was ready to go. Someday I'll pay (a lot) more money to get an actual surround-sound system but for now, this sub-hundred-dollar unit will fill the gap."
1592,5,"Yes, they work. Yes they are cheap. No there isn't much to say about them otherwise. If you need 'em, buy 'em."
1593,5,This product works as advertised - audio quality is good and headphones are comfortable.  Haven't had any issues with it running out of battery; recharger cradle is easy to use.
1594,5,"This is the 2nd TEAC CD recorder I have and my other TEAC recorder still works fine. I needed another so I won't have to trudge up and down the stairs between attaching the recorder to my stereo or computer. It is like having an old tape recorder. Very useful for making cds of lps, tapes, soundtracks to DVD live shows and recording on-line. I would recommend this player highly to those who still like to listen to cds."
1595,5,"These were the perfect fit for my system.  They were thicker than your standard cable, yet flexible enough to run through the entertainment center."
1596,5,Just like the original product. There was no difference but the slight color variation. The sound quality is just the same.
1597,1,"Extremely basic device. MP3s are stored in a folder hierarchy which you have to manually navigate to play music. Once music is playing, a series of long-presses allows you to finally get back to the folder structure to change the music.<br /><br />The biggest issue for me is that you cannot listen to music while the device is plugged-in to USB power. It immediately goes into a \\""charging\\"" mode, in which you can only watch the charging icon on the screen, and nothing else."
1598,1,"--Box does not contain an actual adapter, only a usb cable with a small charger tip.<br />--Followed instructions to charge with usb connected to computer. Wouldn't charge.  Power button wouldn't work.<br />--Tried charging with two other roughly equivalent Samsung adapters.  Wouldn't charge.<br />--On-off button wouldn't turn on, even when plugged in.<br /><br />Determined that \\""dead on arrival\\"".<br /><br />Was a total waste of time and money."
1599,1,"Purchased these just a few weeks ago, to use for work calls as my iPhone earbuds were uncomfortable for long periods of time (though reliable!). Already the left earbud is malfunctioning. Not working at all. I take great care to store them properly, they aren't thrown in a bag or anything. Cannot believe they already don't work. I have 6-year old iPod buds that have never had this issue.<br />Disappointed and will not buy Altec again."
1600,4,"Got these, can't say I was expecting much out of them but it totally took me by surprise when I was listening to something and I actually heard base. I didn't know that song had base. The sound quality is pretty good, but it doesn't filter out the static very well like some of my other ones do. That's why I only give them 4 stars. But for what I payed they're really good.<br /><br />I think it's worth mentioning that these headphones go lower than my laptop speakers and even my TV monitor."
