,star_rating,review_body
0,4,It works as I wished.
1,5,Bought it for my daughter and she uses it everyday.  Battery life is good and its compact size makes it ideal for daily use.  sounds great and connects easily with her iphone.
2,5,Great product
3,5,"This unit is definitely worth the money. I compared 100's of wireless speakers everything from Bose to Jambox and this one for the price took the cake. This unit has a better design then the Bose system with a equal and sometimes better sound quality then the Bose system. It has a rich deep bass sound equal to that of a small sound big box system. When I first had this on my room mates thought I had a dedicated subwoofer. When they found out that it was from this small device they were amazed. I have since recommended this unit to 4 others who all love it, some wished they had demoed this before purchasing the similar Bose system.<br /><br />Pros:<br />* High Clear Crisp Sound<br />* Good Highs and Lows with no interference from case design<br />* Holds a very long charge (although will vary depending on how loud you play it)<br />* Easy Setup<br />* Very Durable<br /><br />Cons:<br />* Rubber on case makes it collect dust easily<br />* A little bulky but not bad<br />* Not able to function as a wireless mic when making calls<br />* Does not come with a carrying case"
4,5,Perfect fit. I love them. Bose wanted recycle them for 90$. I found a better perfect option!
5,5,"This little speaker sounds pretty good, it plays for quite awhile and charges fairly quickly, no issues with the charging port. We liked this little speaker so much we bought this one for my husband."
6,5,"These are some of the best buys available for earbuds; the trick however is to get these inserted into your ears deeply enough to seal them.  Once they are sealed, the bass and actually all sounds come out great.  It would be hard to beat the sound.  The problem I have is that they just don't seem to fit the way I would expect them to.  You have to insert them (to me) upside down with the wires going up toward the top of your head.  I believe this is so they can be looped behind your ears but it just doesn't feel right to me.  Maybe I adjust to this over time..  In any even, for the price and sound, they can't be beat..."
7,4,SatLink WS-6903 Digital LED Satellite Signal Meter Finder
8,5,I just received these as a gift and they are simply outstanding.  The best headphones that I've ever used.  They are adjustable for head size and fit my head/ears perfectly (unlike some other models that I've purchased and seen fail soon after!).  Excellent sound and great build quality.  Very happy!
9,5,Nice wire. Works fine.
10,5,"Floated the river with this case & it worked perfectly!!! Awesome Sound and the speaker stayed completely dry! Very durable, Survived Rapids and plus it Floats!!!"
11,5,Great Item - Fast Shipping - Will Purchase Again
12,5,Fantastic sound.
13,5,Perfect
14,5,"Rock them all the time, they work about 50 feet from phone, its great."
15,5,Works very well
16,5,"I had no idea which antenna to buy, as read that really varies as to signal towers etc & my tower is approx 30-31 miles away so figured this would be fine. I just bought a new TV to replace a tiny TV for a small room that doesn't have cable & won't be getting it, but wanted to get just a few channels for guests.  This antenna is great & works really well.  I didn't want a really cheap one, but didn't want an expensive one either, & this one was right in the middle.  It brought in a ton of digital channels, including most of the local stations & some others like KCET etc.  The picture is very clear, which surprised me as was expecting it to break up like my old analog antenna, but it's actually almost perfect & I forget that it's not cable.  I really love the 20ft cable length, as works perfectly for the room size. I have it behind the TV, nowhere near the window, so am not using the suction cups.   **update 11/7/15 - love this thing, I'm still blown away at the quality of the reception it brings in."
17,5,Works fine for less
18,5,"I've had a GT40 for several years, since they first came out.  I've solely used mine primarily as a DAC in conjunction with JRiver Media Center software, and recommend both heartily.  The GT40 is one of the most satisfying and affordable components in my overall stereo system.  Every other component cost $1,000 or more.  Unlike other DACs I've tried, the output sounds nearly as good as original sources and the unit seems to be built like a tank.  I've had no hiccups or failures of any kind.  I assume that the other applications work as well, in fact I now remember using it successfully as a phono stage for vinyl conversion to WAV a couple of years ago.<br />UPDATE - 2/1/17 - I had my first issue with the GT40 tonight after several hours of listening via earphones with it (since my beloved 50 year-old 15&#34; JBL speakers are being refurbished).  I lost the right channel for no apparent reason, but if I pulled out the headphone plug part way, it would return.  OK, it's just a displaced or dirty contact, I thought.  I took the unit apart and to my dismay the receptacle is sealed, so I couldn't get to the contacts to &#34;adjust&#34; (translation - bend) and/or clean them as hoped.  After putting it back together, I inserted and retracted the headphone plug aggressively several times, and voila -- I have both channels again.  The next step is to treat the receptacle innards from the front with DeOxit.  This turned out to be a minor glitch, so far, following years of flawless and frequent service.  My previous 5-star rating stands.  I'd give it 6 stars if I could!"
19,5,as described!
20,5,Works great s far. Arrived when expected.
21,2,I received a previously used Ipod the product info said new. I was able to use it abs it works great.
22,5,Great but some macs are iffy and don't work because of the new OSX
23,5,happy
24,5,Excellent sound and tone! The wood cabinet provides a rich sound and every instrument is exceptionally clear.
25,5,"I took me all of 15 seconds to get it working. The most intelligent light bulb I have ever used. It however  takes about 30 seconds the first time to connect to the Bluetooth of the iPhone with one 'cannot connect to Bluetooth failure message'. Once you get over that the app is super easy to use, you can increase or decrease the bulb intensity but cannot change the color. The speaks in the bulb sound very good for my ears. I use this for demoes where I show that even old fashioned light bulbs have changed forever thanks to technology.  I am in Mumbai , India and the voltage is 230 v and the light worked without a problem."
26,5,Works great for both my iPhone 5s and my husband's HTC.
27,3,"These ear buds worked for quite awhile, but eventually became useless. I had used these for a couple of years, but one day one of the wires snapped. For their price it was expected that I'd have to replace them after several years. The sound quality was adequate, not bad, not great either. The length of the cord could have been longer, but wasn't too bad overall."
28,2,I've got to re-scan ever time I turn on my tv set
29,4,"Pretty sturdy, but creaky. The ear muffs are soft, but like other comments, circle not oval. This makes them an on-ear headset. Pairing was easy, as well as switching between devices. They are not super tight on my head and I have a large noggin (7.75 hat size). Buttons are easy to use once you have memorized the layout.<br /><br />Sound quality is nice when used with device EQ settings. I like how turning up the volume on the headset does not change the volume setting on the device. To clarify, you have some volume swing when your device is at 75% volume.<br /><br />Overal, good budget piece of hardware."
30,5,"Awesome! I bought them to wear at a noisy gym, especially in one of the CardioKickBoxing classes. So bought for the noise canceling feature. Muffles loud noise nicely and are very comfortable. You can't, however, jump with these, since too much movement stops the feature from working.  But just doing weights, kicking punching is fine. I've also tried listening to some lectures on my iPhone with them, so nice. I could hear the lecture perfectly, but the surrounding noise disappeared. I did this at a birthday party with in laws, at a fancy restaurant, great way to get through a boring event."
31,5,No problems at all it's really a great unit I would recommend it to anybody has many features and does many things and it sounds great great sound from it
32,5,Nice surge protector!
33,1,It arrived broken
34,5,Been very useful to find items
35,1,"Low quality connectors that don't seat well.  Tried 3 different pieces of equipment to rule out a problem with the amp I was using them on originally, and got the same loose fitting seat and terrible audio quality on them as well.  I see that they got some good reviews from other users, so not sure if this is a fluke or what.  This manufacturer needs better quality control to improve consistency."
36,2,This item does not fit my headset as advertised
37,1,"Initially this product worked like a charm, but after a year of use it started to fall apart where the cable and the rectangular device connected. The inner wires started to show to the point where it got dangerous to continue to use this product for fear of being electrocuted. For such an expensive item, the build quality is extremely poor and the customer service is lacking. When you bring it to BOSE, they have a policy where they do not fix these products. Instead, you have the option to buy a new pair for a small discount. Why would I pay several hundred dollars for another pair that will break down after a year? There's a fundamental flaw with the design. If Bose was really proud of their product, they would offer a lifetime guarantee. I will never buy another bose product again."
38,5,"This little antenna is absolutely superb. Simple to set up and reception is excellent. This is a directional antenna. It will work best outdoors, mounted clear of other objects and pointed toward the origin of the broadcast signal. My signals originate from 2 broadcast towers that are about 15 degrees apart. I never have to rotate the antenna to receive a strong signal for all available broadcast channels."
39,5,Very good product with good clarity and vibrant sound.
40,5,Perfect for my application. Thanks!
41,5,So far so good:)  what can I say - it's  a strip outlet and it works
42,5,Perfect and very very sturdy! Very proud of myself for guessing this right.
43,5,Excellent product
44,2,"I received this adapter today. My three-pronged laptop plug fits perfectly. It can be inserted fully into the adapter and fits snugly. However, I cannot get any two-pronged plug into the top of this adapter. I tried to insert the plug for a lamp, my cell phone and my kindle. Not one can go all the way into this adapter. They all can only be inserted halfway into the adapter and are very loose. I am leaving for London in two days so I don't have the time to return this for a replacement. What a disappointment after all the great reviews. I am not a happy camper."
45,5,"I love it. I ordered one, but was defective and received a new one which worked. I love that it has a built in mic."
46,5,"This is a great base for your HEOS speakers (you must have a HEOS speaker to use this).  It helps to protect the system from water, adds bluetooth capability, adds portability and battery power.  Now you can take a speaker with you or use outdoors.<br /><br />The base is easy to put on and take off.  It is also very easy to use for streaming music.<br /><br />The HEOS system just keeps getting better.  Enjoy!"
47,5,works as it should.
48,3,"The ear pieces are quite large, returned."
49,1,not good. disappointed.
50,4,Works great
51,4,these worked great. Supply of mounting bolts not so great. None would fit my Vizio sound bar. Good thing I always keep the extra bolts and nuts from other things I buy. Oh and when it's all mounted and ready to be plugged back in the top part of the brackets blocks the plugs on the soundbar making it a little tight when plugging in wires. Other than that I'm happy and it looks really nice with the soundbar off the tv stand.
52,5,Exactly what I needed for the Omron unit.
53,5,perfect
54,5,"My brother and I paired this subwoofer with JBL ES90BK's floorstanding speakers, and the JBL ES25CBK center channel. Our surrounds are old vintage speakers that we kept for the look because they can still do their job on the sound. This is all tied to a Onkyo TX-NR626 receiver. This subwoofer is more than what you need in the best way. The bass can overpower our setup even when we are completely cranked. That is to say that you will never lack bass if you want bass. Once you dial the levels in this subwoofer really adds to any movie or music you want to throw at it. Fantastic addition, great look, phenomenal sound. This is the item furthest from being a limiting factor on our setup."
55,2,Low grade product. Don't fit with bose never recommand to purchase.
56,5,This was such a fabulous surprise how great it is! Exactly what I needed. I know it's old school but I still like making and playing my own CDs. It came here in perfect condition. Wonderful!!!!!
57,5,I was very pleased w/ this mount. Very easy to install.
58,5,"So far , I have not had any problems. It sounds great .I give it a 5 star rating ."
59,1,"It's a lie, this control does not fit to replace the remote control of AH59-01778V"
60,5,"I was more than happy with these headphones.  I've owned good quality headphones that were too heavy and cheap ones that had no lastabilty at all.  The sound, ease and comfort of these is wonderful.  Buy them!"
61,5,Delivered quickly as discribed
62,1,the product simply did not work!
63,4,"This is a very attractive battery powered speaker and it works quite well.  The speaker is not capable of producing low bass notes to any degree of significance and has the typical mid-range sound you would expect for its size. The Bluetooth connection was very straightforward. It paired automatically and I didn't even have to go through the procedure outlined in the instructions. When a phone call came in, it became a speakerphone in the same manner a Bluetooth earpiece operates.  And when the call ended, it resumed playing music from the cell phone.  Everything has operated perfectly so far.<br /><br />There are a couple of things that I think should have been built differently. On the bottom is a routine mini charger port like the one on your late model cell phone and a mini-plug for audio input along with a reset button requiring a pin to activate it. To charge the battery, you must turn the speaker on its side during charging.  And to play music directly from a MP3 player, you have to do the same thing.  I think they should not have put the receptacles on the bottom.  Side location toward the bottom would have provided so much better access.  While playing directly from a MP3 player, it would be nice to stand the speaker up, but you can't do that because of the audio connection location.  And same thing for charging. It would be nice to be able to listen to music or a phone call with the speaker standing up as it is intended. It should not cost any extra to relocate these two connectors. The cosmetic appearance would still be good since the connectors are so small.<br /><br />I charged this speaker overnight about a week ago. The battery is still charged. I haven't tried to test how long it will keep a charge, but it's plenty good from my limited experience.  It's really nice to have a wireless speakerphone without needing a power cord.  For sure, the sound is much better than what I get from the speakerphone on my cell phone.  You need to keep a little distance between the microphone on your cell phone and this rechargeable speaker during a phone call or you may get some self sustaining squealing microphonic feedback similar to a stage microphone and speaker system. Usually even a short distance is sufficient.<br /><br />Overall, this is a very nice battery powered wireless speaker and is quite attractive.  It has a very well built appearance and with reasonable care, it should last a very long time.  The battery life will vary greatly depending upon the volume and type of music that is being played. Heavy metal has a broad sound spectrum compared to an easy listening Mozart piano concerto. So set your expectations accordingly. Distortion at loud volume was quite apparent, but when backed off to a pleasant level, I didn't notice any distortion.<br /><br />The price is reasonable considering the rechargeable battery and wireless Bluetooth capability.  If you are in the market for something like this, I think this should be seriously considered. The reason I took off a star was because I don't like the location of the charger port and audio input connector.e between the microphone on your cell phone and this rechargeable speaker during a phone call or you may get some self sustaining squealing microphonic feedback similar to a stage microphone and speaker system. Usually even a short distance is sufficient.<br /><br />Overall, this is a very nice battery powered wireless speaker and is quite attractive.  It has a very well built appearance and with reasonable care, it should last a very long time.  The battery life will vary greatly depending upon the volume and type of music that is being played. Heavy metal has a broad sound spectrum compared to an easy listening Mozart piano concerto. So set your expectations accordingly. Distortion at loud volume was quite apparent, but when backed off to a pleasant level, I didn't notice any distortion.<br /><br />The price is reasonable considering the rechargeable battery and wireless Bluetooth capability.  If you are in the market for something like this, I think this should be seriously considered. The reason I took off a star was because I don't like the location of the charger port and audio input connector."
64,5,Thanks for the inventor. Good stuff!
65,5,very nice mount
66,5,Works great fast spipping
67,4,"Does what it's supposed to do, but not quite as loud as running music straight from the Blu-ray player."
68,4,These are very comfortable...so long as you never lose the rubber nubs. without that little rubber piece you're in for some painful listening.
69,5,Love the sound and comfort of these earbuds.
70,4,OK
71,5,Excelente
72,5,Product as described. Thank you.
73,5,"For the price, this cannot be beaten, I ended up buying two and find them to be working much better than anything else I have tried in the past."
74,5,Good product.  Good price.
75,5,"Works as expected, saves on cable."
76,5,nice product.  priced fairly.  arrived within the expected timeframe.  will do business with them again
77,5,This little MP3 player works great..! The battery lasts almost my whole eight hour shift of working in the noisy garage at work.  I love it.
78,5,"Solid, sturdy case, although a bit clunky. Fits my Sennheiser HD 598 perfectly with ample room left over for accessories."
79,5,This wireless set is not tied to any particular brand of home theater receivers unlike many other systems. It does what it is supposed to: deliver clean sound to my rear speakers. I have had this for over a week and love it.
80,5,Easy to install and works well.
81,2,"The primary function of headphones is good sound quality, right? Well with these, the price leads you to believe it'll be phenomenal, but it isn't, it's mediocre at best. The volume as well was good.. but everything lacked that.. oomf you get with ear buds, you know?"
82,4,Works just as described. Use it with a GPS unit and my phone charger and both charge as expected...
83,5,Pretty cool
84,5,"I have been using my earbuds for about two weeks now, and very happy with them.<br /> Connecting them to my S4 was quick and easy, and the sound quality is great!<br /> They fit snugly in your ear, I've use them will running on a treadmill and I had no issues with them staying in.<br /> I highly recommend them, great product at an excellent price!!"
85,5,Works better than expected
86,1,Not sure if it was the Sennheiser or  my TV. Either way I couldn't get it to work ! I'll be returning them  my next opertunity
87,5,Item is as listed.  good price. Quickly shipped.
88,5,"Update - *This survived a 6ft fall onto concrete*  It landed on the corner.  The plastic is not even that messed up.  Great build quality.  Everything still feels just as solid as before the fall. I think this is going to last the test of time.  The sound quality on  this is excellent.  I'm usually quite a bit picky with sound, but for its size this speakers has impressed me.  I have to say I was very surprised that this speaker sounds better outdoors than in a small room.  The rubber feet on this are very grippy.  It gets plenty loud. The sound is a bit directional.  But I feel like that is a plus so you can listen a louder while being less likely to annoy people around you. The speaker feels very solid.  It does not feel cheap. As long as you aren't throwing it around I think it will last a long time.  I have not used it long enough to say much on the battery life, but one of the main reasons I purchased this is when the time comes and the battery does wear out as any rechargeable will.  It can be removed and replaced with a higher capacity one to boot.  There are many how to's videos if you are curious how its done. Being that replacing battery's is much cheaper than replacing the speaker this should be a good long term speaker."
89,1,Sound is terrible.
90,3,lamp was okay but housing was wrong - had to take it out and put lamp in old housing
91,5,Great headset best I have had.  The service was great as I am a Prime member have been for many years.
92,5,I like the product
93,1,Wasn't what I needed
94,1,"Shortly after buying one side of earbud wouldn't play music, as well as playing through speakers when plugged in. Very bad do not buy. My 1$ earphones work better"
95,5,"Amazing headphones, especially given the portability and price. Sound is similar to Senn 558, and not very far off from from other fancy and more expensive headphones headphones - judging with my unqualified ears, while listening to CD rips/ALAC from FiiOx1. I don't get the feeling I am loosing a whole lot on sound quality when I am on the go.<br /><br />Very sturdy and clever folding mechanism. While these headphones are open, I used them in the library at low to moderate volume without complaints and criminal looks- when I put them down with the music still running, I had a hard time picking up any noise."
96,4,"This amp will be delivered to me tomorrow.  I plan to use it as an power amp only, paired to my Parasound pre amp.  Based on my seating position while  listening, I need the &#34;balance&#34; control  feature found on my pre amp, which none of the integrated amps offer.  For some reason, my classical radio station seem to have more energy directed to the left side as far as stereo is concerned (just hear the left speaker so as to sound like a mono recording) so I need to be able to make the right speaker louder to compensate for this effect.  I do have a solid state power amp which allows me to do this but I prefer the sound of tubes. I had to give it a star rating before I was able to post so I'm giving it a 4 star rating"
97,1,"It came before the day it suppose to, but it is really bad.... bought it for my hubby and to find out , one side works and one side don't. It is sadly really bad. Beware before buying."
98,5,"Best batteries i ever use,If loooking for the best,here they are"
99,1,The cushion on the headphones came right off the day we got it and there is no way we can get them back on.
100,5,Love it.  It is very fast to connect and gives me everything I needed.
101,1,Junk! Do not buy this crap - just send me your money if you are going to waste it! LOL CD player died in the first day.
102,5,"5 years ago I kicked cable TV out of my life and have not looked back, with all the great streaming programs I had a great need for hdmi cables. Throughout the years I had my share of cheap cords that came broken, broke within the month or were comically short. Always having to awkwardly place my computer next to the tv crossing my fingers that it will not fall from the corner of a table or the small space next to the tv. The answer to my problems was this heavy duty HDMI cable great picture, I love the length and the cloth cable in my opinion keeps the cable from fraying easily.<br /><br />I received this product at a discount in exchange for my unbiased review."
103,2,only received three channels. not worth the money.
104,5,Needed a flat head cable extension for a lamp and this works just fine for that purpose.
105,5,"As advertised, KOSS brand is a trusted brand. I really enjoy their headphones."
106,2,The moment I put these on my BlueBud X headphones and into my ear - the sound and fit seemed very good but they tore upon my taking them out. Hadn't had them more than a day or two when it happened.
107,5,Arrived on time and is just as described.  Much handier than carrying another cord.
